[W&B] Child process started for job: coil2000_insurance_policies_embed-only_xgboost in group session-training-1
Loading archive 'archives/coil2000_insurance_policies.npz' and initializing pipeline for target: XGBOOST...
Execution Mode: EMBED-ONLY
Session Output Target: outputs/training-1/
Task Type: BINARY
TabPFN Baselines Loaded - Primary: 0.2276 | Secondary: 0.9405
PCA reduced text embeddings to 57 components.
Final training matrix shape assembled for EMBED-ONLY: (7857, 57)

Running 26-Trial Optuna Study for XGBOOST (EMBED-ONLY)...
A new study created in RDB with name: 20260624_125334_coil2000_insurance_policies_embed-only_xgboost
Trial 0 finished with value: 0.28600095646897206 and parameters: {}. Best is trial 0 with value: 0.28600095646897206.
Trial 1 finished with value: 0.254856648956858 and parameters: {'learning_rate': 0.015355286838886862, 'max_depth': 10, 'min_child_weight': 0.5100627805979911, 'subsample': 0.8394633936788146, 'colsample_bylevel': 0.6624074561769746, 'colsample_bynode': 0.662397808134481, 'reg_alpha': 0.29051225247978046, 'reg_lambda': 4.330894111260099, 'grow_policy': 'lossguide', 'max_cat_to_onehot': 8, 'max_leaves': 884}. Best is trial 1 with value: 0.254856648956858.
Trial 2 finished with value: 0.2540691923927523 and parameters: {'learning_rate': 0.060534484680010825, 'max_depth': 4, 'min_child_weight': 0.004705059281907645, 'subsample': 0.6733618039413735, 'colsample_bylevel': 0.7216968971838151, 'colsample_bynode': 0.8099025726528951, 'reg_alpha': 2.1597818987087147, 'reg_lambda': 1.4562165780761898, 'grow_policy': 'depthwise', 'max_cat_to_onehot': 16, 'max_leaves': 45}. Best is trial 2 with value: 0.2540691923927523.
Trial 3 finished with value: 0.25833396030793154 and parameters: {'learning_rate': 0.019603369861210685, 'max_depth': 8, 'min_child_weight': 0.005477562363971304, 'subsample': 0.8056937753654446, 'colsample_bylevel': 0.836965827544817, 'colsample_bynode': 0.6185801650879991, 'reg_alpha': 3.037763505022002, 'reg_lambda': 0.8527035660240889, 'grow_policy': 'lossguide', 'max_cat_to_onehot': 92, 'max_leaves': 399}. Best is trial 2 with value: 0.2540691923927523.
Trial 4 finished with value: 0.24946550800979683 and parameters: {'learning_rate': 0.012453219846912198, 'max_depth': 4, 'min_child_weight': 0.33959199243313637, 'subsample': 0.7760609974958406, 'colsample_bylevel': 0.6488152939379115, 'colsample_bynode': 0.798070764044508, 'reg_alpha': 0.17203916672398045, 'reg_lambda': 4.546611078353703, 'grow_policy': 'lossguide', 'max_cat_to_onehot': 17, 'max_leaves': 97}. Best is trial 4 with value: 0.24946550800979683.
Trial 5 finished with value: 0.25287234643777534 and parameters: {'learning_rate': 0.025719142025384646, 'max_depth': 4, 'min_child_weight': 3.8589082671053854, 'subsample': 0.9100531293444458, 'colsample_bylevel': 0.9757995766256756, 'colsample_bynode': 0.9579309401710595, 'reg_alpha': 2.989540104057545, 'reg_lambda': 4.609378987692081, 'grow_policy': 'lossguide', 'max_cat_to_onehot': 8, 'max_leaves': 37}. Best is trial 4 with value: 0.24946550800979683.
Trial 6 finished with value: 0.2504142035316148 and parameters: {'learning_rate': 0.016019568611465234, 'max_depth': 5, 'min_child_weight': 1.1627201204016835, 'subsample': 0.7427013306774357, 'colsample_bylevel': 0.7123738038749523, 'colsample_bynode': 0.8170784332632994, 'reg_alpha': 0.7047070324513158, 'reg_lambda': 4.011004684072123, 'grow_policy': 'lossguide', 'max_cat_to_onehot': 56, 'max_leaves': 20}. Best is trial 4 with value: 0.24946550800979683.
Trial 7 finished with value: 0.2537251191805454 and parameters: {'learning_rate': 0.0050834018700114374, 'max_depth': 9, 'min_child_weight': 0.4117599592262879, 'subsample': 0.8916028672163949, 'colsample_bylevel': 0.9085081386743783, 'colsample_bynode': 0.6296178606936361, 'reg_alpha': 1.7923927961485087, 'reg_lambda': 0.5794337107196961, 'grow_policy': 'depthwise', 'max_cat_to_onehot': 18, 'max_leaves': 10}. Best is trial 4 with value: 0.24946550800979683.
Trial 8 finished with value: 0.2573573764862166 and parameters: {'learning_rate': 0.012693089228250284, 'max_depth': 5, 'min_child_weight': 0.49979438035802604, 'subsample': 0.8550229885420852, 'colsample_bylevel': 0.9548850970305306, 'colsample_bynode': 0.7888859700647797, 'reg_alpha': 0.5980592702669147, 'reg_lambda': 3.566252611636253, 'grow_policy': 'depthwise', 'max_cat_to_onehot': 55, 'max_leaves': 85}. Best is trial 4 with value: 0.24946550800979683.
Trial 9 finished with value: 0.25355855823711915 and parameters: {'learning_rate': 0.02393652463662192, 'max_depth': 6, 'min_child_weight': 0.0012417226051008223, 'subsample': 0.6431565707973218, 'colsample_bylevel': 0.6125716742746937, 'colsample_bynode': 0.8545641645055122, 'reg_alpha': 1.5718484697835258, 'reg_lambda': 2.542902598754398, 'grow_policy': 'depthwise', 'max_cat_to_onehot': 22, 'max_leaves': 308}. Best is trial 4 with value: 0.24946550800979683.
Trial 10 finished with value: 0.26776110374960194 and parameters: {'learning_rate': 0.08641685654424158, 'max_depth': 7, 'min_child_weight': 0.05330630380208628, 'subsample': 0.9729161367647149, 'colsample_bylevel': 0.8067426612208689, 'colsample_bynode': 0.9630659181130071, 'reg_alpha': 4.7988577526525065, 'reg_lambda': 2.5876151166352477, 'grow_policy': 'lossguide', 'max_cat_to_onehot': 31, 'max_leaves': 137}. Best is trial 4 with value: 0.24946550800979683.
Trial 11 finished with value: 0.24813887624854458 and parameters: {'learning_rate': 0.008236597407822864, 'max_depth': 5, 'min_child_weight': 4.359105583337639, 'subsample': 0.742869807831149, 'colsample_bylevel': 0.7273145000499233, 'colsample_bynode': 0.7708449222533328, 'reg_alpha': 0.034142440330290236, 'reg_lambda': 3.6785387663492077, 'grow_policy': 'lossguide', 'max_cat_to_onehot': 45, 'max_leaves': 9}. Best is trial 11 with value: 0.24813887624854458.
Trial 12 finished with value: 0.25202176294926915 and parameters: {'learning_rate': 0.006517848044415345, 'max_depth': 5, 'min_child_weight': 0.06829067848735262, 'subsample': 0.7548944548876555, 'colsample_bylevel': 0.7551457524243327, 'colsample_bynode': 0.7336320081207262, 'reg_alpha': 0.2101524301960419, 'reg_lambda': 4.971418225794803, 'grow_policy': 'lossguide', 'max_cat_to_onehot': 35, 'max_leaves': 9}. Best is trial 11 with value: 0.24813887624854458.
Trial 13 finished with value: 0.25116001595155235 and parameters: {'learning_rate': 0.008219018821177706, 'max_depth': 4, 'min_child_weight': 4.94518851860614, 'subsample': 0.7231297516673613, 'colsample_bylevel': 0.6099335813069354, 'colsample_bynode': 0.7233933640208137, 'reg_alpha': 0.008472600268174982, 'reg_lambda': 3.233876512812538, 'grow_policy': 'lossguide', 'max_cat_to_onehot': 14, 'max_leaves': 134}. Best is trial 11 with value: 0.24813887624854458.
Trial 14 finished with value: 0.25000151034301954 and parameters: {'learning_rate': 0.008846808792590102, 'max_depth': 6, 'min_child_weight': 0.08309678117321814, 'subsample': 0.6047337600210452, 'colsample_bylevel': 0.6742954100578371, 'colsample_bynode': 0.8909568783600397, 'reg_alpha': 1.0734176105029274, 'reg_lambda': 3.133512782464091, 'grow_policy': 'lossguide', 'max_cat_to_onehot': 95, 'max_leaves': 21}. Best is trial 11 with value: 0.24813887624854458.
Trial 15 finished with value: 0.2513035202536287 and parameters: {'learning_rate': 0.033957652539039894, 'max_depth': 4, 'min_child_weight': 1.237679687034366, 'subsample': 0.7911302960155628, 'colsample_bylevel': 0.8064114554738083, 'colsample_bynode': 0.7326539706064991, 'reg_alpha': 1.01595432264829, 'reg_lambda': 3.9202738463705535, 'grow_policy': 'lossguide', 'max_cat_to_onehot': 47, 'max_leaves': 62}. Best is trial 11 with value: 0.24813887624854458.
Trial 16 finished with value: 0.24995918493191216 and parameters: {'learning_rate': 0.011355002395558908, 'max_depth': 5, 'min_child_weight': 0.18079974190150352, 'subsample': 0.6997108097658562, 'colsample_bylevel': 0.657513942523747, 'colsample_bynode': 0.9127465030868789, 'reg_alpha': 1.2732356785204495, 'reg_lambda': 2.2928230774281415, 'grow_policy': 'lossguide', 'max_cat_to_onehot': 12, 'max_leaves': 18}. Best is trial 11 with value: 0.24813887624854458.
Trial 17 finished with value: 0.2516235791702994 and parameters: {'learning_rate': 0.008957853685580532, 'max_depth': 6, 'min_child_weight': 1.7077577894133231, 'subsample': 0.7945101352497977, 'colsample_bylevel': 0.7616287146723626, 'colsample_bynode': 0.771611160540024, 'reg_alpha': 0.060749223339732095, 'reg_lambda': 4.956386852998385, 'grow_policy': 'lossguide', 'max_cat_to_onehot': 28, 'max_leaves': 276}. Best is trial 11 with value: 0.24813887624854458.
Trial 18 finished with value: 0.2508492143586829 and parameters: {'learning_rate': 0.03545623798872137, 'max_depth': 4, 'min_child_weight': 0.021193013199747167, 'subsample': 0.764597800433642, 'colsample_bylevel': 0.7041791051705739, 'colsample_bynode': 0.6752970934926894, 'reg_alpha': 2.3005330083152393, 'reg_lambda': 3.6095830814087755, 'grow_policy': 'lossguide', 'max_cat_to_onehot': 41, 'max_leaves': 994}. Best is trial 11 with value: 0.24813887624854458.
Trial 19 finished with value: 0.251082028490507 and parameters: {'learning_rate': 0.005009749281998703, 'max_depth': 5, 'min_child_weight': 0.16160334436765317, 'subsample': 0.6940285933808718, 'colsample_bylevel': 0.8801151332999179, 'colsample_bynode': 0.8558525698737702, 'reg_alpha': 0.719871350674822, 'reg_lambda': 1.9083088930479097, 'grow_policy': 'depthwise', 'max_cat_to_onehot': 70, 'max_leaves': 164}. Best is trial 11 with value: 0.24813887624854458.
Trial 20 finished with value: 0.2548845829144033 and parameters: {'learning_rate': 0.011050284619449777, 'max_depth': 7, 'min_child_weight': 2.055255664566164, 'subsample': 0.9805086233038107, 'colsample_bylevel': 0.7705000524185361, 'colsample_bynode': 0.7593351932991563, 'reg_alpha': 4.851901986528535, 'reg_lambda': 4.338505804973737, 'grow_policy': 'lossguide', 'max_cat_to_onehot': 24, 'max_leaves': 33}. Best is trial 11 with value: 0.24813887624854458.
Trial 21 finished with value: 0.25056454915689597 and parameters: {'learning_rate': 0.011628751147826999, 'max_depth': 5, 'min_child_weight': 0.19305476732737278, 'subsample': 0.6680177226438371, 'colsample_bylevel': 0.6526858699640904, 'colsample_bynode': 0.9148404221671845, 'reg_alpha': 1.362428512380954, 'reg_lambda': 2.4208879137425177, 'grow_policy': 'lossguide', 'max_cat_to_onehot': 12, 'max_leaves': 15}. Best is trial 11 with value: 0.24813887624854458.
Trial 22 finished with value: 0.2522296358838956 and parameters: {'learning_rate': 0.00701106047221921, 'max_depth': 5, 'min_child_weight': 0.01652535373239224, 'subsample': 0.7119281268996533, 'colsample_bylevel': 0.64126930266468, 'colsample_bynode': 0.8609028763038048, 'reg_alpha': 1.1594857722515721, 'reg_lambda': 1.4123279160141056, 'grow_policy': 'lossguide', 'max_cat_to_onehot': 11, 'max_leaves': 8}. Best is trial 11 with value: 0.24813887624854458.
Trial 23 finished with value: 0.24930731676436768 and parameters: {'learning_rate': 0.015019375213633224, 'max_depth': 4, 'min_child_weight': 0.233970755173276, 'subsample': 0.6434373753987925, 'colsample_bylevel': 0.7005442296100025, 'colsample_bynode': 0.9186895811626957, 'reg_alpha': 0.5492451573738967, 'reg_lambda': 3.1017896462383536, 'grow_policy': 'lossguide', 'max_cat_to_onehot': 10, 'max_leaves': 15}. Best is trial 11 with value: 0.24813887624854458.
Trial 24 finished with value: 0.25136870258599675 and parameters: {'learning_rate': 0.016675123030375983, 'max_depth': 4, 'min_child_weight': 0.7614108812951667, 'subsample': 0.600235390892198, 'colsample_bylevel': 0.6967854561629327, 'colsample_bynode': 0.9847801718201128, 'reg_alpha': 0.5714399551842798, 'reg_lambda': 3.047506401690456, 'grow_policy': 'lossguide', 'max_cat_to_onehot': 10, 'max_leaves': 14}. Best is trial 11 with value: 0.24813887624854458.
Trial 25 finished with value: 0.2516045761229164 and parameters: {'learning_rate': 0.019870427110634487, 'max_depth': 4, 'min_child_weight': 0.2917584485036008, 'subsample': 0.6331678308224865, 'colsample_bylevel': 0.740307522244937, 'colsample_bynode': 0.6899487595422809, 'reg_alpha': 0.601861295927361, 'reg_lambda': 3.8267020418947215, 'grow_policy': 'lossguide', 'max_cat_to_onehot': 20, 'max_leaves': 27}. Best is trial 11 with value: 0.24813887624854458.
Optuna Search Completed in: 254.50 seconds

Training final model on optimized parameter setup...

[XGBOOST FINALIZED METRICS]
Optimal Trees:         680
1-AUROC:             0.2492 (Delta to TabPFN: +0.0216)
Accuracy:             0.9399 (Delta to TabPFN: -0.0005)
Final Train Time:      0.84 seconds (0.1065s per 1K)
Final Infer Time:      0.00 seconds (0.0019s per 1K)

--- XGBOOST Feature Importance (Raw vs. Scaled Share) ---
Feature | Raw gain | Share
pca_embed_0 | 7021.95 | 12.57%
pca_embed_3 | 4620.32 | 8.27%
pca_embed_1 | 2751.99 | 4.93%
pca_embed_13 | 2661.58 | 4.77%
pca_embed_7 | 2510.36 | 4.50%
pca_embed_6 | 2311.74 | 4.14%
pca_embed_10 | 1559.47 | 2.79%
pca_embed_45 | 1486.96 | 2.66%
pca_embed_9 | 1479.96 | 2.65%
pca_embed_29 | 1405.74 | 2.52%
pca_embed_36 | 1168.36 | 2.09%
pca_embed_40 | 1133.00 | 2.03%
pca_embed_47 | 1048.08 | 1.88%
pca_embed_56 | 1039.32 | 1.86%
pca_embed_31 | 1029.54 | 1.84%
pca_embed_4 | 1021.99 | 1.83%
pca_embed_23 | 1014.73 | 1.82%
pca_embed_2 | 991.32 | 1.78%
pca_embed_53 | 965.32 | 1.73%
pca_embed_19 | 964.17 | 1.73%
pca_embed_54 | 830.00 | 1.49%
pca_embed_49 | 810.01 | 1.45%
pca_embed_33 | 745.94 | 1.34%
pca_embed_21 | 731.21 | 1.31%
pca_embed_15 | 692.17 | 1.24%
pca_embed_11 | 691.14 | 1.24%
pca_embed_14 | 679.49 | 1.22%
pca_embed_12 | 669.51 | 1.20%
pca_embed_30 | 633.44 | 1.13%
pca_embed_42 | 618.82 | 1.11%
pca_embed_17 | 599.22 | 1.07%
pca_embed_28 | 596.67 | 1.07%
pca_embed_26 | 553.32 | 0.99%
pca_embed_55 | 548.78 | 0.98%
pca_embed_25 | 539.08 | 0.97%
pca_embed_22 | 521.00 | 0.93%
pca_embed_34 | 514.76 | 0.92%
pca_embed_38 | 508.71 | 0.91%
pca_embed_32 | 499.87 | 0.90%
pca_embed_16 | 466.87 | 0.84%
pca_embed_41 | 438.98 | 0.79%
pca_embed_48 | 424.50 | 0.76%
pca_embed_43 | 403.87 | 0.72%
pca_embed_18 | 391.50 | 0.70%
pca_embed_39 | 389.79 | 0.70%
pca_embed_44 | 389.44 | 0.70%
pca_embed_8 | 351.75 | 0.63%
pca_embed_20 | 350.04 | 0.63%
pca_embed_50 | 281.25 | 0.50%
pca_embed_52 | 275.42 | 0.49%
pca_embed_35 | 271.67 | 0.49%
pca_embed_5 | 270.12 | 0.48%
pca_embed_37 | 265.03 | 0.47%
pca_embed_24 | 203.46 | 0.36%
pca_embed_27 | 196.13 | 0.35%
pca_embed_51 | 192.67 | 0.34%
pca_embed_46 | 115.82 | 0.21%

=====================================================================
METRIC TYPE                                  | VALUE / PROFILE
=====================================================================
Embedding Share                              | 100.00%
Raw Feature Share                            | 0.00%
---------------------------------------------------------------------
Active Text Embedding Density                | 100.00% (57/57)
Active Raw Tabular Feature Density           | 0.00% (0/0)
---------------------------------------------------------------------
Top-5 Concentration Ratio (CR5)              | 35.04% of total decision weight
Top-10 Concentration Ratio (CR10)            | 49.80% of total decision weight
=====================================================================

Total Pipeline Execution Time: 257.04 seconds

[SUCCESS] Permanent artifacts safely written to 'outputs/training-1/'
[W&B] Artifacts and localized metrics logged successfully for coil2000_insurance_policies_embed-only_xgboost
