[W&B] Child process started for job: concrete_compressive_strength_embed-only_xgboost in group session-training-3
Loading archive 'archives/concrete_compressive_strength.npz' and initializing pipeline for target: XGBOOST...
Execution Mode: EMBED-ONLY
Session Output Target: outputs/training-3/
Task Type: REGRESSION
TabPFN Baselines Loaded - Primary: 3.1552 | Secondary: 0.9640
PCA reduced text embeddings to 78 components.
Final training matrix shape assembled for EMBED-ONLY: (824, 78)

Running 26-Trial Optuna Study for XGBOOST (EMBED-ONLY)...
A new study created in RDB with name: 20260624_155436_concrete_compressive_strength_embed-only_xgboost
Trial 0 finished with value: 4.4690353920213095 and parameters: {}. Best is trial 0 with value: 4.4690353920213095.
Trial 1 finished with value: 4.4249497843512 and parameters: {'learning_rate': 0.015355286838886862, 'max_depth': 10, 'min_child_weight': 0.5100627805979911, 'subsample': 0.8394633936788146, 'colsample_bylevel': 0.6624074561769746, 'colsample_bynode': 0.662397808134481, 'reg_alpha': 0.29051225247978046, 'reg_lambda': 4.330894111260099, 'grow_policy': 'lossguide', 'max_cat_to_onehot': 8, 'max_leaves': 884}. Best is trial 1 with value: 4.4249497843512.
Trial 2 finished with value: 4.512557755308682 and parameters: {'learning_rate': 0.060534484680010825, 'max_depth': 4, 'min_child_weight': 0.004705059281907645, 'subsample': 0.6733618039413735, 'colsample_bylevel': 0.7216968971838151, 'colsample_bynode': 0.8099025726528951, 'reg_alpha': 2.1597818987087147, 'reg_lambda': 1.4562165780761898, 'grow_policy': 'depthwise', 'max_cat_to_onehot': 16, 'max_leaves': 45}. Best is trial 1 with value: 4.4249497843512.
Trial 3 finished with value: 4.338793815629096 and parameters: {'learning_rate': 0.019603369861210685, 'max_depth': 8, 'min_child_weight': 0.005477562363971304, 'subsample': 0.8056937753654446, 'colsample_bylevel': 0.836965827544817, 'colsample_bynode': 0.6185801650879991, 'reg_alpha': 3.037763505022002, 'reg_lambda': 0.8527035660240889, 'grow_policy': 'lossguide', 'max_cat_to_onehot': 92, 'max_leaves': 399}. Best is trial 3 with value: 4.338793815629096.
Trial 4 finished with value: 4.37257406811969 and parameters: {'learning_rate': 0.012453219846912198, 'max_depth': 4, 'min_child_weight': 0.33959199243313637, 'subsample': 0.7760609974958406, 'colsample_bylevel': 0.6488152939379115, 'colsample_bynode': 0.798070764044508, 'reg_alpha': 0.17203916672398045, 'reg_lambda': 4.546611078353703, 'grow_policy': 'lossguide', 'max_cat_to_onehot': 17, 'max_leaves': 97}. Best is trial 3 with value: 4.338793815629096.
Trial 5 finished with value: 4.317739580294916 and parameters: {'learning_rate': 0.025719142025384646, 'max_depth': 4, 'min_child_weight': 3.8589082671053854, 'subsample': 0.9100531293444458, 'colsample_bylevel': 0.9757995766256756, 'colsample_bynode': 0.9579309401710595, 'reg_alpha': 2.989540104057545, 'reg_lambda': 4.609378987692081, 'grow_policy': 'lossguide', 'max_cat_to_onehot': 8, 'max_leaves': 37}. Best is trial 5 with value: 4.317739580294916.
Trial 6 finished with value: 4.335744190839981 and parameters: {'learning_rate': 0.016019568611465234, 'max_depth': 5, 'min_child_weight': 1.1627201204016835, 'subsample': 0.7427013306774357, 'colsample_bylevel': 0.7123738038749523, 'colsample_bynode': 0.8170784332632994, 'reg_alpha': 0.7047070324513158, 'reg_lambda': 4.011004684072123, 'grow_policy': 'lossguide', 'max_cat_to_onehot': 56, 'max_leaves': 20}. Best is trial 5 with value: 4.317739580294916.
Trial 7 finished with value: 4.392069400396122 and parameters: {'learning_rate': 0.0050834018700114374, 'max_depth': 9, 'min_child_weight': 0.4117599592262879, 'subsample': 0.8916028672163949, 'colsample_bylevel': 0.9085081386743783, 'colsample_bynode': 0.6296178606936361, 'reg_alpha': 1.7923927961485087, 'reg_lambda': 0.5794337107196961, 'grow_policy': 'depthwise', 'max_cat_to_onehot': 18, 'max_leaves': 10}. Best is trial 5 with value: 4.317739580294916.
Trial 8 finished with value: 4.295191903295068 and parameters: {'learning_rate': 0.012693089228250284, 'max_depth': 5, 'min_child_weight': 0.49979438035802604, 'subsample': 0.8550229885420852, 'colsample_bylevel': 0.9548850970305306, 'colsample_bynode': 0.7888859700647797, 'reg_alpha': 0.5980592702669147, 'reg_lambda': 3.566252611636253, 'grow_policy': 'depthwise', 'max_cat_to_onehot': 55, 'max_leaves': 85}. Best is trial 8 with value: 4.295191903295068.
Trial 9 finished with value: 4.3605118807277705 and parameters: {'learning_rate': 0.02393652463662192, 'max_depth': 6, 'min_child_weight': 0.0012417226051008223, 'subsample': 0.6431565707973218, 'colsample_bylevel': 0.6125716742746937, 'colsample_bynode': 0.8545641645055122, 'reg_alpha': 1.5718484697835258, 'reg_lambda': 2.542902598754398, 'grow_policy': 'depthwise', 'max_cat_to_onehot': 22, 'max_leaves': 308}. Best is trial 8 with value: 4.295191903295068.
Trial 10 finished with value: 4.370559785966204 and parameters: {'learning_rate': 0.08641869155550744, 'max_depth': 7, 'min_child_weight': 0.05520191203895588, 'subsample': 0.9729161367647149, 'colsample_bylevel': 0.8197534695371591, 'colsample_bynode': 0.7202259292197385, 'reg_alpha': 4.7988577526525065, 'reg_lambda': 2.938272016159444, 'grow_policy': 'depthwise', 'max_cat_to_onehot': 40, 'max_leaves': 137}. Best is trial 8 with value: 4.295191903295068.
Trial 11 finished with value: 4.345640082696605 and parameters: {'learning_rate': 0.03492860276543721, 'max_depth': 5, 'min_child_weight': 4.8053033036668475, 'subsample': 0.929049245729398, 'colsample_bylevel': 0.9847867967774614, 'colsample_bynode': 0.9897154483178633, 'reg_alpha': 3.796745916038369, 'reg_lambda': 3.401784297061922, 'grow_policy': 'depthwise', 'max_cat_to_onehot': 10, 'max_leaves': 41}. Best is trial 8 with value: 4.295191903295068.
Trial 12 finished with value: 4.306589991228703 and parameters: {'learning_rate': 0.007758119926434361, 'max_depth': 5, 'min_child_weight': 4.562561034189502, 'subsample': 0.881811023830265, 'colsample_bylevel': 0.9979548057541356, 'colsample_bynode': 0.9984066126989741, 'reg_alpha': 2.9662524884224752, 'reg_lambda': 4.972706674202061, 'grow_policy': 'lossguide', 'max_cat_to_onehot': 35, 'max_leaves': 62}. Best is trial 8 with value: 4.295191903295068.
Trial 13 finished with value: 4.325936578371163 and parameters: {'learning_rate': 0.007891352116508358, 'max_depth': 5, 'min_child_weight': 0.08111039541916326, 'subsample': 0.8569406103460745, 'colsample_bylevel': 0.906702606839036, 'colsample_bynode': 0.9091201923395409, 'reg_alpha': 4.980085345107131, 'reg_lambda': 4.997042698365308, 'grow_policy': 'lossguide', 'max_cat_to_onehot': 36, 'max_leaves': 107}. Best is trial 8 with value: 4.295191903295068.
Trial 14 finished with value: 4.35704086738178 and parameters: {'learning_rate': 0.008948307671845351, 'max_depth': 6, 'min_child_weight': 1.6590135619732442, 'subsample': 0.9877079408194872, 'colsample_bylevel': 0.9246810535722221, 'colsample_bynode': 0.732520405161235, 'reg_alpha': 1.159598005410121, 'reg_lambda': 3.4860454645220273, 'grow_policy': 'depthwise', 'max_cat_to_onehot': 71, 'max_leaves': 217}. Best is trial 8 with value: 4.295191903295068.
Trial 15 finished with value: 4.322464301057401 and parameters: {'learning_rate': 0.005261882089119868, 'max_depth': 6, 'min_child_weight': 0.10158309221319928, 'subsample': 0.731194128587385, 'colsample_bylevel': 0.9901909773972487, 'colsample_bynode': 0.9083295173848401, 'reg_alpha': 2.537700737209059, 'reg_lambda': 1.792015584924231, 'grow_policy': 'lossguide', 'max_cat_to_onehot': 34, 'max_leaves': 67}. Best is trial 8 with value: 4.295191903295068.
Trial 16 finished with value: 4.324262391504073 and parameters: {'learning_rate': 0.009295700937772999, 'max_depth': 5, 'min_child_weight': 1.3314764406065493, 'subsample': 0.8509679306459871, 'colsample_bylevel': 0.8294757870022369, 'colsample_bynode': 0.7407528485172874, 'reg_alpha': 3.9865174654794657, 'reg_lambda': 3.9026770098508368, 'grow_policy': 'depthwise', 'max_cat_to_onehot': 52, 'max_leaves': 18}. Best is trial 8 with value: 4.295191903295068.
Trial 17 finished with value: 4.365334303039843 and parameters: {'learning_rate': 0.006709536632455191, 'max_depth': 7, 'min_child_weight': 0.1876462692020639, 'subsample': 0.9490164421938835, 'colsample_bylevel': 0.9409564187093861, 'colsample_bynode': 0.8917282041415695, 'reg_alpha': 1.006897968252322, 'reg_lambda': 2.361155879465451, 'grow_policy': 'depthwise', 'max_cat_to_onehot': 28, 'max_leaves': 182}. Best is trial 8 with value: 4.295191903295068.
Trial 18 finished with value: 4.333484777583386 and parameters: {'learning_rate': 0.011587105651977844, 'max_depth': 4, 'min_child_weight': 0.021193013199747167, 'subsample': 0.8863310309178694, 'colsample_bylevel': 0.86507060456165, 'colsample_bynode': 0.9749182192183783, 'reg_alpha': 3.968391153835875, 'reg_lambda': 3.425085600459459, 'grow_policy': 'lossguide', 'max_cat_to_onehot': 53, 'max_leaves': 67}. Best is trial 8 with value: 4.295191903295068.
Trial 19 finished with value: 4.356509643595068 and parameters: {'learning_rate': 0.03509566075305372, 'max_depth': 5, 'min_child_weight': 2.0596547387333204, 'subsample': 0.8073862028667474, 'colsample_bylevel': 0.9525903240562825, 'colsample_bynode': 0.6749587407035115, 'reg_alpha': 2.9183392035525113, 'reg_lambda': 0.08689028168849333, 'grow_policy': 'lossguide', 'max_cat_to_onehot': 87, 'max_leaves': 24}. Best is trial 8 with value: 4.295191903295068.
Trial 20 finished with value: 4.421709951911298 and parameters: {'learning_rate': 0.010671323394939715, 'max_depth': 6, 'min_child_weight': 0.7069793703566147, 'subsample': 0.705974792148965, 'colsample_bylevel': 0.8802489778678998, 'colsample_bynode': 0.7819429245553049, 'reg_alpha': 3.460511603205047, 'reg_lambda': 4.825394827539534, 'grow_policy': 'depthwise', 'max_cat_to_onehot': 27, 'max_leaves': 8}. Best is trial 8 with value: 4.295191903295068.
Trial 21 finished with value: 4.343307249059679 and parameters: {'learning_rate': 0.027570188003427445, 'max_depth': 4, 'min_child_weight': 4.832674113157089, 'subsample': 0.9043013275134434, 'colsample_bylevel': 0.9870420230541036, 'colsample_bynode': 0.9775957767889115, 'reg_alpha': 2.404800517527664, 'reg_lambda': 4.220746798806347, 'grow_policy': 'lossguide', 'max_cat_to_onehot': 11, 'max_leaves': 37}. Best is trial 8 with value: 4.295191903295068.
Trial 22 finished with value: 4.347110332425194 and parameters: {'learning_rate': 0.047722658966718914, 'max_depth': 4, 'min_child_weight': 2.958131309594378, 'subsample': 0.9278884634173611, 'colsample_bylevel': 0.954697529580446, 'colsample_bynode': 0.9414514254789631, 'reg_alpha': 4.435860666469466, 'reg_lambda': 4.620044259943123, 'grow_policy': 'lossguide', 'max_cat_to_onehot': 13, 'max_leaves': 69}. Best is trial 8 with value: 4.295191903295068.
Trial 23 finished with value: 4.2975423933315495 and parameters: {'learning_rate': 0.015310133394051236, 'max_depth': 5, 'min_child_weight': 0.9608154033296633, 'subsample': 0.8730362772995539, 'colsample_bylevel': 0.9958072812860449, 'colsample_bynode': 0.943711625310313, 'reg_alpha': 3.1786683048466324, 'reg_lambda': 3.727405988892058, 'grow_policy': 'lossguide', 'max_cat_to_onehot': 71, 'max_leaves': 28}. Best is trial 8 with value: 4.295191903295068.
Trial 24 finished with value: 4.291930555005707 and parameters: {'learning_rate': 0.016958438702394038, 'max_depth': 5, 'min_child_weight': 0.2116260846942943, 'subsample': 0.801265296893291, 'colsample_bylevel': 0.9952494035820109, 'colsample_bynode': 0.8653230657985537, 'reg_alpha': 1.8591876839188273, 'reg_lambda': 2.95283712086532, 'grow_policy': 'lossguide', 'max_cat_to_onehot': 65, 'max_leaves': 13}. Best is trial 24 with value: 4.291930555005707.
Trial 25 finished with value: 4.318070790621537 and parameters: {'learning_rate': 0.015918777577781346, 'max_depth': 5, 'min_child_weight': 0.21140371976327996, 'subsample': 0.799853493032687, 'colsample_bylevel': 0.9493591663451706, 'colsample_bynode': 0.8713806797916586, 'reg_alpha': 1.6460350736236606, 'reg_lambda': 2.9977472008195316, 'grow_policy': 'lossguide', 'max_cat_to_onehot': 71, 'max_leaves': 12}. Best is trial 24 with value: 4.291930555005707.
Optuna Search Completed in: 392.82 seconds

Training final model on optimized parameter setup...

[XGBOOST FINALIZED METRICS]
Optimal Trees:         434
RMSE:             3.5975 (Delta to TabPFN: +0.4423)
R2_Score:             0.9532 (Delta to TabPFN: -0.0108)
Final Train Time:      1.20 seconds (1.4565s per 1K)
Final Infer Time:      0.00 seconds (0.0060s per 1K)

--- XGBOOST Feature Importance (Raw vs. Scaled Share) ---
Feature | Raw gain | Share
pca_embed_0 | 3483963.25 | 63.48%
pca_embed_1 | 1011452.19 | 18.43%
pca_embed_2 | 354409.91 | 6.46%
pca_embed_4 | 190893.31 | 3.48%
pca_embed_3 | 139485.91 | 2.54%
pca_embed_6 | 26617.31 | 0.48%
pca_embed_12 | 17994.23 | 0.33%
pca_embed_38 | 16830.16 | 0.31%
pca_embed_5 | 14696.20 | 0.27%
pca_embed_15 | 13492.79 | 0.25%
pca_embed_63 | 9360.74 | 0.17%
pca_embed_61 | 7527.25 | 0.14%
pca_embed_36 | 6258.11 | 0.11%
pca_embed_66 | 5899.24 | 0.11%
pca_embed_31 | 5799.30 | 0.11%
pca_embed_52 | 5717.22 | 0.10%
pca_embed_34 | 5660.26 | 0.10%
pca_embed_68 | 5600.89 | 0.10%
pca_embed_55 | 5287.52 | 0.10%
pca_embed_11 | 5097.27 | 0.09%
pca_embed_62 | 5028.49 | 0.09%
pca_embed_65 | 4819.62 | 0.09%
pca_embed_33 | 4649.96 | 0.08%
pca_embed_7 | 4550.68 | 0.08%
pca_embed_64 | 4538.04 | 0.08%
pca_embed_40 | 4353.55 | 0.08%
pca_embed_10 | 4195.61 | 0.08%
pca_embed_48 | 4190.76 | 0.08%
pca_embed_69 | 4184.12 | 0.08%
pca_embed_42 | 4112.92 | 0.07%
pca_embed_25 | 4095.23 | 0.07%
pca_embed_57 | 4087.91 | 0.07%
pca_embed_20 | 3650.85 | 0.07%
pca_embed_72 | 3567.44 | 0.06%
pca_embed_43 | 3546.80 | 0.06%
pca_embed_16 | 3522.92 | 0.06%
pca_embed_70 | 3488.03 | 0.06%
pca_embed_13 | 3446.62 | 0.06%
pca_embed_51 | 3374.00 | 0.06%
pca_embed_8 | 3315.56 | 0.06%
pca_embed_30 | 3136.08 | 0.06%
pca_embed_73 | 3113.55 | 0.06%
pca_embed_54 | 3055.22 | 0.06%
pca_embed_59 | 3054.43 | 0.06%
pca_embed_56 | 2989.25 | 0.05%
pca_embed_35 | 2959.62 | 0.05%
pca_embed_28 | 2793.85 | 0.05%
pca_embed_17 | 2681.85 | 0.05%
pca_embed_21 | 2669.34 | 0.05%
pca_embed_22 | 2642.68 | 0.05%
pca_embed_71 | 2635.71 | 0.05%
pca_embed_9 | 2542.54 | 0.05%
pca_embed_27 | 2458.27 | 0.04%
pca_embed_24 | 2426.88 | 0.04%
pca_embed_49 | 2363.32 | 0.04%
pca_embed_50 | 2292.45 | 0.04%
pca_embed_53 | 2115.36 | 0.04%
pca_embed_41 | 2097.42 | 0.04%
pca_embed_45 | 2004.89 | 0.04%
pca_embed_32 | 1983.07 | 0.04%
pca_embed_58 | 1978.24 | 0.04%
pca_embed_75 | 1897.76 | 0.03%
pca_embed_60 | 1879.41 | 0.03%
pca_embed_18 | 1848.00 | 0.03%
pca_embed_37 | 1617.63 | 0.03%
pca_embed_74 | 1555.52 | 0.03%
pca_embed_39 | 1459.25 | 0.03%
pca_embed_46 | 1358.47 | 0.02%
pca_embed_44 | 1308.46 | 0.02%
pca_embed_29 | 1164.26 | 0.02%
pca_embed_14 | 1147.13 | 0.02%
pca_embed_76 | 1093.82 | 0.02%
pca_embed_47 | 1055.37 | 0.02%
pca_embed_26 | 1050.22 | 0.02%
pca_embed_23 | 965.11 | 0.02%
pca_embed_67 | 901.65 | 0.02%
pca_embed_19 | 849.45 | 0.02%
pca_embed_77 | 762.98 | 0.01%

=====================================================================
METRIC TYPE                                  | VALUE / PROFILE
=====================================================================
Embedding Share                              | 100.00%
Raw Feature Share                            | 0.00%
---------------------------------------------------------------------
Active Text Embedding Density                | 100.00% (78/78)
Active Raw Tabular Feature Density           | 0.00% (0/0)
---------------------------------------------------------------------
Top-5 Concentration Ratio (CR5)              | 94.38% of total decision weight
Top-10 Concentration Ratio (CR10)            | 96.01% of total decision weight
=====================================================================

Total Pipeline Execution Time: 395.74 seconds

[SUCCESS] Permanent artifacts safely written to 'outputs/training-3/'
[W&B] Artifacts and localized metrics logged successfully for concrete_compressive_strength_embed-only_xgboost
