[W&B] Child process started for job: heloc_embed-only_xgboost in group session-training-3
Loading archive 'archives/heloc.npz' and initializing pipeline for target: XGBOOST...
Execution Mode: EMBED-ONLY
Session Output Target: outputs/training-3/
Task Type: BINARY
TabPFN Baselines Loaded - Primary: 0.1908 | Secondary: 0.7357
PCA reduced text embeddings to 21 components.
Final training matrix shape assembled for EMBED-ONLY: (8367, 21)

Running 26-Trial Optuna Study for XGBOOST (EMBED-ONLY)...
A new study created in RDB with name: 20260625_013248_heloc_embed-only_xgboost
Trial 0 finished with value: 0.2534694017374064 and parameters: {}. Best is trial 0 with value: 0.2534694017374064.
Trial 1 finished with value: 0.23038144092146384 and parameters: {'learning_rate': 0.015355286838886862, 'max_depth': 10, 'min_child_weight': 0.5100627805979911, 'subsample': 0.8394633936788146, 'colsample_bylevel': 0.6624074561769746, 'colsample_bynode': 0.662397808134481, 'reg_alpha': 0.29051225247978046, 'reg_lambda': 4.330894111260099, 'grow_policy': 'lossguide', 'max_cat_to_onehot': 8, 'max_leaves': 884}. Best is trial 1 with value: 0.23038144092146384.
Trial 2 finished with value: 0.23701147839163905 and parameters: {'learning_rate': 0.060534484680010825, 'max_depth': 4, 'min_child_weight': 0.004705059281907645, 'subsample': 0.6733618039413735, 'colsample_bylevel': 0.7216968971838151, 'colsample_bynode': 0.8099025726528951, 'reg_alpha': 2.1597818987087147, 'reg_lambda': 1.4562165780761898, 'grow_policy': 'depthwise', 'max_cat_to_onehot': 16, 'max_leaves': 45}. Best is trial 1 with value: 0.23038144092146384.
Trial 3 finished with value: 0.23032920867358941 and parameters: {'learning_rate': 0.019603369861210685, 'max_depth': 8, 'min_child_weight': 0.005477562363971304, 'subsample': 0.8056937753654446, 'colsample_bylevel': 0.836965827544817, 'colsample_bynode': 0.6185801650879991, 'reg_alpha': 3.037763505022002, 'reg_lambda': 0.8527035660240889, 'grow_policy': 'lossguide', 'max_cat_to_onehot': 92, 'max_leaves': 399}. Best is trial 3 with value: 0.23032920867358941.
Trial 4 finished with value: 0.23582039478105998 and parameters: {'learning_rate': 0.012453219846912198, 'max_depth': 4, 'min_child_weight': 0.33959199243313637, 'subsample': 0.7760609974958406, 'colsample_bylevel': 0.6488152939379115, 'colsample_bynode': 0.798070764044508, 'reg_alpha': 0.17203916672398045, 'reg_lambda': 4.546611078353703, 'grow_policy': 'lossguide', 'max_cat_to_onehot': 17, 'max_leaves': 97}. Best is trial 3 with value: 0.23032920867358941.
Trial 5 finished with value: 0.2364306864771314 and parameters: {'learning_rate': 0.025719142025384646, 'max_depth': 4, 'min_child_weight': 3.8589082671053854, 'subsample': 0.9100531293444458, 'colsample_bylevel': 0.9757995766256756, 'colsample_bynode': 0.9579309401710595, 'reg_alpha': 2.989540104057545, 'reg_lambda': 4.609378987692081, 'grow_policy': 'lossguide', 'max_cat_to_onehot': 8, 'max_leaves': 37}. Best is trial 3 with value: 0.23032920867358941.
Trial 6 finished with value: 0.23333403694928934 and parameters: {'learning_rate': 0.016019568611465234, 'max_depth': 5, 'min_child_weight': 1.1627201204016835, 'subsample': 0.7427013306774357, 'colsample_bylevel': 0.7123738038749523, 'colsample_bynode': 0.8170784332632994, 'reg_alpha': 0.7047070324513158, 'reg_lambda': 4.011004684072123, 'grow_policy': 'lossguide', 'max_cat_to_onehot': 56, 'max_leaves': 20}. Best is trial 3 with value: 0.23032920867358941.
Trial 7 finished with value: 0.2489921434452398 and parameters: {'learning_rate': 0.0050834018700114374, 'max_depth': 9, 'min_child_weight': 0.4117599592262879, 'subsample': 0.8916028672163949, 'colsample_bylevel': 0.9085081386743783, 'colsample_bynode': 0.6296178606936361, 'reg_alpha': 1.7923927961485087, 'reg_lambda': 0.5794337107196961, 'grow_policy': 'depthwise', 'max_cat_to_onehot': 18, 'max_leaves': 10}. Best is trial 3 with value: 0.23032920867358941.
Trial 8 finished with value: 0.23414840835769735 and parameters: {'learning_rate': 0.012693089228250284, 'max_depth': 5, 'min_child_weight': 0.49979438035802604, 'subsample': 0.8550229885420852, 'colsample_bylevel': 0.9548850970305306, 'colsample_bynode': 0.7888859700647797, 'reg_alpha': 0.5980592702669147, 'reg_lambda': 3.566252611636253, 'grow_policy': 'depthwise', 'max_cat_to_onehot': 55, 'max_leaves': 85}. Best is trial 3 with value: 0.23032920867358941.
Trial 9 finished with value: 0.2325149061565347 and parameters: {'learning_rate': 0.02393652463662192, 'max_depth': 6, 'min_child_weight': 0.0012417226051008223, 'subsample': 0.6431565707973218, 'colsample_bylevel': 0.6125716742746937, 'colsample_bynode': 0.8545641645055122, 'reg_alpha': 1.5718484697835258, 'reg_lambda': 2.542902598754398, 'grow_policy': 'depthwise', 'max_cat_to_onehot': 22, 'max_leaves': 308}. Best is trial 3 with value: 0.23032920867358941.
Trial 10 finished with value: 0.23672209018046164 and parameters: {'learning_rate': 0.08675823913417954, 'max_depth': 8, 'min_child_weight': 0.038946887834449, 'subsample': 0.9729161367647149, 'colsample_bylevel': 0.8383148270515275, 'colsample_bynode': 0.9630659181130071, 'reg_alpha': 4.7988577526525065, 'reg_lambda': 0.08173818767886609, 'grow_policy': 'lossguide', 'max_cat_to_onehot': 99, 'max_leaves': 968}. Best is trial 3 with value: 0.23032920867358941.
Trial 11 finished with value: 0.23093697659374268 and parameters: {'learning_rate': 0.031790458723690476, 'max_depth': 10, 'min_child_weight': 0.04042693539277767, 'subsample': 0.7969511524558275, 'colsample_bylevel': 0.8167265665612355, 'colsample_bynode': 0.6039952029525323, 'reg_alpha': 3.838153225904187, 'reg_lambda': 2.5517844964406997, 'grow_policy': 'lossguide', 'max_cat_to_onehot': 38, 'max_leaves': 1021}. Best is trial 3 with value: 0.23032920867358941.
Trial 12 finished with value: 0.2308487200490641 and parameters: {'learning_rate': 0.007151134065784922, 'max_depth': 7, 'min_child_weight': 0.04426124104960989, 'subsample': 0.8419766872475172, 'colsample_bylevel': 0.7925153971864091, 'colsample_bynode': 0.6908556046603515, 'reg_alpha': 3.255113914277657, 'reg_lambda': 1.9184517258687528, 'grow_policy': 'lossguide', 'max_cat_to_onehot': 8, 'max_leaves': 360}. Best is trial 3 with value: 0.23032920867358941.
Trial 13 finished with value: 0.23309105966663313 and parameters: {'learning_rate': 0.0364822543842359, 'max_depth': 10, 'min_child_weight': 0.006871349895346334, 'subsample': 0.7174428023808301, 'colsample_bylevel': 0.7213785203554233, 'colsample_bynode': 0.7015897138467831, 'reg_alpha': 4.980085345107131, 'reg_lambda': 3.2241568158948057, 'grow_policy': 'lossguide', 'max_cat_to_onehot': 89, 'max_leaves': 365}. Best is trial 3 with value: 0.23032920867358941.
Trial 14 finished with value: 0.2296161974493397 and parameters: {'learning_rate': 0.008787903270079323, 'max_depth': 8, 'min_child_weight': 0.13925071458840985, 'subsample': 0.8222288590736007, 'colsample_bylevel': 0.8783455015235105, 'colsample_bynode': 0.6831931478275869, 'reg_alpha': 1.1855455336687406, 'reg_lambda': 1.1636683585691965, 'grow_policy': 'lossguide', 'max_cat_to_onehot': 28, 'max_leaves': 195}. Best is trial 14 with value: 0.2296161974493397.
Trial 15 finished with value: 0.23151072898813718 and parameters: {'learning_rate': 0.008445062247427748, 'max_depth': 7, 'min_child_weight': 0.10493327984860741, 'subsample': 0.9362148766913247, 'colsample_bylevel': 0.882776268775016, 'colsample_bynode': 0.7242757678791987, 'reg_alpha': 2.5258822861397694, 'reg_lambda': 1.0827563892547392, 'grow_policy': 'lossguide', 'max_cat_to_onehot': 34, 'max_leaves': 178}. Best is trial 14 with value: 0.2296161974493397.
Trial 16 finished with value: 0.23068228778102629 and parameters: {'learning_rate': 0.008757736843423953, 'max_depth': 8, 'min_child_weight': 0.007515218162927999, 'subsample': 0.8011114925789542, 'colsample_bylevel': 0.9019060550529424, 'colsample_bynode': 0.7414961521835066, 'reg_alpha': 1.2614308175132973, 'reg_lambda': 0.8691333247274609, 'grow_policy': 'lossguide', 'max_cat_to_onehot': 56, 'max_leaves': 187}. Best is trial 14 with value: 0.2296161974493397.
Trial 17 finished with value: 0.23153292040528284 and parameters: {'learning_rate': 0.020569116420177978, 'max_depth': 7, 'min_child_weight': 0.0021555153355774103, 'subsample': 0.7279056637939387, 'colsample_bylevel': 0.7838220184393664, 'colsample_bynode': 0.644453546094764, 'reg_alpha': 4.082694686525883, 'reg_lambda': 1.9315858713968175, 'grow_policy': 'lossguide', 'max_cat_to_onehot': 28, 'max_leaves': 494}. Best is trial 14 with value: 0.2296161974493397.
Trial 18 finished with value: 0.23001690862654167 and parameters: {'learning_rate': 0.0056058016915647435, 'max_depth': 8, 'min_child_weight': 0.014993789501718367, 'subsample': 0.6076755995955162, 'colsample_bylevel': 0.8501181564873096, 'colsample_bynode': 0.6018106912536622, 'reg_alpha': 2.661500697749731, 'reg_lambda': 0.3571384496509349, 'grow_policy': 'lossguide', 'max_cat_to_onehot': 12, 'max_leaves': 140}. Best is trial 14 with value: 0.2296161974493397.
Trial 19 finished with value: 0.2310018882111773 and parameters: {'learning_rate': 0.005009749281998703, 'max_depth': 6, 'min_child_weight': 0.021976138695397503, 'subsample': 0.6276323814426046, 'colsample_bylevel': 0.9325821473611466, 'colsample_bynode': 0.6725579620035722, 'reg_alpha': 1.0145382869536332, 'reg_lambda': 0.08689028168849333, 'grow_policy': 'depthwise', 'max_cat_to_onehot': 12, 'max_leaves': 120}. Best is trial 14 with value: 0.2296161974493397.
Trial 20 finished with value: 0.2307502692643748 and parameters: {'learning_rate': 0.006747196323638648, 'max_depth': 6, 'min_child_weight': 0.09236098946076897, 'subsample': 0.6823283230803168, 'colsample_bylevel': 0.8688058634986925, 'colsample_bynode': 0.7565929776133653, 'reg_alpha': 2.2852223386307897, 'reg_lambda': 1.6090855466366494, 'grow_policy': 'lossguide', 'max_cat_to_onehot': 12, 'max_leaves': 48}. Best is trial 14 with value: 0.2296161974493397.
Trial 21 finished with value: 0.2309334421312632 and parameters: {'learning_rate': 0.010378713589083936, 'max_depth': 8, 'min_child_weight': 0.015644939211928846, 'subsample': 0.6057575681173106, 'colsample_bylevel': 0.8534986792802727, 'colsample_bynode': 0.6091497488421054, 'reg_alpha': 3.104969432618316, 'reg_lambda': 0.48952155152722443, 'grow_policy': 'lossguide', 'max_cat_to_onehot': 69, 'max_leaves': 197}. Best is trial 14 with value: 0.2296161974493397.
Trial 22 finished with value: 0.23044637018180603 and parameters: {'learning_rate': 0.006195656941507862, 'max_depth': 9, 'min_child_weight': 0.13590131000021763, 'subsample': 0.9992069583703465, 'colsample_bylevel': 0.7621063047069575, 'colsample_bynode': 0.6455675932834662, 'reg_alpha': 3.6841419879799986, 'reg_lambda': 1.1412465695547864, 'grow_policy': 'lossguide', 'max_cat_to_onehot': 42, 'max_leaves': 584}. Best is trial 14 with value: 0.2296161974493397.
Trial 23 finished with value: 0.23513816706993318 and parameters: {'learning_rate': 0.04726647997508036, 'max_depth': 8, 'min_child_weight': 0.014781288343478706, 'subsample': 0.7661265366826928, 'colsample_bylevel': 0.8440326121202517, 'colsample_bynode': 0.6979639033789751, 'reg_alpha': 2.700517996355702, 'reg_lambda': 0.6327007945872407, 'grow_policy': 'lossguide', 'max_cat_to_onehot': 26, 'max_leaves': 253}. Best is trial 14 with value: 0.2296161974493397.
Trial 24 finished with value: 0.2301611658601337 and parameters: {'learning_rate': 0.010121771180717498, 'max_depth': 9, 'min_child_weight': 0.0027649917878421063, 'subsample': 0.8669476444201467, 'colsample_bylevel': 0.8142115493309434, 'colsample_bynode': 0.6105191326767642, 'reg_alpha': 4.34455011087802, 'reg_lambda': 1.3730704620327345, 'grow_policy': 'lossguide', 'max_cat_to_onehot': 12, 'max_leaves': 70}. Best is trial 14 with value: 0.2296161974493397.
Trial 25 finished with value: 0.23087732676345052 and parameters: {'learning_rate': 0.009464023491161001, 'max_depth': 9, 'min_child_weight': 0.002428845869820645, 'subsample': 0.8829767908626622, 'colsample_bylevel': 0.7600991144917101, 'colsample_bynode': 0.6572258022273194, 'reg_alpha': 4.406200449982297, 'reg_lambda': 2.3797699192950743, 'grow_policy': 'lossguide', 'max_cat_to_onehot': 11, 'max_leaves': 63}. Best is trial 14 with value: 0.2296161974493397.
Optuna Search Completed in: 504.70 seconds

Training final model on optimized parameter setup...

[XGBOOST FINALIZED METRICS]
Optimal Trees:         483
1-AUROC:             0.2150 (Delta to TabPFN: +0.0242)
Accuracy:             0.7060 (Delta to TabPFN: -0.0296)
Final Train Time:      4.42 seconds (0.5283s per 1K)
Final Infer Time:      0.01 seconds (0.0027s per 1K)

--- XGBOOST Feature Importance (Raw vs. Scaled Share) ---
Feature | Raw gain | Share
pca_embed_1 | 17960.18 | 6.93%
pca_embed_18 | 17074.21 | 6.59%
pca_embed_7 | 16775.81 | 6.47%
pca_embed_19 | 15147.60 | 5.84%
pca_embed_3 | 14219.57 | 5.49%
pca_embed_15 | 14209.47 | 5.48%
pca_embed_2 | 14014.94 | 5.41%
pca_embed_17 | 13711.13 | 5.29%
pca_embed_4 | 13608.32 | 5.25%
pca_embed_10 | 13282.64 | 5.12%
pca_embed_12 | 12872.18 | 4.97%
pca_embed_8 | 11741.56 | 4.53%
pca_embed_5 | 10414.55 | 4.02%
pca_embed_20 | 10231.67 | 3.95%
pca_embed_6 | 10056.10 | 3.88%
pca_embed_0 | 10023.17 | 3.87%
pca_embed_11 | 9919.43 | 3.83%
pca_embed_9 | 9702.21 | 3.74%
pca_embed_14 | 8558.86 | 3.30%
pca_embed_13 | 8125.61 | 3.13%
pca_embed_16 | 7556.98 | 2.92%

=====================================================================
METRIC TYPE                                  | VALUE / PROFILE
=====================================================================
Embedding Share                              | 100.00%
Raw Feature Share                            | 0.00%
---------------------------------------------------------------------
Active Text Embedding Density                | 100.00% (21/21)
Active Raw Tabular Feature Density           | 0.00% (0/0)
---------------------------------------------------------------------
Top-5 Concentration Ratio (CR5)              | 31.32% of total decision weight
Top-10 Concentration Ratio (CR10)            | 57.87% of total decision weight
=====================================================================

Total Pipeline Execution Time: 511.32 seconds

[SUCCESS] Permanent artifacts safely written to 'outputs/training-3/'
[W&B] Artifacts and localized metrics logged successfully for heloc_embed-only_xgboost
