Trial 25 finished with value: 0.18004238106572995 and parameters: {'learning_rate': 0.019962494594668645, 'max_depth': 7, 'min_child_weight': 0.009531933014969822, 'subsample': 0.9211530888746741, 'colsample_bylevel': 0.8819684573336191, 'colsample_bynode': 0.8996583785529637, 'reg_alpha': 4.260063842513697, 'reg_lambda': 4.870422392922617, 'grow_policy': 'lossguide', 'max_cat_to_onehot': 10, 'max_leaves': 48}. Best is trial 22 with value: 0.17872021798957183.
Optuna Search Completed in: 1132.97 seconds

Training final model on optimized parameter setup...

[XGBOOST FINALIZED METRICS]
Optimal Trees:         139
Log_Loss:             0.1807 (Delta to TabPFN: +0.0007)
Accuracy:             0.9649 (Delta to TabPFN: +0.0000)
Final Train Time:      1.21 seconds (0.3921s per 1K)
Final Infer Time:      0.00 seconds (0.0036s per 1K)

--- XGBOOST Feature Importance (Raw vs. Scaled Share) ---
Feature | Raw gain | Share
molecule_structure_property_1459 | 59.79 | 3.83%
molecule_structure_property_68 | 52.91 | 3.39%
molecule_structure_property_918 | 46.82 | 3.00%
molecule_structure_property_369 | 46.72 | 3.00%
molecule_structure_property_1479 | 45.14 | 2.89%
molecule_structure_property_1168 | 44.32 | 2.84%
molecule_structure_property_1219 | 43.10 | 2.76%
molecule_structure_property_191 | 41.44 | 2.66%
molecule_structure_property_721 | 32.75 | 2.10%
molecule_structure_property_891 | 31.66 | 2.03%
molecule_structure_property_953 | 30.54 | 1.96%
molecule_structure_property_1427 | 28.78 | 1.85%
molecule_structure_property_668 | 26.22 | 1.68%
molecule_structure_property_215 | 24.86 | 1.59%
molecule_structure_property_1249 | 21.67 | 1.39%
molecule_structure_property_846 | 18.90 | 1.21%
molecule_structure_property_317 | 18.28 | 1.17%
molecule_structure_property_1232 | 17.38 | 1.11%
molecule_structure_property_579 | 16.27 | 1.04%
molecule_structure_property_652 | 16.14 | 1.04%
molecule_structure_property_616 | 15.15 | 0.97%
molecule_structure_property_1207 | 15.00 | 0.96%
molecule_structure_property_1141 | 14.97 | 0.96%
molecule_structure_property_476 | 14.60 | 0.94%
molecule_structure_property_671 | 14.44 | 0.93%
molecule_structure_property_1103 | 14.32 | 0.92%
molecule_structure_property_704 | 13.33 | 0.86%
molecule_structure_property_1381 | 11.92 | 0.76%
molecule_structure_property_702 | 10.55 | 0.68%
molecule_structure_property_1084 | 10.34 | 0.66%
molecule_structure_property_1566 | 9.90 | 0.63%
molecule_structure_property_1587 | 9.45 | 0.61%
molecule_structure_property_725 | 9.25 | 0.59%
molecule_structure_property_1517 | 9.22 | 0.59%
molecule_structure_property_500 | 8.97 | 0.58%
molecule_structure_property_761 | 8.95 | 0.57%
molecule_structure_property_580 | 8.74 | 0.56%
molecule_structure_property_1425 | 8.65 | 0.55%
molecule_structure_property_605 | 8.64 | 0.55%
molecule_structure_property_212 | 8.48 | 0.54%
molecule_structure_property_412 | 8.36 | 0.54%
molecule_structure_property_262 | 8.21 | 0.53%
molecule_structure_property_866 | 8.04 | 0.52%
molecule_structure_property_950 | 7.79 | 0.50%
molecule_structure_property_1203 | 7.67 | 0.49%
molecule_structure_property_871 | 7.55 | 0.48%
molecule_structure_property_1277 | 7.41 | 0.48%
molecule_structure_property_645 | 7.40 | 0.47%
molecule_structure_property_239 | 7.39 | 0.47%
molecule_structure_property_296 | 7.30 | 0.47%
molecule_structure_property_750 | 7.19 | 0.46%
molecule_structure_property_1247 | 7.09 | 0.45%
molecule_structure_property_1302 | 7.02 | 0.45%
molecule_structure_property_1439 | 7.01 | 0.45%
molecule_structure_property_373 | 6.91 | 0.44%
molecule_structure_property_1330 | 6.89 | 0.44%
molecule_structure_property_66 | 6.83 | 0.44%
molecule_structure_property_1270 | 6.72 | 0.43%
molecule_structure_property_1109 | 6.61 | 0.42%
molecule_structure_property_561 | 6.56 | 0.42%
molecule_structure_property_348 | 6.45 | 0.41%
molecule_structure_property_1155 | 6.40 | 0.41%
molecule_structure_property_1101 | 6.37 | 0.41%
molecule_structure_property_621 | 6.31 | 0.40%
molecule_structure_property_54 | 5.80 | 0.37%
molecule_structure_property_1063 | 5.63 | 0.36%
molecule_structure_property_375 | 5.45 | 0.35%
molecule_structure_property_229 | 5.44 | 0.35%
molecule_structure_property_678 | 5.02 | 0.32%
molecule_structure_property_1402 | 4.99 | 0.32%
molecule_structure_property_646 | 4.98 | 0.32%
molecule_structure_property_451 | 4.89 | 0.31%
molecule_structure_property_1204 | 4.75 | 0.30%
molecule_structure_property_69 | 4.72 | 0.30%
molecule_structure_property_1089 | 4.70 | 0.30%
molecule_structure_property_292 | 4.58 | 0.29%
molecule_structure_property_1064 | 4.52 | 0.29%
molecule_structure_property_740 | 4.49 | 0.29%
molecule_structure_property_1498 | 4.45 | 0.29%
molecule_structure_property_1496 | 4.39 | 0.28%
molecule_structure_property_520 | 4.38 | 0.28%
molecule_structure_property_365 | 4.33 | 0.28%
molecule_structure_property_1304 | 4.28 | 0.27%
molecule_structure_property_1452 | 4.20 | 0.27%
molecule_structure_property_1362 | 4.17 | 0.27%
molecule_structure_property_1463 | 4.07 | 0.26%
molecule_structure_property_927 | 3.88 | 0.25%
molecule_structure_property_912 | 3.84 | 0.25%
molecule_structure_property_1058 | 3.68 | 0.24%
molecule_structure_property_1087 | 3.64 | 0.23%
molecule_structure_property_158 | 3.62 | 0.23%
molecule_structure_property_1323 | 3.44 | 0.22%
molecule_structure_property_1604 | 3.37 | 0.22%
molecule_structure_property_1210 | 3.30 | 0.21%
molecule_structure_property_1290 | 3.28 | 0.21%
molecule_structure_property_18 | 3.27 | 0.21%
molecule_structure_property_102 | 3.26 | 0.21%
molecule_structure_property_1 | 3.20 | 0.21%
molecule_structure_property_361 | 3.19 | 0.20%
molecule_structure_property_391 | 3.17 | 0.20%
molecule_structure_property_189 | 3.15 | 0.20%
molecule_structure_property_62 | 3.14 | 0.20%
molecule_structure_property_193 | 3.09 | 0.20%
molecule_structure_property_1136 | 3.04 | 0.19%
molecule_structure_property_607 | 2.91 | 0.19%
molecule_structure_property_202 | 2.90 | 0.19%
molecule_structure_property_187 | 2.89 | 0.19%
molecule_structure_property_827 | 2.89 | 0.19%
molecule_structure_property_909 | 2.89 | 0.19%
molecule_structure_property_21 | 2.83 | 0.18%
molecule_structure_property_1082 | 2.79 | 0.18%
molecule_structure_property_473 | 2.77 | 0.18%
molecule_structure_property_247 | 2.73 | 0.17%
molecule_structure_property_930 | 2.66 | 0.17%
molecule_structure_property_1345 | 2.59 | 0.17%
molecule_structure_property_906 | 2.59 | 0.17%
molecule_structure_property_1422 | 2.57 | 0.16%
molecule_structure_property_220 | 2.54 | 0.16%
molecule_structure_property_1159 | 2.54 | 0.16%
molecule_structure_property_222 | 2.53 | 0.16%
molecule_structure_property_1602 | 2.52 | 0.16%
molecule_structure_property_654 | 2.49 | 0.16%
molecule_structure_property_808 | 2.47 | 0.16%
molecule_structure_property_1324 | 2.46 | 0.16%
molecule_structure_property_1295 | 2.44 | 0.16%
molecule_structure_property_1068 | 2.43 | 0.16%
molecule_structure_property_983 | 2.38 | 0.15%
molecule_structure_property_531 | 2.36 | 0.15%
molecule_structure_property_437 | 2.35 | 0.15%
molecule_structure_property_972 | 2.34 | 0.15%
molecule_structure_property_712 | 2.32 | 0.15%
molecule_structure_property_129 | 2.30 | 0.15%
molecule_structure_property_683 | 2.27 | 0.15%
molecule_structure_property_445 | 2.25 | 0.14%
molecule_structure_property_1238 | 2.24 | 0.14%
molecule_structure_property_1539 | 2.19 | 0.14%
molecule_structure_property_982 | 2.18 | 0.14%
molecule_structure_property_546 | 2.17 | 0.14%
molecule_structure_property_56 | 2.15 | 0.14%
molecule_structure_property_1147 | 2.15 | 0.14%
molecule_structure_property_334 | 2.14 | 0.14%
molecule_structure_property_560 | 2.12 | 0.14%
molecule_structure_property_998 | 2.11 | 0.14%
molecule_structure_property_1185 | 2.08 | 0.13%
molecule_structure_property_1442 | 2.03 | 0.13%
molecule_structure_property_1102 | 2.02 | 0.13%
molecule_structure_property_612 | 2.02 | 0.13%
molecule_structure_property_48 | 2.01 | 0.13%
molecule_structure_property_458 | 2.01 | 0.13%
molecule_structure_property_241 | 1.97 | 0.13%
molecule_structure_property_9 | 1.94 | 0.12%
molecule_structure_property_753 | 1.90 | 0.12%
molecule_structure_property_513 | 1.83 | 0.12%
molecule_structure_property_1513 | 1.83 | 0.12%
molecule_structure_property_497 | 1.82 | 0.12%
molecule_structure_property_309 | 1.81 | 0.12%
molecule_structure_property_981 | 1.80 | 0.12%
molecule_structure_property_929 | 1.74 | 0.11%
molecule_structure_property_1146 | 1.73 | 0.11%
molecule_structure_property_1244 | 1.71 | 0.11%
molecule_structure_property_1118 | 1.71 | 0.11%
molecule_structure_property_3 | 1.70 | 0.11%
molecule_structure_property_839 | 1.67 | 0.11%
molecule_structure_property_1242 | 1.67 | 0.11%
molecule_structure_property_980 | 1.65 | 0.11%
molecule_structure_property_153 | 1.64 | 0.11%
molecule_structure_property_730 | 1.64 | 0.10%
molecule_structure_property_279 | 1.60 | 0.10%
molecule_structure_property_992 | 1.58 | 0.10%
molecule_structure_property_595 | 1.57 | 0.10%
molecule_structure_property_224 | 1.56 | 0.10%
molecule_structure_property_1050 | 1.55 | 0.10%
molecule_structure_property_952 | 1.53 | 0.10%
molecule_structure_property_624 | 1.52 | 0.10%
molecule_structure_property_87 | 1.50 | 0.10%
molecule_structure_property_1131 | 1.49 | 0.10%
molecule_structure_property_1097 | 1.48 | 0.09%
molecule_structure_property_134 | 1.47 | 0.09%
molecule_structure_property_1132 | 1.46 | 0.09%
molecule_structure_property_161 | 1.45 | 0.09%
molecule_structure_property_1564 | 1.44 | 0.09%
molecule_structure_property_65 | 1.43 | 0.09%
molecule_structure_property_325 | 1.43 | 0.09%
molecule_structure_property_979 | 1.40 | 0.09%
molecule_structure_property_289 | 1.40 | 0.09%
molecule_structure_property_802 | 1.37 | 0.09%
molecule_structure_property_568 | 1.36 | 0.09%
molecule_structure_property_1605 | 1.35 | 0.09%
molecule_structure_property_996 | 1.33 | 0.09%
molecule_structure_property_107 | 1.33 | 0.09%
molecule_structure_property_768 | 1.31 | 0.08%
molecule_structure_property_1293 | 1.31 | 0.08%
molecule_structure_property_1226 | 1.31 | 0.08%
molecule_structure_property_374 | 1.31 | 0.08%
molecule_structure_property_150 | 1.29 | 0.08%
molecule_structure_property_440 | 1.29 | 0.08%
molecule_structure_property_261 | 1.29 | 0.08%
molecule_structure_property_1183 | 1.28 | 0.08%
molecule_structure_property_216 | 1.26 | 0.08%
molecule_structure_property_1372 | 1.25 | 0.08%
molecule_structure_property_123 | 1.24 | 0.08%
molecule_structure_property_330 | 1.24 | 0.08%
molecule_structure_property_589 | 1.24 | 0.08%
molecule_structure_property_586 | 1.23 | 0.08%
molecule_structure_property_984 | 1.23 | 0.08%
molecule_structure_property_1525 | 1.22 | 0.08%
molecule_structure_property_515 | 1.22 | 0.08%
molecule_structure_property_1573 | 1.22 | 0.08%
molecule_structure_property_724 | 1.22 | 0.08%
molecule_structure_property_978 | 1.21 | 0.08%
molecule_structure_property_350 | 1.21 | 0.08%
molecule_structure_property_387 | 1.19 | 0.08%
molecule_structure_property_131 | 1.18 | 0.08%
molecule_structure_property_880 | 1.18 | 0.08%
molecule_structure_property_1611 | 1.18 | 0.08%
molecule_structure_property_232 | 1.17 | 0.08%
molecule_structure_property_576 | 1.16 | 0.07%
molecule_structure_property_1535 | 1.16 | 0.07%
molecule_structure_property_297 | 1.16 | 0.07%
molecule_structure_property_1029 | 1.14 | 0.07%
molecule_structure_property_1437 | 1.14 | 0.07%
molecule_structure_property_371 | 1.13 | 0.07%
molecule_structure_property_1588 | 1.12 | 0.07%
molecule_structure_property_786 | 1.11 | 0.07%
molecule_structure_property_245 | 1.11 | 0.07%
molecule_structure_property_959 | 1.11 | 0.07%
molecule_structure_property_938 | 1.10 | 0.07%
molecule_structure_property_1485 | 1.10 | 0.07%
molecule_structure_property_566 | 1.09 | 0.07%
molecule_structure_property_64 | 1.09 | 0.07%
molecule_structure_property_436 | 1.09 | 0.07%
molecule_structure_property_1551 | 1.08 | 0.07%
molecule_structure_property_344 | 1.07 | 0.07%
molecule_structure_property_157 | 1.07 | 0.07%
molecule_structure_property_1317 | 1.05 | 0.07%
molecule_structure_property_655 | 1.04 | 0.07%
molecule_structure_property_1041 | 1.03 | 0.07%
molecule_structure_property_1484 | 1.02 | 0.07%
molecule_structure_property_1020 | 1.02 | 0.07%
molecule_structure_property_769 | 1.01 | 0.07%
molecule_structure_property_1021 | 1.01 | 0.06%
molecule_structure_property_1565 | 1.01 | 0.06%
molecule_structure_property_863 | 1.01 | 0.06%
molecule_structure_property_1544 | 1.01 | 0.06%
molecule_structure_property_1193 | 0.99 | 0.06%
molecule_structure_property_194 | 0.96 | 0.06%
molecule_structure_property_512 | 0.96 | 0.06%
molecule_structure_property_78 | 0.96 | 0.06%
molecule_structure_property_1100 | 0.96 | 0.06%
molecule_structure_property_155 | 0.95 | 0.06%
molecule_structure_property_1575 | 0.95 | 0.06%
molecule_structure_property_545 | 0.95 | 0.06%
molecule_structure_property_553 | 0.94 | 0.06%
molecule_structure_property_282 | 0.94 | 0.06%
molecule_structure_property_281 | 0.94 | 0.06%
molecule_structure_property_1059 | 0.94 | 0.06%
molecule_structure_property_466 | 0.93 | 0.06%
molecule_structure_property_124 | 0.92 | 0.06%
molecule_structure_property_577 | 0.91 | 0.06%
molecule_structure_property_117 | 0.91 | 0.06%
molecule_structure_property_384 | 0.91 | 0.06%
molecule_structure_property_737 | 0.91 | 0.06%
molecule_structure_property_588 | 0.90 | 0.06%
molecule_structure_property_603 | 0.90 | 0.06%
molecule_structure_property_837 | 0.89 | 0.06%
molecule_structure_property_610 | 0.89 | 0.06%
molecule_structure_property_1148 | 0.89 | 0.06%
molecule_structure_property_1119 | 0.88 | 0.06%
molecule_structure_property_1423 | 0.88 | 0.06%
molecule_structure_property_540 | 0.87 | 0.06%
molecule_structure_property_1122 | 0.87 | 0.06%
molecule_structure_property_25 | 0.87 | 0.06%
molecule_structure_property_308 | 0.86 | 0.06%
molecule_structure_property_1140 | 0.86 | 0.06%
molecule_structure_property_23 | 0.86 | 0.05%
molecule_structure_property_52 | 0.85 | 0.05%
molecule_structure_property_1375 | 0.85 | 0.05%
molecule_structure_property_114 | 0.84 | 0.05%
molecule_structure_property_242 | 0.84 | 0.05%
molecule_structure_property_1151 | 0.83 | 0.05%
molecule_structure_property_214 | 0.83 | 0.05%
molecule_structure_property_664 | 0.82 | 0.05%
molecule_structure_property_1434 | 0.82 | 0.05%
molecule_structure_property_1165 | 0.82 | 0.05%
molecule_structure_property_329 | 0.81 | 0.05%
molecule_structure_property_602 | 0.80 | 0.05%
molecule_structure_property_372 | 0.79 | 0.05%
molecule_structure_property_471 | 0.79 | 0.05%
molecule_structure_property_1105 | 0.78 | 0.05%
molecule_structure_property_1448 | 0.77 | 0.05%
molecule_structure_property_1115 | 0.76 | 0.05%
molecule_structure_property_343 | 0.76 | 0.05%
molecule_structure_property_1359 | 0.75 | 0.05%
molecule_structure_property_660 | 0.75 | 0.05%
molecule_structure_property_213 | 0.74 | 0.05%
molecule_structure_property_1211 | 0.74 | 0.05%
molecule_structure_property_341 | 0.74 | 0.05%
molecule_structure_property_1453 | 0.74 | 0.05%
molecule_structure_property_541 | 0.74 | 0.05%
molecule_structure_property_874 | 0.71 | 0.05%
molecule_structure_property_911 | 0.71 | 0.05%
molecule_structure_property_291 | 0.70 | 0.05%
molecule_structure_property_957 | 0.69 | 0.04%
molecule_structure_property_865 | 0.69 | 0.04%
molecule_structure_property_470 | 0.67 | 0.04%
molecule_structure_property_44 | 0.67 | 0.04%
molecule_structure_property_1507 | 0.67 | 0.04%
molecule_structure_property_823 | 0.66 | 0.04%
molecule_structure_property_640 | 0.66 | 0.04%
molecule_structure_property_27 | 0.66 | 0.04%
molecule_structure_property_195 | 0.65 | 0.04%
molecule_structure_property_465 | 0.64 | 0.04%
molecule_structure_property_353 | 0.63 | 0.04%
molecule_structure_property_1301 | 0.63 | 0.04%
molecule_structure_property_1430 | 0.63 | 0.04%
molecule_structure_property_637 | 0.63 | 0.04%
molecule_structure_property_587 | 0.62 | 0.04%
molecule_structure_property_1240 | 0.62 | 0.04%
molecule_structure_property_1580 | 0.61 | 0.04%
molecule_structure_property_832 | 0.60 | 0.04%
molecule_structure_property_219 | 0.59 | 0.04%
molecule_structure_property_877 | 0.59 | 0.04%
molecule_structure_property_1169 | 0.59 | 0.04%
molecule_structure_property_1572 | 0.58 | 0.04%
molecule_structure_property_937 | 0.58 | 0.04%
molecule_structure_property_674 | 0.57 | 0.04%
molecule_structure_property_1133 | 0.57 | 0.04%
molecule_structure_property_81 | 0.55 | 0.04%
molecule_structure_property_1212 | 0.55 | 0.04%
molecule_structure_property_1568 | 0.55 | 0.04%
molecule_structure_property_1298 | 0.55 | 0.04%
molecule_structure_property_432 | 0.54 | 0.03%
molecule_structure_property_474 | 0.54 | 0.03%
molecule_structure_property_1591 | 0.53 | 0.03%
molecule_structure_property_720 | 0.53 | 0.03%
molecule_structure_property_731 | 0.52 | 0.03%
molecule_structure_property_735 | 0.52 | 0.03%
molecule_structure_property_739 | 0.52 | 0.03%
molecule_structure_property_314 | 0.50 | 0.03%
molecule_structure_property_1178 | 0.49 | 0.03%
molecule_structure_property_1120 | 0.49 | 0.03%
molecule_structure_property_935 | 0.49 | 0.03%
molecule_structure_property_729 | 0.49 | 0.03%
molecule_structure_property_905 | 0.48 | 0.03%
molecule_structure_property_1429 | 0.47 | 0.03%
molecule_structure_property_1294 | 0.46 | 0.03%
molecule_structure_property_1071 | 0.45 | 0.03%
molecule_structure_property_1018 | 0.45 | 0.03%
molecule_structure_property_1222 | 0.43 | 0.03%
molecule_structure_property_236 | 0.42 | 0.03%
molecule_structure_property_1233 | 0.42 | 0.03%
molecule_structure_property_339 | 0.42 | 0.03%
molecule_structure_property_852 | 0.41 | 0.03%
molecule_structure_property_1603 | 0.41 | 0.03%
molecule_structure_property_250 | 0.41 | 0.03%
molecule_structure_property_703 | 0.41 | 0.03%
molecule_structure_property_1166 | 0.40 | 0.03%
molecule_structure_property_728 | 0.40 | 0.03%
molecule_structure_property_1061 | 0.40 | 0.03%
molecule_structure_property_1601 | 0.39 | 0.03%
molecule_structure_property_136 | 0.38 | 0.02%
molecule_structure_property_1005 | 0.35 | 0.02%
molecule_structure_property_836 | 0.34 | 0.02%
molecule_structure_property_176 | 0.34 | 0.02%
molecule_structure_property_1251 | 0.34 | 0.02%
molecule_structure_property_1589 | 0.33 | 0.02%
molecule_structure_property_1229 | 0.33 | 0.02%
molecule_structure_property_243 | 0.33 | 0.02%
molecule_structure_property_1480 | 0.33 | 0.02%
molecule_structure_property_447 | 0.32 | 0.02%
molecule_structure_property_380 | 0.32 | 0.02%
molecule_structure_property_838 | 0.32 | 0.02%
molecule_structure_property_923 | 0.31 | 0.02%
molecule_structure_property_159 | 0.31 | 0.02%
molecule_structure_property_763 | 0.31 | 0.02%
molecule_structure_property_1220 | 0.30 | 0.02%
molecule_structure_property_324 | 0.30 | 0.02%
molecule_structure_property_1008 | 0.30 | 0.02%
molecule_structure_property_630 | 0.29 | 0.02%
molecule_structure_property_259 | 0.28 | 0.02%
molecule_structure_property_132 | 0.28 | 0.02%
molecule_structure_property_818 | 0.28 | 0.02%
molecule_structure_property_106 | 0.28 | 0.02%
molecule_structure_property_973 | 0.26 | 0.02%
molecule_structure_property_1559 | 0.26 | 0.02%
molecule_structure_property_111 | 0.26 | 0.02%
molecule_structure_property_711 | 0.26 | 0.02%
molecule_structure_property_742 | 0.25 | 0.02%
molecule_structure_property_570 | 0.24 | 0.02%
molecule_structure_property_110 | 0.24 | 0.02%
molecule_structure_property_830 | 0.24 | 0.02%
molecule_structure_property_1067 | 0.24 | 0.02%
molecule_structure_property_1555 | 0.23 | 0.01%
molecule_structure_property_1512 | 0.22 | 0.01%
molecule_structure_property_426 | 0.21 | 0.01%
molecule_structure_property_72 | 0.21 | 0.01%
molecule_structure_property_1117 | 0.21 | 0.01%
molecule_structure_property_26 | 0.21 | 0.01%
molecule_structure_property_1521 | 0.21 | 0.01%
molecule_structure_property_53 | 0.21 | 0.01%
molecule_structure_property_626 | 0.20 | 0.01%
molecule_structure_property_590 | 0.20 | 0.01%
molecule_structure_property_456 | 0.19 | 0.01%
molecule_structure_property_868 | 0.19 | 0.01%
molecule_structure_property_151 | 0.19 | 0.01%
molecule_structure_property_1351 | 0.19 | 0.01%
molecule_structure_property_947 | 0.18 | 0.01%
molecule_structure_property_956 | 0.18 | 0.01%
molecule_structure_property_205 | 0.18 | 0.01%
molecule_structure_property_463 | 0.18 | 0.01%
molecule_structure_property_267 | 0.17 | 0.01%
molecule_structure_property_47 | 0.17 | 0.01%
molecule_structure_property_99 | 0.17 | 0.01%
molecule_structure_property_482 | 0.17 | 0.01%
molecule_structure_property_50 | 0.17 | 0.01%
molecule_structure_property_192 | 0.16 | 0.01%
molecule_structure_property_1320 | 0.16 | 0.01%
molecule_structure_property_425 | 0.15 | 0.01%
molecule_structure_property_254 | 0.15 | 0.01%
molecule_structure_property_133 | 0.15 | 0.01%
molecule_structure_property_208 | 0.14 | 0.01%
molecule_structure_property_502 | 0.14 | 0.01%
molecule_structure_property_536 | 0.13 | 0.01%
molecule_structure_property_1016 | 0.13 | 0.01%
molecule_structure_property_403 | 0.13 | 0.01%
molecule_structure_property_666 | 0.12 | 0.01%
molecule_structure_property_1274 | 0.11 | 0.01%
molecule_structure_property_663 | 0.11 | 0.01%
molecule_structure_property_572 | 0.11 | 0.01%
molecule_structure_property_71 | 0.10 | 0.01%
molecule_structure_property_1287 | 0.09 | 0.01%
molecule_structure_property_552 | 0.09 | 0.01%
molecule_structure_property_393 | 0.09 | 0.01%
molecule_structure_property_864 | 0.09 | 0.01%
molecule_structure_property_443 | 0.09 | 0.01%
molecule_structure_property_1181 | 0.08 | 0.01%
molecule_structure_property_1014 | 0.08 | 0.01%
molecule_structure_property_1017 | 0.08 | 0.01%
molecule_structure_property_347 | 0.08 | 0.01%
molecule_structure_property_93 | 0.08 | 0.01%
molecule_structure_property_764 | 0.08 | 0.00%
molecule_structure_property_966 | 0.08 | 0.00%
molecule_structure_property_163 | 0.07 | 0.00%
molecule_structure_property_1334 | 0.07 | 0.00%
molecule_structure_property_649 | 0.06 | 0.00%
molecule_st