[W&B] Child process started for job: customer_satisfaction_in_airline_combined_xgboost in group session-training-3
Loading archive 'archives/customer_satisfaction_in_airline.npz' and initializing pipeline for target: XGBOOST...
Execution Mode: COMBINED
Session Output Target: outputs/training-3/
Task Type: BINARY
TabPFN Baselines Loaded - Primary: 0.0048 | Secondary: 0.9618
PCA reduced text embeddings to 33 components.
Final training matrix shape assembled for COMBINED: (103904, 54)

Running 26-Trial Optuna Study for XGBOOST (COMBINED)...
A new study created in RDB with name: 20260624_182005_customer_satisfaction_in_airline_combined_xgboost
Trial 0 finished with value: 0.005706186230583388 and parameters: {}. Best is trial 0 with value: 0.005706186230583388.
Trial 1 finished with value: 0.005132563728779349 and parameters: {'learning_rate': 0.015355286838886862, 'max_depth': 10, 'min_child_weight': 0.5100627805979911, 'subsample': 0.8394633936788146, 'colsample_bylevel': 0.6624074561769746, 'colsample_bynode': 0.662397808134481, 'reg_alpha': 0.29051225247978046, 'reg_lambda': 4.330894111260099, 'grow_policy': 'lossguide', 'max_cat_to_onehot': 8, 'max_leaves': 884}. Best is trial 1 with value: 0.005132563728779349.
Trial 2 finished with value: 0.005609788580797304 and parameters: {'learning_rate': 0.060534484680010825, 'max_depth': 4, 'min_child_weight': 0.004705059281907645, 'subsample': 0.6733618039413735, 'colsample_bylevel': 0.7216968971838151, 'colsample_bynode': 0.8099025726528951, 'reg_alpha': 2.1597818987087147, 'reg_lambda': 1.4562165780761898, 'grow_policy': 'depthwise', 'max_cat_to_onehot': 16, 'max_leaves': 45}. Best is trial 1 with value: 0.005132563728779349.
Trial 3 finished with value: 0.005193376404018624 and parameters: {'learning_rate': 0.019603369861210685, 'max_depth': 8, 'min_child_weight': 0.005477562363971304, 'subsample': 0.8056937753654446, 'colsample_bylevel': 0.836965827544817, 'colsample_bynode': 0.6185801650879991, 'reg_alpha': 3.037763505022002, 'reg_lambda': 0.8527035660240889, 'grow_policy': 'lossguide', 'max_cat_to_onehot': 92, 'max_leaves': 399}. Best is trial 1 with value: 0.005132563728779349.
Trial 4 finished with value: 0.00801320847386422 and parameters: {'learning_rate': 0.012453219846912198, 'max_depth': 4, 'min_child_weight': 0.33959199243313637, 'subsample': 0.7760609974958406, 'colsample_bylevel': 0.6488152939379115, 'colsample_bynode': 0.798070764044508, 'reg_alpha': 0.17203916672398045, 'reg_lambda': 4.546611078353703, 'grow_policy': 'lossguide', 'max_cat_to_onehot': 17, 'max_leaves': 97}. Best is trial 1 with value: 0.005132563728779349.
Trial 5 finished with value: 0.006387409630763452 and parameters: {'learning_rate': 0.025719142025384646, 'max_depth': 4, 'min_child_weight': 3.8589082671053854, 'subsample': 0.9100531293444458, 'colsample_bylevel': 0.9757995766256756, 'colsample_bynode': 0.9579309401710595, 'reg_alpha': 2.989540104057545, 'reg_lambda': 4.609378987692081, 'grow_policy': 'lossguide', 'max_cat_to_onehot': 8, 'max_leaves': 37}. Best is trial 1 with value: 0.005132563728779349.
Trial 6 finished with value: 0.006438711713444123 and parameters: {'learning_rate': 0.016019568611465234, 'max_depth': 5, 'min_child_weight': 1.1627201204016835, 'subsample': 0.7427013306774357, 'colsample_bylevel': 0.7123738038749523, 'colsample_bynode': 0.8170784332632994, 'reg_alpha': 0.7047070324513158, 'reg_lambda': 4.011004684072123, 'grow_policy': 'lossguide', 'max_cat_to_onehot': 56, 'max_leaves': 20}. Best is trial 1 with value: 0.005132563728779349.
Trial 7 finished with value: 0.015275613849320191 and parameters: {'learning_rate': 0.0050834018700114374, 'max_depth': 9, 'min_child_weight': 0.4117599592262879, 'subsample': 0.8916028672163949, 'colsample_bylevel': 0.9085081386743783, 'colsample_bynode': 0.6296178606936361, 'reg_alpha': 1.7923927961485087, 'reg_lambda': 0.5794337107196961, 'grow_policy': 'depthwise', 'max_cat_to_onehot': 18, 'max_leaves': 10}. Best is trial 1 with value: 0.005132563728779349.
Trial 8 finished with value: 0.006586908208072284 and parameters: {'learning_rate': 0.012693089228250284, 'max_depth': 5, 'min_child_weight': 0.49979438035802604, 'subsample': 0.8550229885420852, 'colsample_bylevel': 0.9548850970305306, 'colsample_bynode': 0.7888859700647797, 'reg_alpha': 0.5980592702669147, 'reg_lambda': 3.566252611636253, 'grow_policy': 'depthwise', 'max_cat_to_onehot': 55, 'max_leaves': 85}. Best is trial 1 with value: 0.005132563728779349.
Trial 9 finished with value: 0.005388900603582325 and parameters: {'learning_rate': 0.02393652463662192, 'max_depth': 6, 'min_child_weight': 0.0012417226051008223, 'subsample': 0.6431565707973218, 'colsample_bylevel': 0.6125716742746937, 'colsample_bynode': 0.8545641645055122, 'reg_alpha': 1.5718484697835258, 'reg_lambda': 2.542902598754398, 'grow_policy': 'depthwise', 'max_cat_to_onehot': 22, 'max_leaves': 308}. Best is trial 1 with value: 0.005132563728779349.
Trial 10 finished with value: 0.005261055974632889 and parameters: {'learning_rate': 0.0864853073450281, 'max_depth': 7, 'min_child_weight': 0.05528731777524736, 'subsample': 0.9729161367647149, 'colsample_bylevel': 0.8262452362725613, 'colsample_bynode': 0.7202259292197385, 'reg_alpha': 4.7988577526525065, 'reg_lambda': 2.58248067449815, 'grow_policy': 'lossguide', 'max_cat_to_onehot': 8, 'max_leaves': 971}. Best is trial 1 with value: 0.005132563728779349.
Trial 11 finished with value: 0.005177602830798822 and parameters: {'learning_rate': 0.031790458723690476, 'max_depth': 10, 'min_child_weight': 0.028789455442955813, 'subsample': 0.7969511524558275, 'colsample_bylevel': 0.8167265665612355, 'colsample_bynode': 0.6039952029525323, 'reg_alpha': 3.838153225904187, 'reg_lambda': 0.11339104360127994, 'grow_policy': 'lossguide', 'max_cat_to_onehot': 84, 'max_leaves': 1021}. Best is trial 1 with value: 0.005132563728779349.
Trial 12 finished with value: 0.00522556217885195 and parameters: {'learning_rate': 0.03789339775622382, 'max_depth': 10, 'min_child_weight': 0.06504931391232921, 'subsample': 0.7275749457799163, 'colsample_bylevel': 0.7770686130040154, 'colsample_bynode': 0.6908556046603515, 'reg_alpha': 4.8695987677759724, 'reg_lambda': 0.036286437200296895, 'grow_policy': 'lossguide', 'max_cat_to_onehot': 33, 'max_leaves': 828}. Best is trial 1 with value: 0.005132563728779349.
Trial 13 finished with value: 0.005460341839500504 and parameters: {'learning_rate': 0.00721580146971962, 'max_depth': 10, 'min_child_weight': 0.05090057180402597, 'subsample': 0.8280519459602143, 'colsample_bylevel': 0.6896214352214821, 'colsample_bynode': 0.6944839312333239, 'reg_alpha': 3.7717334436365895, 'reg_lambda': 2.2386332504708712, 'grow_policy': 'lossguide', 'max_cat_to_onehot': 89, 'max_leaves': 365}. Best is trial 1 with value: 0.005132563728779349.
Trial 14 finished with value: 0.005206677658816439 and parameters: {'learning_rate': 0.041314384168676443, 'max_depth': 8, 'min_child_weight': 0.01032738514476199, 'subsample': 0.9877079408194872, 'colsample_bylevel': 0.7958474857133548, 'colsample_bynode': 0.6032918634338744, 'reg_alpha': 3.696657160648065, 'reg_lambda': 3.433406600621676, 'grow_policy': 'lossguide', 'max_cat_to_onehot': 33, 'max_leaves': 578}. Best is trial 1 with value: 0.005132563728779349.
Trial 15 finished with value: 0.0051907969679156896 and parameters: {'learning_rate': 0.033957652539039894, 'max_depth': 9, 'min_child_weight': 4.204196605005472, 'subsample': 0.9054989579659412, 'colsample_bylevel': 0.9003988944050104, 'colsample_bynode': 0.6597388015567154, 'reg_alpha': 1.0906801479048633, 'reg_lambda': 1.7002317730572796, 'grow_policy': 'lossguide', 'max_cat_to_onehot': 13, 'max_leaves': 178}. Best is trial 1 with value: 0.005132563728779349.
Trial 16 finished with value: 0.005330770334591728 and parameters: {'learning_rate': 0.009151843338230383, 'max_depth': 10, 'min_child_weight': 0.16765674429734193, 'subsample': 0.7113349365124932, 'colsample_bylevel': 0.7438454443240938, 'colsample_bynode': 0.7432872355587146, 'reg_alpha': 2.4484252636344523, 'reg_lambda': 3.083256554298977, 'grow_policy': 'lossguide', 'max_cat_to_onehot': 32, 'max_leaves': 909}. Best is trial 1 with value: 0.005132563728779349.
Trial 17 finished with value: 0.005304149942785608 and parameters: {'learning_rate': 0.059212001777886235, 'max_depth': 8, 'min_child_weight': 0.01894984330711446, 'subsample': 0.7764492866397916, 'colsample_bylevel': 0.6051850022672435, 'colsample_bynode': 0.6601495846386295, 'reg_alpha': 4.082694686525883, 'reg_lambda': 4.956386852998385, 'grow_policy': 'lossguide', 'max_cat_to_onehot': 11, 'max_leaves': 232}. Best is trial 1 with value: 0.005132563728779349.
Trial 18 finished with value: 0.005212025871587089 and parameters: {'learning_rate': 0.02722284472310012, 'max_depth': 7, 'min_child_weight': 1.2285473406008305, 'subsample': 0.8673974237216685, 'colsample_bylevel': 0.8701534786473906, 'colsample_bynode': 0.7382524275549022, 'reg_alpha': 0.07520455600727383, 'reg_lambda': 1.543387342009832, 'grow_policy': 'lossguide', 'max_cat_to_onehot': 61, 'max_leaves': 533}. Best is trial 1 with value: 0.005132563728779349.
Trial 19 finished with value: 0.005159019361516082 and parameters: {'learning_rate': 0.01568040674139593, 'max_depth': 9, 'min_child_weight': 0.13270787839727372, 'subsample': 0.936389711335694, 'colsample_bylevel': 0.6749714890580973, 'colsample_bynode': 0.979851568565839, 'reg_alpha': 3.0292294036574274, 'reg_lambda': 0.08689028168849333, 'grow_policy': 'depthwise', 'max_cat_to_onehot': 26, 'max_leaves': 491}. Best is trial 1 with value: 0.005132563728779349.
Trial 20 finished with value: 0.005678448509714329 and parameters: {'learning_rate': 0.010938793348333784, 'max_depth': 7, 'min_child_weight': 0.13849965052393726, 'subsample': 0.9412643337267934, 'colsample_bylevel': 0.636965143897855, 'colsample_bynode': 0.9989879313923895, 'reg_alpha': 2.746301121872351, 'reg_lambda': 0.8466189170834814, 'grow_policy': 'depthwise', 'max_cat_to_onehot': 24, 'max_leaves': 150}. Best is trial 1 with value: 0.005132563728779349.
Trial 21 finished with value: 0.005173687752070166 and parameters: {'learning_rate': 0.017096562339148396, 'max_depth': 9, 'min_child_weight': 0.024176081442602724, 'subsample': 0.8264863722166047, 'colsample_bylevel': 0.6811951490899263, 'colsample_bynode': 0.8569496416129234, 'reg_alpha': 4.3561107682868725, 'reg_lambda': 0.07099325133040896, 'grow_policy': 'depthwise', 'max_cat_to_onehot': 41, 'max_leaves': 591}. Best is trial 1 with value: 0.005132563728779349.
Trial 22 finished with value: 0.00517024390151688 and parameters: {'learning_rate': 0.016723150040049536, 'max_depth': 9, 'min_child_weight': 0.13823540249377672, 'subsample': 0.8431892314289042, 'colsample_bylevel': 0.6717407257103568, 'colsample_bynode': 0.8891408057925438, 'reg_alpha': 4.435860666469466, 'reg_lambda': 0.5162264121118558, 'grow_policy': 'depthwise', 'max_cat_to_onehot': 26, 'max_leaves': 519}. Best is trial 1 with value: 0.005132563728779349.
Trial 23 finished with value: 0.005188911402449925 and parameters: {'learning_rate': 0.015110077520469983, 'max_depth': 9, 'min_child_weight': 0.1869601444111899, 'subsample': 0.9331725338502658, 'colsample_bylevel': 0.6687216104994829, 'colsample_bynode': 0.9216234925354271, 'reg_alpha': 3.4855911360788205, 'reg_lambda': 0.6167923687075318, 'grow_policy': 'depthwise', 'max_cat_to_onehot': 26, 'max_leaves': 254}. Best is trial 1 with value: 0.005132563728779349.
Trial 24 finished with value: 0.005706402487865914 and parameters: {'learning_rate': 0.008276727340230092, 'max_depth': 8, 'min_child_weight': 1.2038359833294547, 'subsample': 0.8562786562337028, 'colsample_bylevel': 0.7610729105597118, 'colsample_bynode': 0.909448915660398, 'reg_alpha': 4.485306877336069, 'reg_lambda': 1.177195357640699, 'grow_policy': 'depthwise', 'max_cat_to_onehot': 11, 'max_leaves': 443}. Best is trial 1 with value: 0.005132563728779349.
Trial 25 finished with value: 0.005149004060982287 and parameters: {'learning_rate': 0.021971700189479297, 'max_depth': 9, 'min_child_weight': 0.10469140182172353, 'subsample': 0.9607130666952866, 'colsample_bylevel': 0.7095470819598864, 'colsample_bynode': 0.9913280022498538, 'reg_alpha': 3.2391371301546723, 'reg_lambda': 2.218066956007481, 'grow_policy': 'depthwise', 'max_cat_to_onehot': 42, 'max_leaves': 619}. Best is trial 1 with value: 0.005132563728779349.
Optuna Search Completed in: 3137.96 seconds

Training final model on optimized parameter setup...

[XGBOOST FINALIZED METRICS]
Optimal Trees:         1000
1-AUROC:             0.0053 (Delta to TabPFN: +0.0005)
Accuracy:             0.9617 (Delta to TabPFN: -0.0002)
Final Train Time:      29.61 seconds (0.2850s per 1K)
Final Infer Time:      0.34 seconds (0.0131s per 1K)

--- XGBOOST Feature Importance (Raw vs. Scaled Share) ---
Feature | Raw gain | Share
Inflightentertainment | 839290.38 | 22.02%
pca_embed_0 | 521872.88 | 13.69%
Seatcomfort | 411010.31 | 10.78%
pca_embed_1 | 239811.31 | 6.29%
pca_embed_8 | 165958.67 | 4.35%
pca_embed_5 | 162712.73 | 4.27%
EaseofOnlinebooking | 99841.29 | 2.62%
pca_embed_15 | 90718.88 | 2.38%
Onlineboarding | 70969.08 | 1.86%
pca_embed_3 | 68693.85 | 1.80%
Gatelocation | 60420.22 | 1.59%
CustomerType | 58806.72 | 1.54%
pca_embed_17 | 54091.91 | 1.42%
Class | 51319.46 | 1.35%
pca_embed_2 | 48466.23 | 1.27%
pca_embed_4 | 47234.48 | 1.24%
pca_embed_14 | 46234.09 | 1.21%
pca_embed_22 | 44116.66 | 1.16%
pca_embed_27 | 37345.53 | 0.98%
pca_embed_11 | 36566.56 | 0.96%
DepartureArrivaltimeconvenient | 35576.05 | 0.93%
pca_embed_19 | 34546.85 | 0.91%
pca_embed_9 | 33179.92 | 0.87%
pca_embed_7 | 29130.96 | 0.76%
pca_embed_23 | 27100.52 | 0.71%
Foodanddrink | 26634.06 | 0.70%
pca_embed_25 | 25896.97 | 0.68%
Onboardservice | 25417.25 | 0.67%
pca_embed_6 | 24937.20 | 0.65%
pca_embed_13 | 23325.33 | 0.61%
FlightDistance | 23117.07 | 0.61%
pca_embed_26 | 22070.60 | 0.58%
pca_embed_30 | 21486.60 | 0.56%
pca_embed_20 | 20861.50 | 0.55%
pca_embed_29 | 19932.14 | 0.52%
Legroomservice | 19696.01 | 0.52%
pca_embed_10 | 18822.24 | 0.49%
pca_embed_21 | 18470.62 | 0.48%
Age | 18260.12 | 0.48%
pca_embed_16 | 17561.55 | 0.46%
pca_embed_24 | 17189.60 | 0.45%
TypeofTravel | 16611.41 | 0.44%
Onlinesupport | 15210.23 | 0.40%
pca_embed_18 | 15075.31 | 0.40%
Baggagehandling | 14920.60 | 0.39%
pca_embed_12 | 13123.50 | 0.34%
pca_embed_32 | 11540.59 | 0.30%
pca_embed_31 | 11540.10 | 0.30%
Cleanliness | 11522.23 | 0.30%
pca_embed_28 | 11040.62 | 0.29%
ArrivalDelayinMinutes | 10790.15 | 0.28%
Inflightwifiservice | 9765.59 | 0.26%
Checkinservice | 7103.23 | 0.19%
DepartureDelayinMinutes | 5039.87 | 0.13%

=====================================================================
METRIC TYPE                                  | VALUE / PROFILE
=====================================================================
Embedding Share                              | 51.96%
Raw Feature Share                            | 48.04%
---------------------------------------------------------------------
Active Text Embedding Density                | 100.00% (33/33)
Active Raw Tabular Feature Density           | 100.00% (21/21)
---------------------------------------------------------------------
Top-5 Concentration Ratio (CR5)              | 57.13% of total decision weight
Top-10 Concentration Ratio (CR10)            | 70.07% of total decision weight
=====================================================================

Total Pipeline Execution Time: 3171.36 seconds

[SUCCESS] Permanent artifacts safely written to 'outputs/training-3/'
[W&B] Artifacts and localized metrics logged successfully for customer_satisfaction_in_airline_combined_xgboost
