number,value,datetime_start,datetime_complete,duration,params_boosting_type,params_bootstrap_type,params_colsample_bylevel,params_depth,params_grow_policy,params_l2_leaf_reg,params_leaf_estimation_iterations,params_learning_rate,params_max_bin,params_max_ctr_complexity,params_model_size_reg,params_one_hot_max_size,params_subsample,user_attrs_optimal_trees,system_attrs_fixed_params,state
0,6.586214399180902,2026-06-24 16:18:11.911663,2026-06-24 16:18:13.795492,0 days 00:00:01.883829,,,,,,,,,,,,,,100,{},COMPLETE
1,4.24521792766787,2026-06-24 16:18:13.811682,2026-06-24 16:18:23.332307,0 days 00:00:09.520625,Plain,Bernoulli,0.8733991780504303,4.0,SymmetricTree,0.00018747059221802545,12.0,0.015355286838886862,254.0,2.0,0.6803900745073703,36.0,0.9852142919229748,1000,,COMPLETE
2,4.404234879354274,2026-06-24 16:18:23.345990,2026-06-24 16:18:26.307719,0 days 00:00:02.961729,Plain,Bernoulli,0.8956363364439306,4.0,SymmetricTree,0.02922905212920092,2.0,0.09138013915892866,254.0,2.0,0.5243180891902851,16.0,0.9497327922401265,563,,COMPLETE
3,4.287767795659217,2026-06-24 16:18:26.317997,2026-06-24 16:18:42.972119,0 days 00:00:16.654122,Plain,Bernoulli,0.9271351657620417,4.0,Depthwise,0.06077686426194464,1.0,0.011996621453406362,254.0,2.0,0.15869086642715013,36.0,0.8099085529881075,1000,,COMPLETE
4,4.359239320510425,2026-06-24 16:18:42.981510,2026-06-24 16:18:45.835372,0 days 00:00:02.853862,Plain,Bernoulli,0.9526349539768235,4.0,SymmetricTree,0.011702088154220882,1.0,0.08580222514877409,254.0,5.0,0.10975998502129433,27.0,0.9896896099223678,566,,COMPLETE
5,4.401843799203935,2026-06-24 16:18:45.846234,2026-06-24 16:19:45.591647,0 days 00:00:59.745413,Plain,Bernoulli,0.877728168328829,6.0,Depthwise,3.597899951374983,9.0,0.010855517271883068,254.0,4.0,1.128232550122133,86.0,0.8987566853061946,1000,,COMPLETE
6,4.411474387452139,2026-06-24 16:19:45.602201,2026-06-24 16:19:52.257472,0 days 00:00:06.655271,Plain,Bernoulli,0.9083015934534223,5.0,SymmetricTree,0.001883913511943895,11.0,0.07913270952323785,254.0,4.0,0.21399549030176218,19.0,0.7265477506155759,812,,COMPLETE
7,4.69997476098978,2026-06-24 16:19:52.267632,2026-06-24 16:21:36.626996,0 days 00:01:44.359364,Plain,Bernoulli,0.8798073522301258,7.0,Depthwise,0.00010615690854925657,10.0,0.007626348515257587,254.0,5.0,0.7200770311577639,47.0,0.9406590942262119,1000,,COMPLETE
8,4.775579870434767,2026-06-24 16:21:36.636935,2026-06-24 16:23:21.693809,0 days 00:01:45.056874,Plain,Bernoulli,0.8996347037278973,7.0,Depthwise,0.00019891099118865958,2.0,0.006241720498669827,254.0,4.0,0.7212460519889856,17.0,0.8075397185632818,1000,,COMPLETE
9,5.042542552834071,2026-06-24 16:23:21.704248,2026-06-24 16:23:58.191775,0 days 00:00:36.487527,Plain,Bernoulli,0.9341915796354244,7.0,Depthwise,0.4195190175255899,3.0,0.07132805718188966,254.0,2.0,0.318293122389662,29.0,0.8416644775485848,451,,COMPLETE
10,5.3190737111579125,2026-06-24 16:23:58.202172,2026-06-24 16:24:52.424559,0 days 00:00:54.222387,Plain,Bernoulli,0.9942739726130633,8.0,SymmetricTree,0.0025843128549611844,18.0,0.027075555569701922,254.0,3.0,1.3180934075316322,8.0,0.701799154886745,1000,,COMPLETE
11,4.305359827407456,2026-06-24 16:24:52.433633,2026-06-24 16:25:00.492152,0 days 00:00:08.058519,Plain,Bernoulli,0.8601730401643931,4.0,SymmetricTree,0.09774549841052531,1.0,0.015753387726212563,254.0,2.0,0.10586390145586963,51.0,0.7979239426070239,1000,,COMPLETE
12,4.2908697548632215,2026-06-24 16:25:00.502091,2026-06-24 16:25:30.838233,0 days 00:00:30.336142,Plain,Bernoulli,0.935626484649295,5.0,Depthwise,4.104746291866498,5.0,0.022990961643687132,254.0,3.0,0.21117492373326263,48.0,0.8583336679090096,1000,,COMPLETE
13,4.287517475728218,2026-06-24 16:25:30.849303,2026-06-24 16:25:41.172341,0 days 00:00:10.323038,Plain,Bernoulli,0.9765970152566792,5.0,SymmetricTree,0.0011283551613015107,1.0,0.029346655525812386,254.0,3.0,0.3495337593931401,29.0,0.7701766093107817,1000,,COMPLETE
14,4.341616782352112,2026-06-24 16:25:41.182893,2026-06-24 16:25:50.145373,0 days 00:00:08.962480,Plain,Bernoulli,0.9782050882474624,5.0,SymmetricTree,0.0006671591820665904,4.0,0.036398548347517976,254.0,3.0,0.41078176874620537,93.0,0.7634898346657215,1000,,COMPLETE
15,4.23250490194127,2026-06-24 16:25:50.155594,2026-06-24 16:25:59.061105,0 days 00:00:08.905511,Plain,Bernoulli,0.8507110179479633,5.0,SymmetricTree,0.000649368556986632,18.0,0.0403057502917834,254.0,3.0,0.7583299697243715,11.0,0.9938276775318233,1000,,COMPLETE
16,4.340235314104754,2026-06-24 16:25:59.074882,2026-06-24 16:26:10.992949,0 days 00:00:11.918067,Plain,Bernoulli,0.8503969586671809,6.0,SymmetricTree,0.00029640147355294193,18.0,0.0451159727146497,254.0,3.0,0.8630272419774733,8.0,0.9976274636576414,773,,COMPLETE
17,4.437376530797139,2026-06-24 16:26:11.002726,2026-06-24 16:26:23.675192,0 days 00:00:12.672466,Plain,Bernoulli,0.8749310480685797,6.0,SymmetricTree,0.0047439625734073945,7.0,0.05004700624977665,254.0,2.0,0.5264436835177938,12.0,0.950373870683115,1000,,COMPLETE
18,4.251056501897315,2026-06-24 16:26:23.691398,2026-06-24 16:26:37.656522,0 days 00:00:13.965124,Plain,Bernoulli,0.8634016228022348,5.0,SymmetricTree,0.0006581871797055162,20.0,0.016537289108844985,254.0,3.0,1.053461654631859,12.0,0.9158915666136902,1000,,COMPLETE
19,4.247557939410672,2026-06-24 16:26:37.667388,2026-06-24 16:26:46.246448,0 days 00:00:08.579060,Plain,Bernoulli,0.852253181743853,4.0,SymmetricTree,0.00738836580729759,13.0,0.018915137025867522,254.0,4.0,1.4751962929798974,72.0,0.98415831088428,1000,,COMPLETE
20,4.352187139606056,2026-06-24 16:26:46.256084,2026-06-24 16:27:09.430085,0 days 00:00:23.174001,Plain,Bernoulli,0.8899718522358547,6.0,SymmetricTree,0.00039104745729516826,7.0,0.008623617580561804,254.0,2.0,0.588877556818652,11.0,0.8963544147928729,1000,,COMPLETE
21,4.317813269514962,2026-06-24 16:27:09.440561,2026-06-24 16:27:16.628418,0 days 00:00:07.187857,Plain,Bernoulli,0.8520410836224734,4.0,SymmetricTree,0.007775505050908237,13.0,0.01862321246878515,254.0,4.0,1.431612154278977,68.0,0.9723511491460253,1000,,COMPLETE
22,4.305194571211817,2026-06-24 16:27:16.637954,2026-06-24 16:27:25.315218,0 days 00:00:08.677264,Plain,Bernoulli,0.8698064084696284,4.0,SymmetricTree,0.00017240273315643757,13.0,0.013357456611034945,254.0,4.0,0.9434013415891885,77.0,0.9758076157411857,1000,,COMPLETE
23,4.293013254881911,2026-06-24 16:27:25.326656,2026-06-24 16:27:37.970625,0 days 00:00:12.643969,Plain,Bernoulli,0.8607980650344326,5.0,SymmetricTree,0.0029574363479771774,14.0,0.021700632420770288,254.0,5.0,0.7601984331391209,57.0,0.9305396775807278,1000,,COMPLETE
24,4.38405504366721,2026-06-24 16:27:37.980148,2026-06-24 16:27:42.493693,0 days 00:00:04.513545,Plain,Bernoulli,0.8850798710000046,4.0,SymmetricTree,0.013153623091867756,7.0,0.0599472326702636,254.0,3.0,1.2132171856620648,37.0,0.9597430535513471,708,,COMPLETE
25,4.375978651695792,2026-06-24 16:27:42.503290,2026-06-24 16:27:50.098163,0 days 00:00:07.594873,Plain,Bernoulli,0.8508830095514494,5.0,SymmetricTree,0.001260618025588648,9.0,0.03728695131011425,254.0,4.0,0.6075194453411614,20.0,0.9929490474667921,1000,,COMPLETE
