number,value,datetime_start,datetime_complete,duration,params_boosting_type,params_bootstrap_type,params_colsample_bylevel,params_depth,params_grow_policy,params_l2_leaf_reg,params_leaf_estimation_iterations,params_learning_rate,params_max_bin,params_max_ctr_complexity,params_model_size_reg,params_one_hot_max_size,params_subsample,user_attrs_optimal_trees,system_attrs_fixed_params,state
0,87408.51518725214,2026-06-24 23:37:02.138840,2026-06-24 23:37:04.922196,0 days 00:00:02.783356,,,,,,,,,,,,,,100,{},COMPLETE
1,78836.75652916444,2026-06-24 23:37:04.936603,2026-06-24 23:37:18.643675,0 days 00:00:13.707072,Plain,Bernoulli,0.8733991780504303,4.0,SymmetricTree,0.00018747059221802545,12.0,0.015355286838886862,254.0,2.0,0.6803900745073703,36.0,0.9852142919229748,1000,,COMPLETE
2,81420.0070780454,2026-06-24 23:37:18.657014,2026-06-24 23:37:23.312959,0 days 00:00:04.655945,Plain,Bernoulli,0.8956363364439306,4.0,SymmetricTree,0.02922905212920092,2.0,0.09138013915892866,254.0,2.0,0.5243180891902851,16.0,0.9497327922401265,712,,COMPLETE
3,79048.43643965293,2026-06-24 23:37:23.325076,2026-06-24 23:37:45.805338,0 days 00:00:22.480262,Plain,Bernoulli,0.9271351657620417,4.0,Depthwise,0.06077686426194464,1.0,0.011996621453406362,254.0,2.0,0.15869086642715013,36.0,0.8099085529881075,1000,,COMPLETE
4,81001.35905943914,2026-06-24 23:37:45.815346,2026-06-24 23:37:50.308379,0 days 00:00:04.493033,Plain,Bernoulli,0.9526349539768235,4.0,SymmetricTree,0.011702088154220882,1.0,0.08580222514877409,254.0,5.0,0.10975998502129433,27.0,0.9896896099223678,482,,COMPLETE
5,78860.48619851026,2026-06-24 23:37:50.319510,2026-06-24 23:38:56.587785,0 days 00:01:06.268275,Plain,Bernoulli,0.877728168328829,6.0,Depthwise,3.597899951374983,9.0,0.010855517271883068,254.0,4.0,1.128232550122133,86.0,0.8987566853061946,1000,,COMPLETE
6,80650.645500765,2026-06-24 23:38:56.596787,2026-06-24 23:39:02.042239,0 days 00:00:05.445452,Plain,Bernoulli,0.9083015934534223,5.0,SymmetricTree,0.001883913511943895,11.0,0.07913270952323785,254.0,4.0,0.21399549030176218,19.0,0.7265477506155759,327,,COMPLETE
7,79083.7703462592,2026-06-24 23:39:02.053353,2026-06-24 23:41:08.812853,0 days 00:02:06.759500,Plain,Bernoulli,0.8798073522301258,7.0,Depthwise,0.00010615690854925657,10.0,0.007626348515257587,254.0,5.0,0.7200770311577639,47.0,0.9406590942262119,1000,,COMPLETE
8,78957.28110181591,2026-06-24 23:41:08.823483,2026-06-24 23:43:21.964971,0 days 00:02:13.141488,Plain,Bernoulli,0.8996347037278973,7.0,Depthwise,0.00019891099118865958,2.0,0.006241720498669827,254.0,4.0,0.7212460519889856,17.0,0.8075397185632818,1000,,COMPLETE
9,81425.65661951293,2026-06-24 23:43:21.975577,2026-06-24 23:43:54.470413,0 days 00:00:32.494836,Plain,Bernoulli,0.9341915796354244,7.0,Depthwise,0.4195190175255899,3.0,0.07132805718188966,254.0,2.0,0.318293122389662,29.0,0.8416644775485848,334,,COMPLETE
10,79394.20852171087,2026-06-24 23:43:54.481484,2026-06-24 23:44:33.357623,0 days 00:00:38.876139,Plain,Bernoulli,0.9942739726130633,8.0,SymmetricTree,0.0025843128549611844,18.0,0.027075555569701922,254.0,3.0,1.3180934075316322,8.0,0.701799154886745,1000,,COMPLETE
11,78321.13396003864,2026-06-24 23:44:33.366942,2026-06-24 23:44:57.130135,0 days 00:00:23.763193,Plain,Bernoulli,0.8547148908686132,6.0,SymmetricTree,2.4898729835966105,6.0,0.017220169277036748,254.0,3.0,1.3260386311938197,100.0,0.8852363418979063,1000,,COMPLETE
12,78472.48306295997,2026-06-24 23:44:57.143522,2026-06-24 23:45:11.732232,0 days 00:00:14.588710,Plain,Bernoulli,0.8523755911255017,5.0,SymmetricTree,4.3141335635717635,5.0,0.022990961643687132,254.0,3.0,1.4583774727583452,99.0,0.8726916867113359,1000,,COMPLETE
13,78804.82658857843,2026-06-24 23:45:11.742250,2026-06-24 23:45:27.414730,0 days 00:00:15.672480,Plain,Bernoulli,0.8541956403746939,6.0,SymmetricTree,4.941838852582691,5.0,0.02711641797158028,254.0,3.0,1.4799673007959433,92.0,0.876436686592867,694,,COMPLETE
14,79161.58855493431,2026-06-24 23:45:27.423631,2026-06-24 23:45:39.989056,0 days 00:00:12.565425,Plain,Bernoulli,0.8541174300973556,5.0,SymmetricTree,0.7516527633769301,5.0,0.026834132137647897,254.0,3.0,1.0132489868046672,63.0,0.8891860265869109,1000,,COMPLETE
15,79479.77266158063,2026-06-24 23:45:39.998531,2026-06-24 23:45:48.296339,0 days 00:00:08.297808,Plain,Bernoulli,0.8507110179479634,5.0,SymmetricTree,0.7757959394658933,5.0,0.0443133055089301,254.0,3.0,0.9389792300154784,65.0,0.8392499488134854,593,,COMPLETE
16,78944.61509696812,2026-06-24 23:45:48.305521,2026-06-24 23:46:07.810224,0 days 00:00:19.504703,Plain,Bernoulli,0.864766899998405,6.0,SymmetricTree,0.19154321197381433,3.0,0.01860583015494775,254.0,3.0,0.4398271249791548,92.0,0.7609524784084656,941,,COMPLETE
17,79579.28453604422,2026-06-24 23:46:07.821663,2026-06-24 23:46:18.251796,0 days 00:00:10.430133,Plain,Bernoulli,0.887026254980577,5.0,SymmetricTree,1.7440497369295562,7.0,0.04235704509488058,254.0,4.0,1.4715680357251881,64.0,0.9268961061095251,1000,,COMPLETE
18,78863.95237847071,2026-06-24 23:46:18.260728,2026-06-24 23:46:42.411841,0 days 00:00:24.151113,Plain,Bernoulli,0.8669951702329732,6.0,SymmetricTree,0.20203888278828494,20.0,0.019580914983326765,254.0,3.0,0.91087620995342,98.0,0.8505461954171024,1000,,COMPLETE
19,79849.38108534201,2026-06-24 23:46:42.422719,2026-06-24 23:47:20.268990,0 days 00:00:37.846271,Plain,Bernoulli,0.9121968032086688,8.0,SymmetricTree,1.7533395229912454,3.0,0.038069884211763945,254.0,4.0,0.5135561952604613,56.0,0.7884092592824421,1000,,COMPLETE
20,78927.62078111967,2026-06-24 23:47:20.278638,2026-06-24 23:47:40.566332,0 days 00:00:20.287694,Plain,Bernoulli,0.9924443382121897,5.0,SymmetricTree,1.976450019255842,7.0,0.009606895209437378,254.0,3.0,1.0771092764151144,73.0,0.9052980075146653,1000,,COMPLETE
21,79042.1302291721,2026-06-24 23:47:40.575565,2026-06-24 23:47:59.954762,0 days 00:00:19.379197,Plain,Bernoulli,0.8521498183584634,6.0,SymmetricTree,4.864977143985637,5.0,0.02420724886938078,254.0,3.0,1.431612154278977,98.0,0.872744478256631,1000,,COMPLETE
22,78692.53846075574,2026-06-24 23:47:59.965649,2026-06-24 23:48:24.641009,0 days 00:00:24.675360,Plain,Bernoulli,0.8615673254289361,6.0,SymmetricTree,3.539701424948635,4.0,0.015847657295443154,254.0,3.0,1.2643520764184608,78.0,0.8710165855748508,1000,,COMPLETE
23,78962.36776875652,2026-06-24 23:48:24.650244,2026-06-24 23:49:09.212573,0 days 00:00:44.562329,Plain,Bernoulli,0.8672925374207419,7.0,SymmetricTree,1.0452250449727332,2.0,0.014257913757463573,254.0,2.0,0.8400496226933426,51.0,0.8525069620060415,1000,,COMPLETE
24,78813.31869717974,2026-06-24 23:49:09.222856,2026-06-24 23:49:29.059307,0 days 00:00:19.836451,Plain,Bernoulli,0.8880659259495767,6.0,SymmetricTree,0.3259375963242455,4.0,0.01901094467372566,254.0,3.0,1.1965935601449742,76.0,0.9180464638342315,1000,,COMPLETE
25,78858.2161157298,2026-06-24 23:49:29.068478,2026-06-24 23:49:39.179010,0 days 00:00:10.110532,Plain,Bernoulli,0.8642764530515297,5.0,SymmetricTree,1.960752278339964,7.0,0.03502510231980833,254.0,4.0,1.1300287861398308,44.0,0.960429607909195,576,,COMPLETE
