Trial 46 finished with value: 0.9447978877747305 and parameters: {'learning_rate': 0.02895826708847353, 'max_depth': 9, 'min_child_weight': 2.9791767132480107, 'subsample': 0.8411418933565945, 'colsample_bylevel': 0.649687604060296, 'colsample_bynode': 0.9048679736842785, 'reg_alpha': 0.6557670390037789, 'reg_lambda': 4.1759357093361515, 'grow_policy': 'lossguide', 'max_cat_to_onehot': 53, 'max_leaves': 8}. Best is trial 41 with value: 0.9481659110144433.
Trial 47 finished with value: 0.9463130010158677 and parameters: {'learning_rate': 0.03877233000539898, 'max_depth': 4, 'min_child_weight': 0.20388575901492043, 'subsample': 0.8642169727616136, 'colsample_bylevel': 0.6832249532451025, 'colsample_bynode': 0.8701879503708219, 'reg_alpha': 1.6187872776143675, 'reg_lambda': 4.743257397296873, 'grow_policy': 'depthwise', 'max_cat_to_onehot': 66, 'max_leaves': 11}. Best is trial 41 with value: 0.9481659110144433.
Trial 48 finished with value: 0.9454221799236742 and parameters: {'learning_rate': 0.07020390224148022, 'max_depth': 5, 'min_child_weight': 0.0017291835025353358, 'subsample': 0.819324704508128, 'colsample_bylevel': 0.7214285991971437, 'colsample_bynode': 0.7804931007110135, 'reg_alpha': 1.3815890163520441, 'reg_lambda': 3.495529809848791, 'grow_policy': 'lossguide', 'max_cat_to_onehot': 25, 'max_leaves': 43}. Best is trial 41 with value: 0.9481659110144433.
Trial 49 finished with value: 0.9466342074435236 and parameters: {'learning_rate': 0.03449651180802643, 'max_depth': 6, 'min_child_weight': 4.638519213553987, 'subsample': 0.8956030003686004, 'colsample_bylevel': 0.6482009301968853, 'colsample_bynode': 0.7243159335188741, 'reg_alpha': 1.0277765217833348, 'reg_lambda': 3.6774357870915995, 'grow_policy': 'depthwise', 'max_cat_to_onehot': 43, 'max_leaves': 125}. Best is trial 41 with value: 0.9481659110144433.
Optuna Search Completed in: 408.18 seconds

Training final model on optimized parameter setup...

[XGBOOST FINALIZED METRICS]
Optimal Trees:         627
ROC_AUC:             0.9268 (Delta to TabPFN: +0.0126)
Accuracy:            0.9740 (Delta to TabPFN: +0.0000)
Final Train Time:      0.73 seconds

--- XGBOOST Feature Importance (Raw vs. Scaled Share) ---
Feature | Raw gain | Share
pca_embed_0 | 18809.99 | 32.80%
pca_embed_5 | 10762.33 | 18.77%
pca_embed_1 | 7530.55 | 13.13%
pca_embed_2 | 3115.48 | 5.43%
pca_embed_3 | 2010.80 | 3.51%
pca_embed_16 | 1829.31 | 3.19%
pca_embed_4 | 1461.98 | 2.55%
international_plan | 1058.96 | 1.85%
total_day_minutes | 947.62 | 1.65%
pca_embed_10 | 901.35 | 1.57%
pca_embed_12 | 722.87 | 1.26%
pca_embed_9 | 697.31 | 1.22%
pca_embed_8 | 561.24 | 0.98%
pca_embed_17 | 558.24 | 0.97%
number_customer_service_calls | 473.58 | 0.83%
pca_embed_11 | 464.84 | 0.81%
pca_embed_7 | 461.16 | 0.80%
pca_embed_18 | 423.63 | 0.74%
pca_embed_14 | 336.72 | 0.59%
total_eve_minutes | 319.66 | 0.56%
pca_embed_13 | 311.46 | 0.54%
voice_mail_plan | 308.39 | 0.54%
pca_embed_15 | 307.41 | 0.54%
total_intl_minutes | 294.70 | 0.51%
total_night_calls | 272.20 | 0.47%
total_day_calls | 267.81 | 0.47%
total_night_minutes | 263.95 | 0.46%
total_eve_calls | 258.79 | 0.45%
pca_embed_6 | 247.89 | 0.43%
number_vmail_messages | 244.31 | 0.43%
account_length | 238.29 | 0.42%
total_day_charge | 223.81 | 0.39%
total_night_charge | 185.41 | 0.32%
total_eve_charge | 178.30 | 0.31%
total_intl_charge | 139.01 | 0.24%
total_intl_calls | 83.11 | 0.14%
area_code | 41.62 | 0.07%
state | 29.55 | 0.05%

=====================================================================
METRIC TYPE                                  | VALUE / PROFILE
=====================================================================
Macro Embedding Share                        | 89.83%
Macro Raw Feature Share                      | 10.17%
---------------------------------------------------------------------
Active Text Embedding Density            | 100.00% (19/19)
Active Raw Tabular Feature Density       | 100.00% (19/19)
---------------------------------------------------------------------
Top-5 Concentration Ratio (CR5)          | 73.64% of total decision weight
Top-10 Concentration Ratio (CR10)        | 84.45% of total decision weight
=====================================================================

Total Pipeline Execution Time: 411.89 seconds

[SUCCESS] Permanent artifacts safely written to 'outputs/1/results/'
