Loading archive 'archives/churn.npz' and initializing pipeline for target: XGBOOST...
Execution Mode: COMBINED
Session Output Target: outputs/1/
Task Type: BINARY
TabPFN Baselines Loaded - Primary: 0.9142 | Secondary: 0.9740
PCA reduced text embeddings to 19 components.
Final training matrix shape assembled for COMBINED: (4000, 38)

Running 50-Trial Optuna Study for XGBOOST (COMBINED)...
A new study created in RDB with name: 20260618_214248_xgboost_combined_churn
Trial 0 finished with value: 0.9439259697241364 and parameters: {'learning_rate': 0.015355286838886862, 'max_depth': 10, 'min_child_weight': 0.5100627805979911, 'subsample': 0.8394633936788146, 'colsample_bylevel': 0.6624074561769746, 'colsample_bynode': 0.662397808134481, 'reg_alpha': 0.29051225247978046, 'reg_lambda': 4.330894111260099, 'grow_policy': 'lossguide', 'max_cat_to_onehot': 8, 'max_leaves': 884}. Best is trial 0 with value: 0.9439259697241364.
Trial 1 finished with value: 0.9467858597085511 and parameters: {'learning_rate': 0.060534484680010825, 'max_depth': 4, 'min_child_weight': 0.004705059281907645, 'subsample': 0.6733618039413735, 'colsample_bylevel': 0.7216968971838151, 'colsample_bynode': 0.8099025726528951, 'reg_alpha': 2.1597818987087147, 'reg_lambda': 1.4562165780761898, 'grow_policy': 'depthwise', 'max_cat_to_onehot': 16, 'max_leaves': 45}. Best is trial 1 with value: 0.9467858597085511.
Trial 2 finished with value: 0.9468717721938955 and parameters: {'learning_rate': 0.019603369861210685, 'max_depth': 8, 'min_child_weight': 0.005477562363971304, 'subsample': 0.8056937753654446, 'colsample_bylevel': 0.836965827544817, 'colsample_bynode': 0.6185801650879991, 'reg_alpha': 3.037763505022002, 'reg_lambda': 0.8527035660240889, 'grow_policy': 'lossguide', 'max_cat_to_onehot': 92, 'max_leaves': 399}. Best is trial 2 with value: 0.9468717721938955.
Trial 3 finished with value: 0.9397697057886049 and parameters: {'learning_rate': 0.012453219846912198, 'max_depth': 4, 'min_child_weight': 0.33959199243313637, 'subsample': 0.7760609974958406, 'colsample_bylevel': 0.6488152939379115, 'colsample_bynode': 0.798070764044508, 'reg_alpha': 0.17203916672398045, 'reg_lambda': 4.546611078353703, 'grow_policy': 'lossguide', 'max_cat_to_onehot': 17, 'max_leaves': 97}. Best is trial 2 with value: 0.9468717721938955.
Trial 4 finished with value: 0.9441509564294286 and parameters: {'learning_rate': 0.025719142025384646, 'max_depth': 4, 'min_child_weight': 3.8589082671053854, 'subsample': 0.9100531293444458, 'colsample_bylevel': 0.9757995766256756, 'colsample_bynode': 0.9579309401710595, 'reg_alpha': 2.989540104057545, 'reg_lambda': 4.609378987692081, 'grow_policy': 'lossguide', 'max_cat_to_onehot': 8, 'max_leaves': 37}. Best is trial 2 with value: 0.9468717721938955.
Trial 5 finished with value: 0.9470982599233773 and parameters: {'learning_rate': 0.016019568611465234, 'max_depth': 5, 'min_child_weight': 1.1627201204016835, 'subsample': 0.7427013306774357, 'colsample_bylevel': 0.7123738038749523, 'colsample_bynode': 0.8170784332632994, 'reg_alpha': 0.7047070324513158, 'reg_lambda': 4.011004684072123, 'grow_policy': 'lossguide', 'max_cat_to_onehot': 56, 'max_leaves': 20}. Best is trial 5 with value: 0.9470982599233773.
Trial 6 finished with value: 0.9394195001823871 and parameters: {'learning_rate': 0.0050834018700114374, 'max_depth': 9, 'min_child_weight': 0.4117599592262879, 'subsample': 0.8916028672163949, 'colsample_bylevel': 0.9085081386743783, 'colsample_bynode': 0.6296178606936361, 'reg_alpha': 1.7923927961485087, 'reg_lambda': 0.5794337107196961, 'grow_policy': 'depthwise', 'max_cat_to_onehot': 18, 'max_leaves': 10}. Best is trial 5 with value: 0.9470982599233773.
Trial 7 finished with value: 0.9475143919984207 and parameters: {'learning_rate': 0.012693089228250284, 'max_depth': 5, 'min_child_weight': 0.49979438035802604, 'subsample': 0.8550229885420852, 'colsample_bylevel': 0.9548850970305306, 'colsample_bynode': 0.7888859700647797, 'reg_alpha': 0.5980592702669147, 'reg_lambda': 3.566252611636253, 'grow_policy': 'depthwise', 'max_cat_to_onehot': 55, 'max_leaves': 85}. Best is trial 7 with value: 0.9475143919984207.
Trial 8 finished with value: 0.9452362724246793 and parameters: {'learning_rate': 0.02393652463662192, 'max_depth': 6, 'min_child_weight': 0.0012417226051008223, 'subsample': 0.6431565707973218, 'colsample_bylevel': 0.6125716742746937, 'colsample_bynode': 0.8545641645055122, 'reg_alpha': 1.5718484697835258, 'reg_lambda': 2.542902598754398, 'grow_policy': 'depthwise', 'max_cat_to_onehot': 22, 'max_leaves': 308}. Best is trial 7 with value: 0.9475143919984207.
Trial 9 finished with value: 0.9282013984362827 and parameters: {'learning_rate': 0.009923006608672534, 'max_depth': 4, 'min_child_weight': 0.011797281245016885, 'subsample': 0.6644885149016018, 'colsample_bylevel': 0.9718790609370292, 'colsample_bynode': 0.9232481518257668, 'reg_alpha': 3.1670554421764665, 'reg_lambda': 4.35731580487957, 'grow_policy': 'depthwise', 'max_cat_to_onehot': 76, 'max_leaves': 106}. Best is trial 7 with value: 0.9475143919984207.
Trial 10 finished with value: 0.943405709383291 and parameters: {'learning_rate': 0.08641869155550744, 'max_depth': 7, 'min_child_weight': 0.05520191203895588, 'subsample': 0.9729161367647149, 'colsample_bylevel': 0.8197534695371591, 'colsample_bynode': 0.7202259292197385, 'reg_alpha': 4.7988577526525065, 'reg_lambda': 2.938272016159444, 'grow_policy': 'depthwise', 'max_cat_to_onehot': 38, 'max_leaves': 9}. Best is trial 7 with value: 0.9475143919984207.
Trial 11 finished with value: 0.9432584560244198 and parameters: {'learning_rate': 0.007265971125856864, 'max_depth': 5, 'min_child_weight': 4.6723067682627075, 'subsample': 0.7381137674739325, 'colsample_bylevel': 0.7476913183222175, 'colsample_bynode': 0.7708449222533328, 'reg_alpha': 0.9641094099774248, 'reg_lambda': 3.2410945373579265, 'grow_policy': 'lossguide', 'max_cat_to_onehot': 51, 'max_leaves': 25}. Best is trial 7 with value: 0.9475143919984207.
Trial 12 finished with value: 0.943555522231527 and parameters: {'learning_rate': 0.03926563841225128, 'max_depth': 5, 'min_child_weight': 1.1692924670454259, 'subsample': 0.7299041874638382, 'colsample_bylevel': 0.8657791232703632, 'colsample_bynode': 0.8847911208853647, 'reg_alpha': 0.9377444039036937, 'reg_lambda': 3.690465616670249, 'grow_policy': 'lossguide', 'max_cat_to_onehot': 47, 'max_leaves': 86}. Best is trial 7 with value: 0.9475143919984207.
Trial 13 finished with value: 0.9443782076176852 and parameters: {'learning_rate': 0.00906444097976681, 'max_depth': 5, 'min_child_weight': 0.083010851978711, 'subsample': 0.8595724924347362, 'colsample_bylevel': 0.7676420307638638, 'colsample_bynode': 0.7275691352884314, 'reg_alpha': 0.8626993187695151, 'reg_lambda': 2.1628087272886978, 'grow_policy': 'depthwise', 'max_cat_to_onehot': 32, 'max_leaves': 19}. Best is trial 7 with value: 0.9475143919984207.
Trial 14 finished with value: 0.9472279889137761 and parameters: {'learning_rate': 0.03603551866269189, 'max_depth': 6, 'min_child_weight': 0.13925071458840985, 'subsample': 0.6030297679596901, 'colsample_bylevel': 0.9037033513077797, 'colsample_bynode': 0.8478593036227312, 'reg_alpha': 0.2670696293404993, 'reg_lambda': 3.7007244376422093, 'grow_policy': 'depthwise', 'max_cat_to_onehot': 64, 'max_leaves': 168}. Best is trial 7 with value: 0.9475143919984207.
Trial 15 finished with value: 0.9458586776197869 and parameters: {'learning_rate': 0.041623526501032425, 'max_depth': 6, 'min_child_weight': 0.08937721702630358, 'subsample': 0.6025532477327051, 'colsample_bylevel': 0.91239882733399, 'colsample_bynode': 0.9896216576281744, 'reg_alpha': 0.1361924100533458, 'reg_lambda': 3.5062331016368598, 'grow_policy': 'depthwise', 'max_cat_to_onehot': 70, 'max_leaves': 233}. Best is trial 7 with value: 0.9475143919984207.
Trial 16 finished with value: 0.9468025905740461 and parameters: {'learning_rate': 0.033811383117528473, 'max_depth': 6, 'min_child_weight': 0.026490999760491216, 'subsample': 0.9628909156117286, 'colsample_bylevel': 0.9997930060702714, 'colsample_bynode': 0.8758435069458204, 'reg_alpha': 1.4682470529255425, 'reg_lambda': 2.0675380653753144, 'grow_policy': 'depthwise', 'max_cat_to_onehot': 30, 'max_leaves': 183}. Best is trial 7 with value: 0.9475143919984207.
Trial 17 finished with value: 0.9463802103919233 and parameters: {'learning_rate': 0.059531822519558, 'max_depth': 7, 'min_child_weight': 0.17707907160229652, 'subsample': 0.9323056647301382, 'colsample_bylevel': 0.9212844518088551, 'colsample_bynode': 0.7425452393980401, 'reg_alpha': 2.428724988569137, 'reg_lambda': 4.956386852998385, 'grow_policy': 'depthwise', 'max_cat_to_onehot': 100, 'max_leaves': 598}. Best is trial 7 with value: 0.9475143919984207.
Trial 18 finished with value: 0.946044887833892 and parameters: {'learning_rate': 0.09923933355769515, 'max_depth': 7, 'min_child_weight': 1.3148773819954953, 'subsample': 0.9956280166514846, 'colsample_bylevel': 0.9437177608251542, 'colsample_bynode': 0.843846913639172, 'reg_alpha': 4.640521530877541, 'reg_lambda': 2.6709409359651977, 'grow_policy': 'depthwise', 'max_cat_to_onehot': 59, 'max_leaves': 62}. Best is trial 7 with value: 0.9475143919984207.
Trial 19 finished with value: 0.9422337055843677 and parameters: {'learning_rate': 0.005009749281998704, 'max_depth': 6, 'min_child_weight': 0.16160334436765317, 'subsample': 0.7018058809573449, 'colsample_bylevel': 0.8773355491720513, 'colsample_bynode': 0.6831076004510133, 'reg_alpha': 0.5288929498802717, 'reg_lambda': 0.08689028168849333, 'grow_policy': 'depthwise', 'max_cat_to_onehot': 41, 'max_leaves': 158}. Best is trial 7 with value: 0.9475143919984207.
Trial 20 finished with value: 0.9457636562065026 and parameters: {'learning_rate': 0.054343058680638254, 'max_depth': 5, 'min_child_weight': 0.03103839052352024, 'subsample': 0.8169425316087808, 'colsample_bylevel': 0.8086096508636509, 'colsample_bynode': 0.9259454362738012, 'reg_alpha': 1.3127214124147408, 'reg_lambda': 3.8568175065322032, 'grow_policy': 'depthwise', 'max_cat_to_onehot': 72, 'max_leaves': 140}. Best is trial 7 with value: 0.9475143919984207.
Trial 21 finished with value: 0.944835918991792 and parameters: {'learning_rate': 0.015651750708814208, 'max_depth': 5, 'min_child_weight': 1.4217031672398663, 'subsample': 0.6057575681173106, 'colsample_bylevel': 0.6974040046404777, 'colsample_bynode': 0.8198626169348787, 'reg_alpha': 0.6012024509469651, 'reg_lambda': 3.9382671521122625, 'grow_policy': 'lossguide', 'max_cat_to_onehot': 56, 'max_leaves': 17}. Best is trial 7 with value: 0.9475143919984207.
Trial 22 finished with value: 0.9466109355399709 and parameters: {'learning_rate': 0.027817699984184863, 'max_depth': 5, 'min_child_weight': 0.25849092348941927, 'subsample': 0.7678615545853775, 'colsample_bylevel': 0.8760977632791143, 'colsample_bynode': 0.7706998964349969, 'reg_alpha': 0.8504951890007526, 'reg_lambda': 3.294522632875486, 'grow_policy': 'lossguide', 'max_cat_to_onehot': 72, 'max_leaves': 59}. Best is trial 7 with value: 0.9475143919984207.
Trial 23 finished with value: 0.947337713703007 and parameters: {'learning_rate': 0.01637390608033187, 'max_depth': 6, 'min_child_weight': 0.6973480657262014, 'subsample': 0.8630826230398995, 'colsample_bylevel': 0.7741686384095295, 'colsample_bynode': 0.7780791207356286, 'reg_alpha': 1.2292564941219453, 'reg_lambda': 4.14963163142869, 'grow_policy': 'lossguide', 'max_cat_to_onehot': 33, 'max_leaves': 24}. Best is trial 7 with value: 0.9475143919984207.
Trial 24 finished with value: 0.9421251616113746 and parameters: {'learning_rate': 0.011584054612692995, 'max_depth': 6, 'min_child_weight': 0.6346694217657802, 'subsample': 0.8742977577155705, 'colsample_bylevel': 0.7858941255436765, 'colsample_bynode': 0.7745635711997276, 'reg_alpha': 0.008500137967593635, 'reg_lambda': 3.047506401690456, 'grow_policy': 'depthwise', 'max_cat_to_onehot': 26, 'max_leaves': 33}. Best is trial 7 with value: 0.9475143919984207.
Trial 25 finished with value: 0.9455684537822329 and parameters: {'learning_rate': 0.02148368987780189, 'max_depth': 7, 'min_child_weight': 2.015232753786131, 'subsample': 0.926070092130924, 'colsample_bylevel': 0.9468850053263496, 'colsample_bynode': 0.7004413291539467, 'reg_alpha': 1.1693861005880484, 'reg_lambda': 4.914809944601021, 'grow_policy': 'depthwise', 'max_cat_to_onehot': 37, 'max_leaves': 66}. Best is trial 7 with value: 0.9475143919984207.
Trial 26 finished with value: 0.9463614506532654 and parameters: {'learning_rate': 0.007104984944976344, 'max_depth': 8, 'min_child_weight': 0.14217980470533007, 'subsample': 0.8400964659005544, 'colsample_bylevel': 0.8509808405781523, 'colsample_bynode': 0.8868421704055203, 'reg_alpha': 1.7241384230399766, 'reg_lambda': 3.5604632103584217, 'grow_policy': 'lossguide', 'max_cat_to_onehot': 12, 'max_leaves': 270}. Best is trial 7 with value: 0.9475143919984207.
Trial 27 finished with value: 0.9468553999810725 and parameters: {'learning_rate': 0.018120142510899086, 'max_depth': 6, 'min_child_weight': 0.7946758986691769, 'subsample': 0.7980340222595339, 'colsample_bylevel': 0.8971063510076088, 'colsample_bynode': 0.7541320210350736, 'reg_alpha': 2.132646325651817, 'reg_lambda': 4.168919358329142, 'grow_policy': 'depthwise', 'max_cat_to_onehot': 48, 'max_leaves': 13}. Best is trial 7 with value: 0.9475143919984207.
Trial 28 finished with value: 0.9437933050988588 and parameters: {'learning_rate': 0.03113070393721218, 'max_depth': 6, 'min_child_weight': 2.7992574102315206, 'subsample': 0.7114743996887809, 'colsample_bylevel': 0.9944320805267332, 'colsample_bynode': 0.8472885282769654, 'reg_alpha': 3.8751126742149413, 'reg_lambda': 2.697004611111322, 'grow_policy': 'lossguide', 'max_cat_to_onehot': 25, 'max_leaves': 453}. Best is trial 7 with value: 0.9475143919984207.
Trial 29 finished with value: 0.94264365665764 and parameters: {'learning_rate': 0.012673733455863943, 'max_depth': 8, 'min_child_weight': 0.5311994281345189, 'subsample': 0.8399488930253045, 'colsample_bylevel': 0.9424197444316152, 'colsample_bynode': 0.6657941597272262, 'reg_alpha': 0.2904969302304313, 'reg_lambda': 4.196540516207413, 'grow_policy': 'lossguide', 'max_cat_to_onehot': 41, 'max_leaves': 800}. Best is trial 7 with value: 0.9475143919984207.
Trial 30 finished with value: 0.942158710015937 and parameters: {'learning_rate': 0.008312802644976903, 'max_depth': 10, 'min_child_weight': 0.04281815434052359, 'subsample': 0.884721678789128, 'colsample_bylevel': 0.6665715100093754, 'colsample_bynode': 0.7941863149435143, 'reg_alpha': 0.46591121012828113, 'reg_lambda': 4.54386113972364, 'grow_policy': 'depthwise', 'max_cat_to_onehot': 32, 'max_leaves': 117}. Best is trial 7 with value: 0.9475143919984207.
Trial 31 finished with value: 0.9457880040680721 and parameters: {'learning_rate': 0.015728451767115844, 'max_depth': 5, 'min_child_weight': 0.7901215288360276, 'subsample': 0.6365712970733188, 'colsample_bylevel': 0.7289882670843939, 'colsample_bynode': 0.8253268386629763, 'reg_alpha': 0.6633288243328062, 'reg_lambda': 4.011827228367338, 'grow_policy': 'lossguide', 'max_cat_to_onehot': 60, 'max_leaves': 24}. Best is trial 7 with value: 0.9475143919984207.
Trial 32 finished with value: 0.9470035223487472 and parameters: {'learning_rate': 0.014277188425281983, 'max_depth': 5, 'min_child_weight': 0.23227028433326222, 'subsample': 0.765174491647099, 'colsample_bylevel': 0.7928181458384137, 'colsample_bynode': 0.7996857963073067, 'reg_alpha': 1.2361798079177517, 'reg_lambda': 3.6137080516259985, 'grow_policy': 'lossguide', 'max_cat_to_onehot': 80, 'max_leaves': 44}. Best is trial 7 with value: 0.9475143919984207.
Trial 33 finished with value: 0.9459930886631882 and parameters: {'learning_rate': 0.02105674491612442, 'max_depth': 4, 'min_child_weight': 2.0776020303600067, 'subsample': 0.6835684569462417, 'colsample_bylevel': 0.6953010112743017, 'colsample_bynode': 0.8280998427268167, 'reg_alpha': 0.42647900520798127, 'reg_lambda': 3.3560674082233426, 'grow_policy': 'lossguide', 'max_cat_to_onehot': 62, 'max_leaves': 14}. Best is trial 7 with value: 0.9475143919984207.
Trial 34 finished with value: 0.946780224740402 and parameters: {'learning_rate': 0.017243100045058503, 'max_depth': 5, 'min_child_weight': 0.35389256299438476, 'subsample': 0.8172177365153427, 'colsample_bylevel': 0.7465773401694825, 'colsample_bynode': 0.9141260042714653, 'reg_alpha': 1.9126220580123399, 'reg_lambda': 3.78234815997374, 'grow_policy': 'lossguide', 'max_cat_to_onehot': 86, 'max_leaves': 21}. Best is trial 7 with value: 0.9475143919984207.
Trial 35 finished with value: 0.9454646093550846 and parameters: {'learning_rate': 0.011338641792580581, 'max_depth': 4, 'min_child_weight': 0.09388339057169258, 'subsample': 0.7916329634361271, 'colsample_bylevel': 0.6987930052804414, 'colsample_bynode': 0.7883396577896151, 'reg_alpha': 1.1161665797198188, 'reg_lambda': 4.6445794389542705, 'grow_policy': 'lossguide', 'max_cat_to_onehot': 46, 'max_leaves': 34}. Best is trial 7 with value: 0.9475143919984207.
Trial 36 finished with value: 0.9472765902546326 and parameters: {'learning_rate': 0.013609377211265703, 'max_depth': 6, 'min_child_weight': 0.7824202910286555, 'subsample': 0.8570736318302115, 'colsample_bylevel': 0.6347153886242395, 'colsample_bynode': 0.8664027906259945, 'reg_alpha': 0.7190201361957164, 'reg_lambda': 4.329018358764072, 'grow_policy': 'lossguide', 'max_cat_to_onehot': 53, 'max_leaves': 12}. Best is trial 7 with value: 0.9475143919984207.
Trial 37 finished with value: 0.9459637672012524 and parameters: {'learning_rate': 0.047578662089237715, 'max_depth': 7, 'min_child_weight': 0.303535514172176, 'subsample': 0.9088916199598134, 'colsample_bylevel': 0.6029058061745126, 'colsample_bynode': 0.8638733241109805, 'reg_alpha': 2.5649345902508713, 'reg_lambda': 4.3665616546174455, 'grow_policy': 'lossguide', 'max_cat_to_onehot': 65, 'max_leaves': 8}. Best is trial 7 with value: 0.9475143919984207.
Trial 38 finished with value: 0.9403709539350877 and parameters: {'learning_rate': 0.012961368427315198, 'max_depth': 6, 'min_child_weight': 0.5100791655167451, 'subsample': 0.8602665056681633, 'colsample_bylevel': 0.6359444803907027, 'colsample_bynode': 0.8945002417159371, 'reg_alpha': 0.011748445445071698, 'reg_lambda': 4.754833755696092, 'grow_policy': 'depthwise', 'max_cat_to_onehot': 13, 'max_leaves': 11}. Best is trial 7 with value: 0.9475143919984207.
Trial 39 finished with value: 0.932807905290758 and parameters: {'learning_rate': 0.006386888686740689, 'max_depth': 6, 'min_child_weight': 0.8334772089410862, 'subsample': 0.9431431387061668, 'colsample_bylevel': 0.6642745079204068, 'colsample_bynode': 0.8332059971846223, 'reg_alpha': 1.4802639594704365, 'reg_lambda': 1.4481426692131585, 'grow_policy': 'lossguide', 'max_cat_to_onehot': 35, 'max_leaves': 82}. Best is trial 7 with value: 0.9475143919984207.
Trial 40 finished with value: 0.9329280562090352 and parameters: {'learning_rate': 0.01026551393867825, 'max_depth': 7, 'min_child_weight': 0.01021032333933329, 'subsample': 0.9024555173447606, 'colsample_bylevel': 0.8324690579176736, 'colsample_bynode': 0.9582865830246412, 'reg_alpha': 0.3349310963787161, 'reg_lambda': 4.135723838883828, 'grow_policy': 'depthwise', 'max_cat_to_onehot': 20, 'max_leaves': 195}. Best is trial 7 with value: 0.9475143919984207.
Trial 41 finished with value: 0.9481659110144433 and parameters: {'learning_rate': 0.022273476376458653, 'max_depth': 4, 'min_child_weight': 1.2504646532437993, 'subsample': 0.8612169191825383, 'colsample_bylevel': 0.6292834684083091, 'colsample_bynode': 0.81067600236094, 'reg_alpha': 0.6977389174292432, 'reg_lambda': 4.423071026399243, 'grow_policy': 'lossguide', 'max_cat_to_onehot': 54, 'max_leaves': 15}. Best is trial 41 with value: 0.9481659110144433.
Trial 42 finished with value: 0.9464615771103038 and parameters: {'learning_rate': 0.02356678135116808, 'max_depth': 4, 'min_child_weight': 2.736823606610448, 'subsample': 0.8564679148750185, 'colsample_bylevel': 0.6309514635364726, 'colsample_bynode': 0.8070333724610598, 'reg_alpha': 0.7561859096889416, 'reg_lambda': 4.4005766490632245, 'grow_policy': 'lossguide', 'max_cat_to_onehot': 50, 'max_leaves': 15}. Best is trial 41 with value: 0.9481659110144433.
Trial 43 finished with value: 0.9458583287512464 and parameters: {'learning_rate': 0.019302301366800417, 'max_depth': 4, 'min_child_weight': 0.4172973462452833, 'subsample': 0.82896539573069, 'colsample_bylevel': 0.6203850299200013, 'colsample_bynode': 0.855674890245233, 'reg_alpha': 1.1142111012749398, 'reg_lambda': 3.862771083970058, 'grow_policy': 'lossguide', 'max_cat_to_onehot': 43, 'max_leaves': 12}. Best is trial 41 with value: 0.9481659110144433.
Trial 44 finished with value: 0.9467020774955545 and parameters: {'learning_rate': 0.026584265926994047, 'max_depth': 4, 'min_child_weight': 1.7604738750077713, 'subsample': 0.8812586191391717, 'colsample_bylevel': 0.674727085291904, 'colsample_bynode': 0.7508975531347586, 'reg_alpha': 0.2746507955734196, 'reg_lambda': 3.042892414540275, 'grow_policy': 'lossguide', 'max_cat_to_onehot': 52, 'max_leaves': 27}. Best is trial 41 with value: 0.9481659110144433.
Trial 45 finished with value: 0.9471598266225743 and parameters: {'learning_rate': 0.01420866597681358, 'max_depth': 6, 'min_child_weight': 0.8710732509440678, 'subsample': 0.78343567872504, 'colsample_bylevel': 0.9699942421938975, 'colsample_bynode': 0.6017062594387346, 'reg_alpha': 0.9657778072448979, 'reg_lambda': 4.448692805140264, 'grow_policy': 'lossguide', 'max_cat_to_onehot': 86, 'max_leaves': 374}. Best is trial 41 with value: 0.9481659110144433.
