Trial 25 finished with value: 0.7347831861347174 and parameters: {'learning_rate': 0.007048073535244201, 'max_depth': 8, 'min_child_weight': 0.14067267898297098, 'subsample': 0.9549291159824506, 'colsample_bylevel': 0.9947647361543167, 'colsample_bynode': 0.663945874007628, 'reg_alpha': 3.913063177632239, 'reg_lambda': 0.031211490942872067, 'grow_policy': 'depthwise', 'max_cat_to_onehot': 27, 'max_leaves': 13}. Best is trial 23 with value: 0.7334609531883631.
Optuna Search Completed in: 689.17 seconds

Training final model on optimized parameter setup...

[XGBOOST FINALIZED METRICS]
Optimal Trees:         466
RMSE:             0.6714 (Delta to TabPFN: -0.0021)
R2_Score:             0.8053 (Delta to TabPFN: +0.0012)
Final Train Time:      1.50 seconds (0.3259s per 1K)
Final Infer Time:      0.00 seconds (0.0021s per 1K)

--- XGBOOST Feature Importance (Raw vs. Scaled Share) ---
Feature | Raw gain | Share
pca_embed_0 | 244316.58 | 68.23%
pca_embed_3 | 30755.02 | 8.59%
pca_embed_2 | 26656.92 | 7.44%
pca_embed_1 | 23603.07 | 6.59%
pca_embed_4 | 4591.28 | 1.28%
FCFP6_1024_867 | 3488.83 | 0.97%
pca_embed_6 | 2475.69 | 0.69%
FCFP6_1024_652 | 1677.47 | 0.47%
pca_embed_29 | 1308.51 | 0.37%
pca_embed_9 | 1193.80 | 0.33%
FCFP6_1024_82 | 800.13 | 0.22%
pca_embed_11 | 760.59 | 0.21%
pca_embed_13 | 651.04 | 0.18%
pca_embed_33 | 627.12 | 0.18%
pca_embed_20 | 610.64 | 0.17%
pca_embed_30 | 586.60 | 0.16%
FCFP6_1024_238 | 558.27 | 0.16%
FCFP6_1024_334 | 556.63 | 0.16%
pca_embed_40 | 548.89 | 0.15%
pca_embed_7 | 519.78 | 0.15%
pca_embed_14 | 504.23 | 0.14%
pca_embed_5 | 486.89 | 0.14%
FCFP6_1024_612 | 479.72 | 0.13%
pca_embed_8 | 470.49 | 0.13%
pca_embed_12 | 468.91 | 0.13%
FCFP6_1024_602 | 448.63 | 0.13%
pca_embed_10 | 371.16 | 0.10%
FCFP6_1024_617 | 369.99 | 0.10%
FCFP6_1024_275 | 351.64 | 0.10%
pca_embed_25 | 350.62 | 0.10%
pca_embed_27 | 313.32 | 0.09%
pca_embed_19 | 287.13 | 0.08%
pca_embed_36 | 268.31 | 0.07%
pca_embed_15 | 250.24 | 0.07%
pca_embed_18 | 249.08 | 0.07%
pca_embed_21 | 236.38 | 0.07%
FCFP6_1024_16 | 224.75 | 0.06%
pca_embed_31 | 218.42 | 0.06%
pca_embed_16 | 199.47 | 0.06%
pca_embed_28 | 192.49 | 0.05%
pca_embed_22 | 190.37 | 0.05%
pca_embed_32 | 189.73 | 0.05%
pca_embed_37 | 186.67 | 0.05%
pca_embed_34 | 178.50 | 0.05%
FCFP6_1024_546 | 176.30 | 0.05%
pca_embed_38 | 175.27 | 0.05%
pca_embed_17 | 173.54 | 0.05%
FCFP6_1024_473 | 171.07 | 0.05%
FCFP6_1024_112 | 146.27 | 0.04%
pca_embed_35 | 145.59 | 0.04%
pca_embed_26 | 144.49 | 0.04%
pca_embed_23 | 141.74 | 0.04%
pca_embed_39 | 137.63 | 0.04%
pca_embed_24 | 124.77 | 0.03%
FCFP6_1024_743 | 124.03 | 0.03%
FCFP6_1024_674 | 123.78 | 0.03%
FCFP6_1024_322 | 90.42 | 0.03%
FCFP6_1024_359 | 83.56 | 0.02%
FCFP6_1024_169 | 76.13 | 0.02%
FCFP6_1024_313 | 71.18 | 0.02%
FCFP6_1024_809 | 69.66 | 0.02%
FCFP6_1024_489 | 67.67 | 0.02%
FCFP6_1024_880 | 65.31 | 0.02%
FCFP6_1024_45 | 65.00 | 0.02%
FCFP6_1024_284 | 51.38 | 0.01%
FCFP6_1024_469 | 48.36 | 0.01%
FCFP6_1024_7 | 48.10 | 0.01%
FCFP6_1024_679 | 46.27 | 0.01%
FCFP6_1024_777 | 37.86 | 0.01%
FCFP6_1024_239 | 34.45 | 0.01%
FCFP6_1024_629 | 32.98 | 0.01%
FCFP6_1024_894 | 32.00 | 0.01%
FCFP6_1024_346 | 30.54 | 0.01%
FCFP6_1024_358 | 30.33 | 0.01%
FCFP6_1024_395 | 30.16 | 0.01%
FCFP6_1024_116 | 29.20 | 0.01%
FCFP6_1024_123 | 26.32 | 0.01%
FCFP6_1024_730 | 24.94 | 0.01%
FCFP6_1024_850 | 23.30 | 0.01%
FCFP6_1024_513 | 22.43 | 0.01%
FCFP6_1024_520 | 22.27 | 0.01%
FCFP6_1024_921 | 22.12 | 0.01%
FCFP6_1024_194 | 21.91 | 0.01%
FCFP6_1024_463 | 21.80 | 0.01%
FCFP6_1024_213 | 21.06 | 0.01%
FCFP6_1024_963 | 21.02 | 0.01%
FCFP6_1024_942 | 20.73 | 0.01%
FCFP6_1024_17 | 20.38 | 0.01%
FCFP6_1024_364 | 19.75 | 0.01%
FCFP6_1024_912 | 18.71 | 0.01%
FCFP6_1024_104 | 18.27 | 0.01%
FCFP6_1024_493 | 17.85 | 0.00%
FCFP6_1024_588 | 17.85 | 0.00%
FCFP6_1024_749 | 17.83 | 0.00%
FCFP6_1024_727 | 16.55 | 0.00%
FCFP6_1024_77 | 16.22 | 0.00%
FCFP6_1024_455 | 15.50 | 0.00%
FCFP6_1024_691 | 14.95 | 0.00%
FCFP6_1024_347 | 14.84 | 0.00%
FCFP6_1024_610 | 14.62 | 0.00%
FCFP6_1024_846 | 14.41 | 0.00%
FCFP6_1024_218 | 14.34 | 0.00%
FCFP6_1024_823 | 14.02 | 0.00%
FCFP6_1024_626 | 13.73 | 0.00%
FCFP6_1024_355 | 13.13 | 0.00%
FCFP6_1024_889 | 13.02 | 0.00%
FCFP6_1024_1003 | 12.96 | 0.00%
FCFP6_1024_1014 | 12.75 | 0.00%
FCFP6_1024_794 | 12.74 | 0.00%
FCFP6_1024_318 | 12.74 | 0.00%
FCFP6_1024_622 | 12.32 | 0.00%
FCFP6_1024_694 | 12.23 | 0.00%
FCFP6_1024_189 | 12.23 | 0.00%
FCFP6_1024_330 | 11.90 | 0.00%
FCFP6_1024_431 | 11.54 | 0.00%
FCFP6_1024_222 | 11.44 | 0.00%
FCFP6_1024_501 | 11.35 | 0.00%
FCFP6_1024_537 | 10.99 | 0.00%
FCFP6_1024_263 | 10.96 | 0.00%
FCFP6_1024_938 | 10.83 | 0.00%
FCFP6_1024_428 | 10.77 | 0.00%
FCFP6_1024_350 | 10.75 | 0.00%
FCFP6_1024_882 | 10.44 | 0.00%
FCFP6_1024_49 | 10.25 | 0.00%
FCFP6_1024_60 | 9.77 | 0.00%
FCFP6_1024_952 | 9.76 | 0.00%
FCFP6_1024_114 | 9.73 | 0.00%
FCFP6_1024_305 | 9.42 | 0.00%
FCFP6_1024_830 | 9.12 | 0.00%
FCFP6_1024_177 | 8.88 | 0.00%
FCFP6_1024_560 | 8.86 | 0.00%
FCFP6_1024_858 | 8.73 | 0.00%
FCFP6_1024_607 | 8.37 | 0.00%
FCFP6_1024_569 | 8.29 | 0.00%
FCFP6_1024_323 | 8.26 | 0.00%
FCFP6_1024_941 | 8.06 | 0.00%
FCFP6_1024_852 | 8.03 | 0.00%
FCFP6_1024_745 | 7.94 | 0.00%
FCFP6_1024_1012 | 7.92 | 0.00%
FCFP6_1024_8 | 7.84 | 0.00%
FCFP6_1024_47 | 7.72 | 0.00%
FCFP6_1024_164 | 7.62 | 0.00%
FCFP6_1024_598 | 7.46 | 0.00%
FCFP6_1024_778 | 7.39 | 0.00%
FCFP6_1024_838 | 7.38 | 0.00%
FCFP6_1024_423 | 7.31 | 0.00%
FCFP6_1024_861 | 7.07 | 0.00%
FCFP6_1024_811 | 7.02 | 0.00%
FCFP6_1024_902 | 6.79 | 0.00%
FCFP6_1024_536 | 6.76 | 0.00%
FCFP6_1024_690 | 6.60 | 0.00%
FCFP6_1024_196 | 6.51 | 0.00%
FCFP6_1024_729 | 6.41 | 0.00%
FCFP6_1024_816 | 6.35 | 0.00%
FCFP6_1024_697 | 6.31 | 0.00%
FCFP6_1024_158 | 6.27 | 0.00%
FCFP6_1024_217 | 6.11 | 0.00%
FCFP6_1024_184 | 6.07 | 0.00%
FCFP6_1024_24 | 6.06 | 0.00%
FCFP6_1024_180 | 6.03 | 0.00%
FCFP6_1024_919 | 5.99 | 0.00%
FCFP6_1024_707 | 5.99 | 0.00%
FCFP6_1024_6 | 5.95 | 0.00%
FCFP6_1024_245 | 5.95 | 0.00%
FCFP6_1024_724 | 5.92 | 0.00%
FCFP6_1024_214 | 5.83 | 0.00%
FCFP6_1024_405 | 5.77 | 0.00%
FCFP6_1024_985 | 5.57 | 0.00%
FCFP6_1024_199 | 5.55 | 0.00%
FCFP6_1024_655 | 5.44 | 0.00%
FCFP6_1024_109 | 5.32 | 0.00%
FCFP6_1024_505 | 5.31 | 0.00%
FCFP6_1024_507 | 5.18 | 0.00%
FCFP6_1024_181 | 5.14 | 0.00%
FCFP6_1024_207 | 5.13 | 0.00%
FCFP6_1024_124 | 4.95 | 0.00%
FCFP6_1024_1018 | 4.91 | 0.00%
FCFP6_1024_511 | 4.90 | 0.00%
FCFP6_1024_89 | 4.90 | 0.00%
FCFP6_1024_430 | 4.86 | 0.00%
FCFP6_1024_751 | 4.72 | 0.00%
FCFP6_1024_128 | 4.66 | 0.00%
FCFP6_1024_304 | 4.60 | 0.00%
FCFP6_1024_142 | 4.53 | 0.00%
FCFP6_1024_329 | 4.44 | 0.00%
FCFP6_1024_437 | 4.38 | 0.00%
FCFP6_1024_138 | 4.36 | 0.00%
FCFP6_1024_531 | 4.34 | 0.00%
FCFP6_1024_905 | 4.32 | 0.00%
FCFP6_1024_907 | 4.28 | 0.00%
FCFP6_1024_982 | 4.23 | 0.00%
FCFP6_1024_928 | 4.22 | 0.00%
FCFP6_1024_893 | 4.15 | 0.00%
FCFP6_1024_1019 | 4.15 | 0.00%
FCFP6_1024_748 | 4.10 | 0.00%
FCFP6_1024_282 | 4.10 | 0.00%
FCFP6_1024_614 | 4.08 | 0.00%
FCFP6_1024_3 | 4.02 | 0.00%
FCFP6_1024_434 | 3.86 | 0.00%
FCFP6_1024_980 | 3.86 | 0.00%
FCFP6_1024_53 | 3.73 | 0.00%
FCFP6_1024_141 | 3.72 | 0.00%
FCFP6_1024_878 | 3.71 | 0.00%
FCFP6_1024_260 | 3.68 | 0.00%
FCFP6_1024_925 | 3.67 | 0.00%
FCFP6_1024_480 | 3.66 | 0.00%
FCFP6_1024_964 | 3.66 | 0.00%
FCFP6_1024_270 | 3.62 | 0.00%
FCFP6_1024_834 | 3.56 | 0.00%
FCFP6_1024_187 | 3.53 | 0.00%
FCFP6_1024_414 | 3.49 | 0.00%
FCFP6_1024_887 | 3.34 | 0.00%
FCFP6_1024_573 | 3.25 | 0.00%
FCFP6_1024_766 | 3.24 | 0.00%
FCFP6_1024_786 | 3.12 | 0.00%
FCFP6_1024_960 | 3.11 | 0.00%
FCFP6_1024_176 | 3.09 | 0.00%
FCFP6_1024_728 | 3.07 | 0.00%
FCFP6_1024_64 | 2.99 | 0.00%
FCFP6_1024_9 | 2.99 | 0.00%
FCFP6_1024_1002 | 2.98 | 0.00%
FCFP6_1024_56 | 2.95 | 0.00%
FCFP6_1024_407 | 2.92 | 0.00%
FCFP6_1024_701 | 2.90 | 0.00%
FCFP6_1024_32 | 2.89 | 0.00%
FCFP6_1024_276 | 2.89 | 0.00%
FCFP6_1024_735 | 2.85 | 0.00%
FCFP6_1024_740 | 2.79 | 0.00%
FCFP6_1024_111 | 2.77 | 0.00%
FCFP6_1024_390 | 2.77 | 0.00%
FCFP6_1024_396 | 2.76 | 0.00%
FCFP6_1024_946 | 2.73 | 0.00%
FCFP6_1024_72 | 2.72 | 0.00%
FCFP6_1024_677 | 2.71 | 0.00%
FCFP6_1024_240 | 2.71 | 0.00%
FCFP6_1024_667 | 2.70 | 0.00%
FCFP6_1024_262 | 2.70 | 0.00%
FCFP6_1024_499 | 2.70 | 0.00%
FCFP6_1024_442 | 2.66 | 0.00%
FCFP6_1024_871 | 2.64 | 0.00%
FCFP6_1024_145 | 2.63 | 0.00%
FCFP6_1024_713 | 2.62 | 0.00%
FCFP6_1024_994 | 2.54 | 0.00%
FCFP6_1024_94 | 2.51 | 0.00%
FCFP6_1024_719 | 2.51 | 0.00%
FCFP6_1024_343 | 2.50 | 0.00%
FCFP6_1024_523 | 2.46 | 0.00%
FCFP6_1024_613 | 2.43 | 0.00%
FCFP6_1024_528 | 2.42 | 0.00%
FCFP6_1024_826 | 2.41 | 0.00%
FCFP6_1024_649 | 2.29 | 0.00%
FCFP6_1024_589 | 2.28 | 0.00%
FCFP6_1024_107 | 2.27 | 0.00%
FCFP6_1024_259 | 2.20 | 0.00%
FCFP6_1024_901 | 2.14 | 0.00%
FCFP6_1024_206 | 2.14 | 0.00%
FCFP6_1024_425 | 2.09 | 0.00%
FCFP6_1024_825 | 2.07 | 0.00%
FCFP6_1024_810 | 2.06 | 0.00%
FCFP6_1024_309 | 2.02 | 0.00%
FCFP6_1024_732 | 1.99 | 0.00%
FCFP6_1024_454 | 1.93 | 0.00%
FCFP6_1024_580 | 1.87 | 0.00%
FCFP6_1024_211 | 1.86 | 0.00%
FCFP6_1024_874 | 1.85 | 0.00%
FCFP6_1024_280 | 1.72 | 0.00%
FCFP6_1024_412 | 1.68 | 0.00%
FCFP6_1024_471 | 1.67 | 0.00%
FCFP6_1024_970 | 1.60 | 0.00%
FCFP6_1024_918 | 1.49 | 0.00%
FCFP6_1024_298 | 1.46 | 0.00%
FCFP6_1024_799 | 1.46 | 0.00%
FCFP6_1024_936 | 1.41 | 0.00%
FCFP6_1024_106 | 1.38 | 0.00%
FCFP6_1024_803 | 1.35 | 0.00%
FCFP6_1024_51 | 1.35 | 0.00%
FCFP6_1024_660 | 1.32 | 0.00%
FCFP6_1024_375 | 1.28 | 0.00%
FCFP6_1024_522 | 1.28 | 0.00%
FCFP6_1024_190 | 1.25 | 0.00%
FCFP6_1024_892 | 1.24 | 0.00%
FCFP6_1024_269 | 1.13 | 0.00%
FCFP6_1024_136 | 1.12 | 0.00%
FCFP6_1024_487 | 1.09 | 0.00%
FCFP6_1024_488 | 0.99 | 0.00%
FCFP6_1024_700 | 0.98 | 0.00%
FCFP6_1024_54 | 0.96 | 0.00%
FCFP6_1024_578 | 0.95 | 0.00%
FCFP6_1024_394 | 0.94 | 0.00%
FCFP6_1024_4 | 0.92 | 0.00%
FCFP6_1024_121 | 0.91 | 0.00%
FCFP6_1024_127 | 0.90 | 0.00%
FCFP6_1024_615 | 0.88 | 0.00%
FCFP6_1024_226 | 0.84 | 0.00%
FCFP6_1024_83 | 0.83 | 0.00%
FCFP6_1024_209 | 0.82 | 0.00%
FCFP6_1024_264 | 0.81 | 0.00%
FCFP6_1024_737 | 0.80 | 0.00%
FCFP6_1024_855 | 0.76 | 0.00%
FCFP6_1024_165 | 0.73 | 0.00%
FCFP6_1024_131 | 0.72 | 0.00%
FCFP6_1024_382 | 0.71 | 0.00%
FCFP6_1024_73 | 0.70 | 0.00%
FCFP6_1024_814 | 0.69 | 0.00%
FCFP6_1024_68 | 0.69 | 0.00%
FCFP6_1024_387 | 0.58 | 0.00%
FCFP6_1024_684 | 0.56 | 0.00%
FCFP6_1024_278 | 0.53 | 0.00%
FCFP6_1024_153 | 0.46 | 0.00%
FCFP6_1024_133 | 0.16 | 0.00%
FCFP6_1024_208 | 0.10 | 0.00%
FCFP6_1024_151 | 0.01 | 0.00%
FCFP6_1024_1013 | 0.00 | 0.00%
FCFP6_1024_0 | 0.00 | 0.00%
FCFP6_1024_1 | 0.00 | 0.00%
FCFP6_1024_2 | 0.00 | 0.00%
FCFP6_1024_5 | 0.00 | 0.00%
FCFP6_1024_10 | 0.00 | 0.00%
FCFP6_1024_11 | 0.00 | 0.00%
FCFP6_1024_12 | 0.00 | 0.00%
FCFP6_1024_13 | 0.00 | 0.00%
FCFP6_1024_14 | 0.00 | 0.00%
FCFP6_1024_15 | 0.00 | 0.00%
FCFP6_1024_18 | 0.00 | 0.00%
FCFP6_1024_19 | 0.00 | 0.00%
FCFP6_1024_20 | 0.00 | 0.00%
FCFP6_1024_21 | 0.00 | 0.00%
FCFP6_1024_22 | 0.00 | 0.00%
FCFP6_1024_23 | 0.00 | 0.00%
FCFP6_1024_25 | 0.00 | 0.00%
FCFP6_1024_26 | 0.00 | 0.00%
FCFP6_1024_27 | 0.00 | 0.00%
FCFP6_1024_28 | 0.00 | 0.00%
FCFP6_1024_29 | 0.00 | 0.00%
FCFP6_1024_30 | 0.00 | 0.00%
FCFP6_1024_31 | 0.00 | 0.00%
FCFP6_1024_33 | 0.00 | 0.00%
FCFP6_1024_34 | 0.00 | 0.00%
FCFP6_1024_35 | 0.00 | 0.00%
FCFP6_1024_36 | 0.00 | 0.00%
FCFP6_1024_37 | 0.00 | 0.00%
FCFP6_1024_38 | 0.00 | 0.00%
FCFP6_1024_39 | 0.00 | 0.00%
FCFP6_1024_40 | 0.00 | 0.00%
FCFP6_1024_41 | 0.00 | 0.00%
FCFP6_1024_42 | 0.00 | 0.00%
FCFP6_1024_43 | 0.00 | 0.00%
FCFP6_1024_44 | 0.00 | 0.00%
FCFP6_1024_46 | 0.00 | 0.00%
FCFP6_1024_48 | 0.00 | 0.00%
FCFP6_1024_50 | 0.00 | 0.00%
FCFP6_1024_52 | 0.00 | 0.00%
FCFP6_1024_55 | 0.00 | 0.00%
FCFP6_1024_57 | 0.00 | 0.00%
FCFP6_1024_58 | 0.00 | 0.00%
FCFP6_1024_59 | 0.00 | 0.00%
FCFP6_1024_61 | 0.00 | 0.00%
FCFP6_1024_62 | 0.00 | 0.00%
FCFP6_1024_63 | 0.00 | 0.00%
FCFP6_1024_65 | 0.00 | 0.00%
FCFP6_1024_66 | 0.00 | 0.00%
FCFP6_1024_67 | 0.00 | 0.00%
FCFP6_1024_69 | 0.00 | 0.00%
FCFP6_1024_70 | 0.00 | 0.00%
FCFP6_1024_71 | 0.00 | 0.00%
FCFP6_1024_74 | 0.00 | 0.00%
FCFP6_1024_75 | 0.00 | 0.00%
FCFP6_1024_76 | 0.00 | 0.00%
FCFP6_1024_78 | 0.00 | 0.00%
FCFP6_1024_79 | 0.00 | 0.00%
FCFP6_1024_80 | 0.00 | 0.00%
FCFP6_1024_81 | 0.00 | 0.00%
FCFP6_1024_84 | 0.00 | 0.00%
FCFP6_1024_85 | 0.00 | 0.00%
FCFP6_1024_86 | 0.00 | 0.00%
FCFP6_1024_87 | 0.00 | 0.00%
FCFP6_1024_88 | 0.00 | 0.00%
FCFP6_1024_90 | 0.00 | 0.00%
FCFP6_1024_91 | 0.00 | 0.00%
FCFP6_1024_92 | 0.00 | 0.00%
FCFP6_1024_93 | 0.00 | 0.00%
FCFP6_1024_95 | 0.00 | 0.00%
FCFP6_1024_96 | 0.00 | 0.00%
FCFP6_1024_97 | 0.00 | 0.00%
FCFP6_1024_98 | 0.00 | 0.00%
FCFP6_1024_99 | 0.00 | 0.00%
FCFP6_1024_100 | 0.00 | 0.00%
FCFP6_1024_101 | 0.00 | 0.00%
FCFP6_1024_102 | 0.00 | 0.00%
FCFP6_1024_103 | 0.00 | 0.00%
FCFP6_1024_105 | 0.00 | 0.00%
FCFP6_1024_108 | 0.00 | 0.00%
FCFP6_1024_110 | 0.00 | 0.00%
FCFP6_1024_113 | 0.00 | 0.00%
FCFP6_1024_115 | 0.00 | 0.00%
FCFP6_1024_117 | 0.00 | 0.00%
FCFP6_1024_118 | 0.00 | 0.00%
FCFP6_1024_119 | 0.00 | 0.00%
FCFP6_1024_120 | 0.00 | 0.00%
FCFP6_1024_122 | 0.00 | 0.00%
FCFP6_1024_125 | 0.00 | 0.00%
FCFP6_1024_126 | 0.00 | 0.00%
FCFP6_1024_129 | 0.00 | 0.00%
FCFP6_1024_130 | 0.00 | 0.00%
FCFP6_1024_132 | 0.00 | 0.00%
FCFP6_1024_134 | 0.00 | 0.00%
FCFP6_1024_135 | 0.00 | 0.00%
FCFP6_1024_137 | 0.00 | 0.00%
FCFP6_1024_139 | 0.00 | 0.00%
FCFP6_1024_140 | 0.00 | 0.00%
FCFP6_1024_143 | 0.00 | 0.00%
FCFP6_1024_144 | 0.00 | 0.00%
FCFP6_1024_146 | 0.00 | 0.00%
FCFP6_1024_147 | 0.00 | 0.00%
FCFP6_1024_148 | 0.00 | 0.00%
FCFP6_1024_149 | 0.00 | 0.00%
FCFP6_1024_150 | 0.00 | 0.00%
FCFP6_1024_152 | 0.00 | 0.00%
FCFP6_1024_154 | 0.00 | 0.00%
FCFP6_1024_155 | 0.00 | 0.00%
FCFP6_1024_156 | 0.00 | 0.00%
FCFP6_1024_157 | 0.00 | 0.00%
FCFP6_1024_159 | 0.00 | 0.00%
FCFP6_1024_160 | 0.00 | 0.00%
FCFP6_1024_161 | 0.00 | 0.00%
FCFP6_1024_162 | 0.00 | 0.00%
FCFP6_1024_163 | 0.00 | 0.00%
FCFP6_1024_166 | 0.00 | 0.00%
FCFP6_1024_167 | 0.00 | 0.00%
FCFP6_1024_168 | 0.00 | 0.00%
FCFP6_1024_170 | 0.00 | 0.00%
FCFP6_1024_171 | 0.00 | 0.00%
FCFP6_1024_172 | 0.00 | 0.00%
FCFP6_1024_173 | 0.00 | 0.00%
FCFP6_1024_174 | 0.00 | 0.00%
FCFP6_1024_175 | 0.00 | 0.00%
FCFP6_1024_178 | 0.00 | 0.00%
FCFP6_1024_179 | 0.00 | 0.00%
FCFP6_1024_182 | 0.00 | 0.00%
FCFP6_1024_183 | 0.00 | 0.00%
FCFP6_1024_185 | 0.00 | 0.00%
FCFP6_1024_186 | 0.00 | 0.00%
FCFP6_1024_188 | 0.00 | 0.00%
FCFP6_1024_191 | 0.00 | 0.00%
FCFP6_1024_192 | 0.00 | 0.00%
FCFP6_1024_193 | 0.00 | 0.00%
FCFP6_1024_195 | 0.00 | 0.00%
FCFP6_1024_197 | 0.00 | 0.00%
FCFP6_1024_198 | 0.00 | 0.00%
FCFP6_1024_200 | 0.00 | 0.00%
FCFP6_1024_201 | 0.00 | 0.00%
FCFP6_1024_202 | 0.00 | 0.00%
FCFP6_1024_203 | 0.00 | 0.00%
FCFP6_1024_204 | 0.00 | 0.00%
FCFP6_1024_205 | 0.00 | 0.00%
FCFP6_1024_210 | 0.00 | 0.00%
FCFP6_1024_212 | 0.00 | 0.00%
FCFP6_1024_215 | 0.00 | 0.00%
FCFP6_1024_216 | 0.00 | 0.00%
FCFP6_1024_219 | 0.00 | 0.00%
FCFP6_1024_220 | 0.00 | 0.00%
FCFP6_1024_221 | 0.00 | 0.00%
FCFP6_1024_223 | 0.00 | 0.00%
FCFP6_1024_224 | 0.00 | 0.00%
FCFP6_1024_225 | 0.00 | 0.00%
FCFP6_1024_227 | 0.00 | 0.00%
FCFP6_1024_228 | 0.00 | 0.00%
FCFP6_1024_229 | 0.00 | 0.00%
FCFP6_1024_230 | 0.00 | 0.00%
FCFP6_1024_231 | 0.00 | 0.00%
FCFP6_1024_232 | 0.00 | 0.00%
FCFP6_1024_233 | 0.00 | 0.00%
FCFP6_1024_234 | 0.00 | 0.00%
FCFP6_1024_235 | 0.00 | 0.00%
FCFP6_1024_236 | 0.00 | 0.00%
FCFP6_1024_237 | 0.00 | 0.00%
FCFP6_1024_241 | 0.00 | 0.00%
FCFP6_1024_242 | 0.00 | 0.00%
FCFP6_1024_243 | 0.00 | 0.00%
FCFP6_1024_244 | 0.00 | 0.00%
FCFP6_1024_246 | 0.00 | 0.00%
FCFP6_1024_247 | 0.00 | 0.00%
FCFP6_1024_248 | 0.00 | 0.00%
FCFP6_1024_249 | 0.00 | 0.00%
FCFP6_1024_250 | 0.00 | 0.00%
FCFP6_1024_251 | 0.00 | 0.00%
FCFP6_1024_252 | 0.00 | 0.00%
FCFP6_1024_253 | 0.00 | 0.00%
FCFP6_1024_254 | 0.00 | 0.00%
FCFP6_1024_255 | 0.00 | 0.00%
FCFP6_1024_256 | 0.00 | 0.00%
FCFP6_1024_257 | 0.00 | 0.00%
FCFP6_1024_258 | 0.00 | 0.00%
FCFP6_1024_261 | 0.00 | 0.00%
FCFP6_1024_265 | 0.00 | 0.00%
FCFP6_1024_266 | 0.00 | 0.00%
FCFP6_1024_267 | 0.00 | 0.00%
FCFP6_1024_268 | 0.00 | 0.00%
FCFP6_1024_271 | 0.00 | 0.00%
FCFP6_1024_272 | 0.00 | 0.00%
FCFP6_1024_273 | 0.00 | 0.00%
FCFP6_1024_274 | 0.00 | 0.00%
FCFP6_1024_277 | 0.00 | 0.00%
FCFP6_1024_279 | 0.00 | 0.00%
FCFP6_1024_281 | 0.00 | 0.00%
FCFP6_1024_283 | 0.00 | 0.00%
FCFP6_1024_285 | 0.00 | 0.00%
FCFP6_1024_286 | 0.00 | 0.00%
FCFP6_1024_287 | 0.00 | 0.00%
FCFP6_1024_288 | 0.00 | 0.00%
FCFP6_1024_289 | 0.00 | 0.00%
FCFP6_1024_290 | 0.00 | 0.00%
FCFP6_1024_291 | 0.00 | 0.00%
FCFP6_1024_292 | 0.00 | 0.00%
FCFP6_1024_293 | 0.00 | 0.00%
FCFP6_1024_294 | 0.00 | 0.00%
FCFP6_1024_295 | 0.00 | 0.00%
FCFP6_1024_296 | 0.00 | 0.00%
FCFP6_1024_297 | 0.00 | 0.00%
FCFP6_1024_299 | 0.00 | 0.00%
FCFP6_1024_300 | 0.00 | 0.00%
FCFP6_1024_301 | 0.00 | 0.00%
FCFP6_1024_302 | 0.00 | 0.00%
FCFP6_1024_303 | 0.00 | 0.00%
FCFP6_1024_306 | 0.00 | 0.00%
FCFP6_1024_307 | 0.00 | 0.00%
FCFP6_1024_308 | 0.00 | 0.00%
FCFP6_1024_310 | 0.00 | 0.00%
FCFP6_1024_311 | 0.00 | 0.00%
FCFP6_1024_312 | 0.00 | 0.00%
FCFP6_1024_314 | 0.00 | 0.00%
FCFP6_1024_315 | 0.00 | 0.00%
FCFP6_1024_316 | 0.00 | 0.00%
FCFP6_1024_317 | 0.00 | 0.00%
FCFP6_1024_319 | 0.00 | 0.00%
FCFP6_1024_320 | 0.00 | 0.00%
FCFP6_1024_321 | 0.00 | 0.00%
FCFP6_1024_324 | 0.00 | 0.00%
FCFP6_1024_325 | 0.00 | 0.00%
FCFP6_1024_326 | 0.00 | 0.00%
FCFP6_1024_327 | 0.00 | 0.00%
FCFP6_1024_328 | 0.00 | 0.00%
FCFP6_1024_331 | 0.00 | 0.00%
FCFP6_1024_332 | 0.00 | 0.00%
FCFP6_1024_333 | 0.00 | 0.00%
FCFP6_1024_335 | 0.00 | 0.00%
FCFP6_1024_336 | 0.00 | 0.00%
FCFP6_1024_337 | 0.00 | 0.00%
FCFP6_1024_338 | 0.00 | 0.00%
FCFP6_1024_339 | 0.00 | 0.00%
FCFP6_1024_340 | 0.00 | 0.00%
FCFP6_1024_341 | 0.00 | 0.00%
FCFP6_1024_342 | 0.00 | 0.00%
FCFP6_1024_344 | 0.00 | 0.00%
FCFP6_1024_345 | 0.00 | 0.00%
FCFP6_1024_348 | 0.00 | 0.00%
FCFP6_1024_349 | 0.00 | 0.00%
FCFP6_1024_351 | 0.00 | 0.00%
FCFP6_1024_352 | 0.00 | 0.00%
FCFP6_1024_353 | 0.00 | 0.00%
FCFP6_1024_354 | 0.00 | 0.00%
FCFP6_1024_356 | 0.00 | 0.00%
FCFP6_1024_357 | 0.00 | 0.00%
FCFP6_1024_360 | 0.00 | 0.00%
FCFP6_1024_361 | 0.00 | 0.00%
FCFP6_1024_362 | 0.00 | 0.00%
FCFP6_1024_363 | 0.00 | 0.00%
FCFP6_1024_365 | 0.00 | 0.00%
FCFP6_1024_366 | 0.00 | 0.00%
FCFP6_1024_367 | 0.00 | 0.00%
FCFP6_1024_368 | 0.00 | 0.00%
FCFP6_1024_369 | 0.00 | 0.00%
FCFP6_1024_370 | 0.00 | 0.00%
FCFP6_1024_371 | 0.00 | 0.00%
FCFP6_1024_372 | 0.00 | 0.00%
FCFP6_1024_373 | 0.00 | 0.00%
FCFP6_1024_374 | 0.00 | 0.00%
FCFP6_1024_376 | 0.00 | 0.00%
FCFP6_1024_377 | 0.00 | 0.00%
FCFP6_1024_378 | 0.00 | 0.00%
FCFP6_1024_379 | 0.00 | 0.00%
FCFP6_1024_380 | 0.00 | 0.00%
FCFP6_1024_381 | 0.00 | 0.00%
FCFP6_1024_383 | 0.00 | 0.00%
FCFP6_1024_384 | 0.00 | 0.00%
FCFP6_1024_385 | 0.00 | 0.00%
FCFP6_1024_386 | 0.00 | 0.00%
FCFP6_1024_388 | 0.00 | 0.00%
FCFP6_1024_389 | 0.00 | 0.00%
FCFP6_1024_391 | 0.00 | 0.00%
FCFP6_1024_392 | 0.00 | 0.00%
FCFP6_1024_393 | 0.00 | 0.00%
FCFP6_1024_397 | 0.00 | 0.00%
FCFP6_1024_398 | 0.00 | 0.00%
FCFP6_1024_399 | 0.00 | 0.00%
FCFP6_1024_400 | 0.00 | 0.00%
FCFP6_1024_401 | 0.00 | 0.00%
FCFP6_1024_402 | 0.00 | 0.00%
FCFP6_1024_403 | 0.00 | 0.00%
FCFP6_1024_404 | 0.00 | 0.00%
FCFP6_1024_406 | 0.00 | 0.00%
FCFP6_1024_408 | 0.00 | 0.00%
FCFP6_1024_409 | 0.00 | 0.00%
FCFP6_1024_410 | 0.00 | 0.00%
FCFP6_1024_411 | 0.00 | 0.00%
FCFP6_1024_413 | 0.00 | 0.00%
FCFP6_1024_415 | 0.00 | 0.00%
FCFP6_1024_416 | 0.00 | 0.00%
FCFP6_1024_417 | 0.00 | 0.00%
FCFP6_1024_418 | 0.00 | 0.00%
FCFP6_1024_419 | 0.00 | 0.00%
FCFP6_1024_420 | 0.00 | 0.00%
FCFP6_1024_421 | 0.00 | 0.00%
FCFP6_1024_422 | 0.00 | 0.00%
FCFP6_1024_424 | 0.00 | 0.00%
FCFP6_1024_426 | 0.00 | 0.00%
FCFP6_1024_427 | 0.00 | 0.00%
FCFP6_1024_429 | 0.00 | 0.00%
FCFP6_1024_432 | 0.00 | 0.00%
FCFP6_1024_433 | 0.00 | 0.00%
FCFP6_1024_435 | 0.00 | 0.00%
FCFP6_1024_436 | 0.00 | 0.00%
FCFP6_1024_438 | 0.00 | 0.00%
FCFP6_1024_439 | 0.00 | 0.00%
FCFP6_1024_440 | 0.00 | 0.00%
FCFP6_1024_441 | 0.00 | 0.00%
FCFP6_1024_443 | 0.00 | 0.00%
FCFP6_1024_444 | 0.00 | 0.00%
FCFP6_1024_445 | 0.00 | 0.00%
FCFP6_1024_446 | 0.00 | 0.00%
FCFP6_1024_447 | 0.00 | 0.00%
FCFP6_1024_448 | 0.00 | 0.00%
FCFP6_1024_449 | 0.00 | 0.00%
FCFP6_1024_450 | 0.00 | 0.00%
FCFP6_1024_451 | 0.00 | 0.00%
FCFP6_1024_452 | 0.00 | 0.00%
FCFP6_1024_453 | 0.00 | 0.00%
FCFP6_1024_456 | 0.00 | 0.00%
FCFP6_1024_457 | 0.00 | 0.00%
FCFP6_1024_458 | 0.00 | 0.00%
FCFP6_1024_459 | 0.00 | 0.00%
FCFP6_1024_460 | 0.00 | 0.00%
FCFP6_1024_461 | 0.00 | 0.00%
FCFP6_1024_462 | 0.00 | 0.00%
FCFP6_1024_464 | 0.00 | 0.00%
FCFP6_1024_465 | 0.00 | 0.00%
FCFP6_1024_466 | 0.00 | 0.00%
FCFP6_1024_467 | 0.00 | 0.00%
FCFP6_1024_468 | 0.00 | 0.00%
FCFP6_1024_470 | 0.00 | 0.00%
FCFP6_1024_472 | 0.00 | 0.00%
FCFP6_1024_474 | 0.00 | 0.00%
FCFP6_1024_475 | 0.00 | 0.00%
FCFP6_1024_476 | 0.00 | 0.00%
FCFP6_1024_477 | 0.00 | 0.00%
FCFP6_1024_478 | 0.00 | 0.00%
FCFP6_1024_479 | 0.00 | 0.00%
FCFP6_1024_481 | 0.00 | 0.00%
FCFP6_1024_482 | 0.00 | 0.00%
FCFP6_1024_483 | 0.00 | 0.00%
FCFP6_1024_484 | 0.00 | 0.00%
FCFP6_1024_485 | 0.00 | 0.00%
FCFP6_1024_486 | 0.00 | 0.00%
FCFP6_1024_490 | 0.00 | 0.00%
FCFP6_1024_491 | 0.00 | 0.00%
FCFP6_1024_492 | 0.00 | 0.00%
FCFP6_1024_494 | 0.00 | 0.00%
FCFP6_1024_495 | 0.00 | 0.00%
FCFP6_1024_496 | 0.00 | 0.00%
FCFP6_1024_497 | 0.00 | 0.00%
FCFP6_1024_498 | 0.00 | 0.00%
FCFP6_1024_500 | 0.00 | 0.00%
FCFP6_1024_502 | 0.00 | 0.00%
FCFP6_1024_503 | 0.00 | 0.00%
FCFP6_1024_504 | 0.00 | 0.00%
FCFP6_1024_506 | 0.00 | 0.00%
FCFP6_1024_508 | 0.00 | 0.00%
FCFP6_1024_509 | 0.00 | 0.00%
FCFP6_1024_510 | 0.00 | 0.00%
FCFP6_1024_512 | 0.00 | 0.00%
FCFP6_1024_514 | 0.00 | 0.00%
FCFP6_1024_515 | 0.00 | 0.00%
FCFP6_1024_516 | 0.00 | 0.00%
FCFP6_1024_517 | 0.00 | 0.00%
FCFP6_1024_518 | 0.00 | 0.00%
FCFP6_1024_519 | 0.00 | 0.00%
FCFP6_1024_521 | 0.00 | 0.00%
FCFP6_1024_524 | 0.00 | 0.00%
FCFP6_1024_525 | 0.00 | 0.00%
FCFP6_1024_526 | 0.00 | 0.00%
FCFP6_1024_527 | 0.00 | 0.00%
FCFP6_1024_529 | 0.00 | 0.00%
FCFP6_1024_530 | 0.00 | 0.00%
FCFP6_1024_532 | 0.00 | 0.00%
FCFP6_1024_533 | 0.00 | 0.00%
FCFP6_1024_534 | 0.00 | 0.00%
FCFP6_1024_535 | 0.00 | 0.00%
FCFP6_1024_538 | 0.00 | 0.00%
FCFP6_1024_539 | 0.00 | 0.00%
FCFP6_1024_540 | 0.00 | 0.00%
FCFP6_1024_541 | 0.00 | 0.00%
FCFP6_1024_542 | 0.00 | 0.00%
FCFP6_1024_543 | 0.00 