[W&B] Child process started for job: credit-g_raw-only_catboost in group session-training-4
Loading archive 'archives/credit-g.npz' and initializing pipeline for target: CATBOOST...
Execution Mode: RAW-ONLY
Session Output Target: outputs/training-4/
Task Type: BINARY
TabPFN Baselines Loaded - Primary: 0.2269 | Secondary: 0.7500
PCA reduced text embeddings to 42 components.
Final training matrix shape assembled for RAW-ONLY: (800, 20)

Running 26-Trial Optuna Study for CATBOOST (RAW-ONLY)...
A new study created in RDB with name: 20260624_154420_credit-g_raw-only_catboost
Trial 0 finished with value: 0.2176190476190476 and parameters: {}. Best is trial 0 with value: 0.2176190476190476.
Trial 1 finished with value: 0.21875 and parameters: {'learning_rate': 0.015355286838886862, 'bootstrap_type': 'Bernoulli', 'subsample': 0.9852142919229748, 'grow_policy': 'SymmetricTree', 'depth': 4, 'colsample_bylevel': 0.8733991780504303, 'l2_leaf_reg': 0.00018747059221802545, 'leaf_estimation_iterations': 12, 'one_hot_max_size': 36, 'model_size_reg': 0.6803900745073703, 'max_ctr_complexity': 2, 'boosting_type': 'Plain', 'max_bin': 254}. Best is trial 0 with value: 0.2176190476190476.
Trial 2 finished with value: 0.1986904761904762 and parameters: {'learning_rate': 0.09138013915892866, 'bootstrap_type': 'Bernoulli', 'subsample': 0.9497327922401265, 'grow_policy': 'SymmetricTree', 'depth': 4, 'colsample_bylevel': 0.8956363364439306, 'l2_leaf_reg': 0.02922905212920092, 'leaf_estimation_iterations': 2, 'one_hot_max_size': 16, 'model_size_reg': 0.5243180891902851, 'max_ctr_complexity': 2, 'boosting_type': 'Plain', 'max_bin': 254}. Best is trial 2 with value: 0.1986904761904762.
Trial 3 finished with value: 0.19720238095238085 and parameters: {'learning_rate': 0.011996621453406362, 'bootstrap_type': 'Bernoulli', 'subsample': 0.8099085529881075, 'grow_policy': 'Depthwise', 'depth': 4, 'colsample_bylevel': 0.9271351657620417, 'l2_leaf_reg': 0.06077686426194464, 'leaf_estimation_iterations': 1, 'one_hot_max_size': 36, 'model_size_reg': 0.15869086642715013, 'max_ctr_complexity': 2, 'boosting_type': 'Plain', 'max_bin': 254}. Best is trial 3 with value: 0.19720238095238085.
Trial 4 finished with value: 0.19791666666666674 and parameters: {'learning_rate': 0.08580222514877409, 'bootstrap_type': 'Bernoulli', 'subsample': 0.9896896099223678, 'grow_policy': 'SymmetricTree', 'depth': 4, 'colsample_bylevel': 0.9526349539768235, 'l2_leaf_reg': 0.011702088154220882, 'leaf_estimation_iterations': 1, 'one_hot_max_size': 27, 'model_size_reg': 0.10975998502129433, 'max_ctr_complexity': 5, 'boosting_type': 'Plain', 'max_bin': 254}. Best is trial 3 with value: 0.19720238095238085.
Trial 5 finished with value: 0.1952380952380952 and parameters: {'learning_rate': 0.010855517271883068, 'bootstrap_type': 'Bernoulli', 'subsample': 0.8987566853061946, 'grow_policy': 'Depthwise', 'depth': 6, 'colsample_bylevel': 0.877728168328829, 'l2_leaf_reg': 3.597899951374983, 'leaf_estimation_iterations': 9, 'one_hot_max_size': 86, 'model_size_reg': 1.128232550122133, 'max_ctr_complexity': 4, 'boosting_type': 'Plain', 'max_bin': 254}. Best is trial 5 with value: 0.1952380952380952.
Trial 6 finished with value: 0.20613095238095247 and parameters: {'learning_rate': 0.07913270952323785, 'bootstrap_type': 'Bernoulli', 'subsample': 0.7265477506155759, 'grow_policy': 'SymmetricTree', 'depth': 5, 'colsample_bylevel': 0.9083015934534223, 'l2_leaf_reg': 0.001883913511943895, 'leaf_estimation_iterations': 11, 'one_hot_max_size': 19, 'model_size_reg': 0.21399549030176218, 'max_ctr_complexity': 4, 'boosting_type': 'Plain', 'max_bin': 254}. Best is trial 5 with value: 0.1952380952380952.
Trial 7 finished with value: 0.22494047619047608 and parameters: {'learning_rate': 0.007626348515257587, 'bootstrap_type': 'Bernoulli', 'subsample': 0.9406590942262119, 'grow_policy': 'Depthwise', 'depth': 7, 'colsample_bylevel': 0.8798073522301258, 'l2_leaf_reg': 0.00010615690854925657, 'leaf_estimation_iterations': 10, 'one_hot_max_size': 47, 'model_size_reg': 0.7200770311577639, 'max_ctr_complexity': 5, 'boosting_type': 'Plain', 'max_bin': 254}. Best is trial 5 with value: 0.1952380952380952.
Trial 8 finished with value: 0.20511904761904765 and parameters: {'learning_rate': 0.006241720498669827, 'bootstrap_type': 'Bernoulli', 'subsample': 0.8075397185632818, 'grow_policy': 'Depthwise', 'depth': 7, 'colsample_bylevel': 0.8996347037278973, 'l2_leaf_reg': 0.00019891099118865958, 'leaf_estimation_iterations': 2, 'one_hot_max_size': 17, 'model_size_reg': 0.7212460519889856, 'max_ctr_complexity': 4, 'boosting_type': 'Plain', 'max_bin': 254}. Best is trial 5 with value: 0.1952380952380952.
Trial 9 finished with value: 0.19916666666666671 and parameters: {'learning_rate': 0.07132805718188966, 'bootstrap_type': 'Bernoulli', 'subsample': 0.8416644775485848, 'grow_policy': 'Depthwise', 'depth': 7, 'colsample_bylevel': 0.9341915796354244, 'l2_leaf_reg': 0.4195190175255899, 'leaf_estimation_iterations': 3, 'one_hot_max_size': 29, 'model_size_reg': 0.318293122389662, 'max_ctr_complexity': 2, 'boosting_type': 'Plain', 'max_bin': 254}. Best is trial 5 with value: 0.1952380952380952.
Trial 10 finished with value: 0.19166666666666687 and parameters: {'learning_rate': 0.03273941684536397, 'bootstrap_type': 'Bernoulli', 'subsample': 0.701799154886745, 'grow_policy': 'Depthwise', 'depth': 8, 'colsample_bylevel': 0.9942561717820161, 'l2_leaf_reg': 1.841152012664479, 'leaf_estimation_iterations': 5, 'one_hot_max_size': 92, 'model_size_reg': 1.3327052390755632, 'max_ctr_complexity': 3, 'boosting_type': 'Plain', 'max_bin': 254}. Best is trial 10 with value: 0.19166666666666687.
Trial 11 finished with value: 0.19119047619047624 and parameters: {'learning_rate': 0.032292835893222384, 'bootstrap_type': 'Bernoulli', 'subsample': 0.7062334097277313, 'grow_policy': 'Depthwise', 'depth': 8, 'colsample_bylevel': 0.9977495407596995, 'l2_leaf_reg': 3.4391948739985434, 'leaf_estimation_iterations': 5, 'one_hot_max_size': 100, 'model_size_reg': 1.3562496261778056, 'max_ctr_complexity': 3, 'boosting_type': 'Plain', 'max_bin': 254}. Best is trial 11 with value: 0.19119047619047624.
Trial 12 finished with value: 0.19244047619047622 and parameters: {'learning_rate': 0.03322412489174181, 'bootstrap_type': 'Bernoulli', 'subsample': 0.7021366757350271, 'grow_policy': 'Depthwise', 'depth': 8, 'colsample_bylevel': 0.998693225459642, 'l2_leaf_reg': 4.705157260326336, 'leaf_estimation_iterations': 5, 'one_hot_max_size': 99, 'model_size_reg': 1.4595062083155894, 'max_ctr_complexity': 3, 'boosting_type': 'Plain', 'max_bin': 254}. Best is trial 11 with value: 0.19119047619047624.
Trial 13 finished with value: 0.2008928571428571 and parameters: {'learning_rate': 0.03337397440893824, 'bootstrap_type': 'Bernoulli', 'subsample': 0.7512648994157257, 'grow_policy': 'Depthwise', 'depth': 8, 'colsample_bylevel': 0.9996132417238263, 'l2_leaf_reg': 0.5525353539116049, 'leaf_estimation_iterations': 5, 'one_hot_max_size': 71, 'model_size_reg': 1.478134309691276, 'max_ctr_complexity': 3, 'boosting_type': 'Plain', 'max_bin': 254}. Best is trial 11 with value: 0.19119047619047624.
Trial 14 finished with value: 0.19380952380952365 and parameters: {'learning_rate': 0.031831338065457696, 'bootstrap_type': 'Bernoulli', 'subsample': 0.7672830962540468, 'grow_policy': 'Depthwise', 'depth': 8, 'colsample_bylevel': 0.9730708379780038, 'l2_leaf_reg': 0.6595035268446806, 'leaf_estimation_iterations': 20, 'one_hot_max_size': 61, 'model_size_reg': 1.0150596018438498, 'max_ctr_complexity': 3, 'boosting_type': 'Plain', 'max_bin': 254}. Best is trial 11 with value: 0.19119047619047624.
Trial 15 finished with value: 0.19577380952380952 and parameters: {'learning_rate': 0.021441952507475073, 'bootstrap_type': 'Bernoulli', 'subsample': 0.7125236242836097, 'grow_policy': 'Depthwise', 'depth': 8, 'colsample_bylevel': 0.972063920347689, 'l2_leaf_reg': 1.3202570254603707, 'leaf_estimation_iterations': 4, 'one_hot_max_size': 59, 'model_size_reg': 0.9739764230952354, 'max_ctr_complexity': 3, 'boosting_type': 'Plain', 'max_bin': 254}. Best is trial 11 with value: 0.19119047619047624.
Trial 16 finished with value: 0.1981547619047619 and parameters: {'learning_rate': 0.045132498571606866, 'bootstrap_type': 'Bernoulli', 'subsample': 0.7609524784084656, 'grow_policy': 'Depthwise', 'depth': 7, 'colsample_bylevel': 0.980594200172791, 'l2_leaf_reg': 0.14429199384839014, 'leaf_estimation_iterations': 7, 'one_hot_max_size': 91, 'model_size_reg': 0.43171887056318564, 'max_ctr_complexity': 3, 'boosting_type': 'Plain', 'max_bin': 254}. Best is trial 11 with value: 0.19119047619047624.
Trial 17 finished with value: 0.19684523809523813 and parameters: {'learning_rate': 0.047898461159181276, 'bootstrap_type': 'Bernoulli', 'subsample': 0.7387239172108682, 'grow_policy': 'Depthwise', 'depth': 6, 'colsample_bylevel': 0.9829632282467918, 'l2_leaf_reg': 1.7440497369295562, 'leaf_estimation_iterations': 2, 'one_hot_max_size': 10, 'model_size_reg': 1.0723611066412044, 'max_ctr_complexity': 4, 'boosting_type': 'Plain', 'max_bin': 254}. Best is trial 11 with value: 0.19119047619047624.
Trial 18 finished with value: 0.19547619047619047 and parameters: {'learning_rate': 0.023777691739753293, 'bootstrap_type': 'Bernoulli', 'subsample': 0.7960431417969895, 'grow_policy': 'Depthwise', 'depth': 8, 'colsample_bylevel': 0.9559672301197402, 'l2_leaf_reg': 0.1696745090702916, 'leaf_estimation_iterations': 3, 'one_hot_max_size': 50, 'model_size_reg': 1.496765591328068, 'max_ctr_complexity': 3, 'boosting_type': 'Plain', 'max_bin': 254}. Best is trial 11 with value: 0.19119047619047624.
Trial 19 finished with value: 0.19833333333333325 and parameters: {'learning_rate': 0.05360116129238042, 'bootstrap_type': 'Bernoulli', 'subsample': 0.7004012108247599, 'grow_policy': 'SymmetricTree', 'depth': 6, 'colsample_bylevel': 0.852253181743853, 'l2_leaf_reg': 1.6075930901891207, 'leaf_estimation_iterations': 17, 'one_hot_max_size': 72, 'model_size_reg': 0.8421590802877242, 'max_ctr_complexity': 4, 'boosting_type': 'Plain', 'max_bin': 254}. Best is trial 11 with value: 0.19119047619047624.
Trial 20 finished with value: 0.20119047619047614 and parameters: {'learning_rate': 0.024804786988411567, 'bootstrap_type': 'Bernoulli', 'subsample': 0.7801864039020684, 'grow_policy': 'Depthwise', 'depth': 7, 'colsample_bylevel': 0.9578109299938373, 'l2_leaf_reg': 0.2681832053993195, 'leaf_estimation_iterations': 7, 'one_hot_max_size': 99, 'model_size_reg': 0.5133609957268597, 'max_ctr_complexity': 3, 'boosting_type': 'Plain', 'max_bin': 254}. Best is trial 11 with value: 0.19119047619047624.
Trial 21 finished with value: 0.1879761904761904 and parameters: {'learning_rate': 0.0358856834772333, 'bootstrap_type': 'Bernoulli', 'subsample': 0.7130916586848359, 'grow_policy': 'Depthwise', 'depth': 8, 'colsample_bylevel': 0.9971878483027306, 'l2_leaf_reg': 4.864977143985637, 'leaf_estimation_iterations': 5, 'one_hot_max_size': 98, 'model_size_reg': 1.3674547376203134, 'max_ctr_complexity': 3, 'boosting_type': 'Plain', 'max_bin': 254}. Best is trial 21 with value: 0.1879761904761904.
Trial 22 finished with value: 0.1919047619047619 and parameters: {'learning_rate': 0.01778165506237588, 'bootstrap_type': 'Bernoulli', 'subsample': 0.7335608591067949, 'grow_policy': 'Depthwise', 'depth': 8, 'colsample_bylevel': 0.9891387417990014, 'l2_leaf_reg': 3.533252013582099, 'leaf_estimation_iterations': 4, 'one_hot_max_size': 71, 'model_size_reg': 1.1826399060208852, 'max_ctr_complexity': 3, 'boosting_type': 'Plain', 'max_bin': 254}. Best is trial 21 with value: 0.1879761904761904.
Trial 23 finished with value: 0.19267857142857148 and parameters: {'learning_rate': 0.04011091924587638, 'bootstrap_type': 'Bernoulli', 'subsample': 0.7298734917536152, 'grow_policy': 'Depthwise', 'depth': 8, 'colsample_bylevel': 0.9987417045316526, 'l2_leaf_reg': 1.1835445649351624, 'leaf_estimation_iterations': 6, 'one_hot_max_size': 76, 'model_size_reg': 1.2297991153911725, 'max_ctr_complexity': 2, 'boosting_type': 'Plain', 'max_bin': 254}. Best is trial 21 with value: 0.1879761904761904.
Trial 24 finished with value: 0.1924404761904761 and parameters: {'learning_rate': 0.0599472326702636, 'bootstrap_type': 'Bernoulli', 'subsample': 0.8434186538350988, 'grow_policy': 'Depthwise', 'depth': 7, 'colsample_bylevel': 0.9671042484806278, 'l2_leaf_reg': 3.7995372112793455, 'leaf_estimation_iterations': 3, 'one_hot_max_size': 54, 'model_size_reg': 0.8366123821346041, 'max_ctr_complexity': 3, 'boosting_type': 'Plain', 'max_bin': 254}. Best is trial 21 with value: 0.1879761904761904.
Trial 25 finished with value: 0.19166666666666654 and parameters: {'learning_rate': 0.02859539775030989, 'bootstrap_type': 'Bernoulli', 'subsample': 0.7169897567128405, 'grow_policy': 'Depthwise', 'depth': 8, 'colsample_bylevel': 0.9875281106846241, 'l2_leaf_reg': 0.9883802478573815, 'leaf_estimation_iterations': 4, 'one_hot_max_size': 82, 'model_size_reg': 1.2364413031676829, 'max_ctr_complexity': 4, 'boosting_type': 'Plain', 'max_bin': 254}. Best is trial 21 with value: 0.1879761904761904.
Optuna Search Completed in: 149.94 seconds

Training final model on optimized parameter setup...

[CATBOOST FINALIZED METRICS]
Optimal Trees:         670
1-AUROC:             0.2460 (Delta to TabPFN: +0.0190)
Accuracy:             0.7500 (Delta to TabPFN: +0.0000)
Final Train Time:      2.52 seconds (3.1558s per 1K)
Final Infer Time:      0.00 seconds (0.0201s per 1K)

--- CATBOOST Feature Importance (Raw vs. Scaled Share) ---
Feature | Raw gain | Share
checking_status | 16.24 | 16.24%
credit_amount | 11.17 | 11.17%
duration_months | 10.93 | 10.93%
age_years | 8.28 | 8.28%
credit_history | 7.28 | 7.28%
property | 5.38 | 5.38%
credit_purpose | 4.84 | 4.84%
employment_since | 4.70 | 4.70%
other_installment_plans | 4.15 | 4.15%
savings_status | 4.14 | 4.14%
personal_status_sex | 3.92 | 3.92%
residence_since | 3.65 | 3.65%
installment_rate_percent | 3.22 | 3.22%
job | 3.03 | 3.03%
housing | 2.29 | 2.29%
telephone | 2.09 | 2.09%
existing_credits_count | 1.94 | 1.94%
other_debtors | 1.46 | 1.46%
people_liable | 1.12 | 1.12%
foreign_worker | 0.17 | 0.17%

=====================================================================
METRIC TYPE                                  | VALUE / PROFILE
=====================================================================
Embedding Share                              | 0.00%
Raw Feature Share                            | 100.00%
---------------------------------------------------------------------
Active Text Embedding Density                | 0.00% (0/0)
Active Raw Tabular Feature Density           | 100.00% (20/20)
---------------------------------------------------------------------
Top-5 Concentration Ratio (CR5)              | 53.90% of total decision weight
Top-10 Concentration Ratio (CR10)            | 77.10% of total decision weight
=====================================================================

Total Pipeline Execution Time: 153.98 seconds

[SUCCESS] Permanent artifacts safely written to 'outputs/training-4/'
[W&B] Artifacts and localized metrics logged successfully for credit-g_raw-only_catboost
