[W&B] Child process started for job: sdss17_embed-only_xgboost in group session-training-2
Loading archive 'archives/sdss17.npz' and initializing pipeline for target: XGBOOST...
Execution Mode: EMBED-ONLY
Session Output Target: outputs/training-2/
Task Type: MULTICLASS
TabPFN Baselines Loaded - Primary: 0.0635 | Secondary: 0.9795
PCA reduced text embeddings to 21 components.
Final training matrix shape assembled for EMBED-ONLY: (62442, 21)

Running 26-Trial Optuna Study for XGBOOST (EMBED-ONLY)...
A new study created in RDB with name: 20260625_032220_sdss17_embed-only_xgboost
Trial 0 finished with value: 0.0700518065956804 and parameters: {}. Best is trial 0 with value: 0.0700518065956804.
Trial 1 finished with value: 0.06797851109777084 and parameters: {'learning_rate': 0.015355286838886862, 'max_depth': 10, 'min_child_weight': 0.5100627805979911, 'subsample': 0.8394633936788146, 'colsample_bylevel': 0.6624074561769746, 'colsample_bynode': 0.662397808134481, 'reg_alpha': 0.29051225247978046, 'reg_lambda': 4.330894111260099, 'grow_policy': 'lossguide', 'max_cat_to_onehot': 8, 'max_leaves': 884}. Best is trial 1 with value: 0.06797851109777084.
Trial 2 finished with value: 0.06822505012850372 and parameters: {'learning_rate': 0.060534484680010825, 'max_depth': 4, 'min_child_weight': 0.004705059281907645, 'subsample': 0.6733618039413735, 'colsample_bylevel': 0.7216968971838151, 'colsample_bynode': 0.8099025726528951, 'reg_alpha': 2.1597818987087147, 'reg_lambda': 1.4562165780761898, 'grow_policy': 'depthwise', 'max_cat_to_onehot': 16, 'max_leaves': 45}. Best is trial 1 with value: 0.06797851109777084.
Trial 3 finished with value: 0.06724715833149011 and parameters: {'learning_rate': 0.019603369861210685, 'max_depth': 8, 'min_child_weight': 0.005477562363971304, 'subsample': 0.8056937753654446, 'colsample_bylevel': 0.836965827544817, 'colsample_bynode': 0.6185801650879991, 'reg_alpha': 3.037763505022002, 'reg_lambda': 0.8527035660240889, 'grow_policy': 'lossguide', 'max_cat_to_onehot': 92, 'max_leaves': 399}. Best is trial 3 with value: 0.06724715833149011.
Trial 4 finished with value: 0.0703613043516293 and parameters: {'learning_rate': 0.012453219846912198, 'max_depth': 4, 'min_child_weight': 0.33959199243313637, 'subsample': 0.7760609974958406, 'colsample_bylevel': 0.6488152939379115, 'colsample_bynode': 0.798070764044508, 'reg_alpha': 0.17203916672398045, 'reg_lambda': 4.546611078353703, 'grow_policy': 'lossguide', 'max_cat_to_onehot': 17, 'max_leaves': 97}. Best is trial 3 with value: 0.06724715833149011.
Trial 5 finished with value: 0.06860419769481543 and parameters: {'learning_rate': 0.025719142025384646, 'max_depth': 4, 'min_child_weight': 3.8589082671053854, 'subsample': 0.9100531293444458, 'colsample_bylevel': 0.9757995766256756, 'colsample_bynode': 0.9579309401710595, 'reg_alpha': 2.989540104057545, 'reg_lambda': 4.609378987692081, 'grow_policy': 'lossguide', 'max_cat_to_onehot': 8, 'max_leaves': 37}. Best is trial 3 with value: 0.06724715833149011.
Trial 6 finished with value: 0.06771558191232299 and parameters: {'learning_rate': 0.016019568611465234, 'max_depth': 5, 'min_child_weight': 1.1627201204016835, 'subsample': 0.7427013306774357, 'colsample_bylevel': 0.7123738038749523, 'colsample_bynode': 0.8170784332632994, 'reg_alpha': 0.7047070324513158, 'reg_lambda': 4.011004684072123, 'grow_policy': 'lossguide', 'max_cat_to_onehot': 56, 'max_leaves': 20}. Best is trial 3 with value: 0.06724715833149011.
Trial 7 finished with value: 0.1025515435184921 and parameters: {'learning_rate': 0.0050834018700114374, 'max_depth': 9, 'min_child_weight': 0.4117599592262879, 'subsample': 0.8916028672163949, 'colsample_bylevel': 0.9085081386743783, 'colsample_bynode': 0.6296178606936361, 'reg_alpha': 1.7923927961485087, 'reg_lambda': 0.5794337107196961, 'grow_policy': 'depthwise', 'max_cat_to_onehot': 18, 'max_leaves': 10}. Best is trial 3 with value: 0.06724715833149011.
Trial 8 finished with value: 0.06815197530939124 and parameters: {'learning_rate': 0.012693089228250284, 'max_depth': 5, 'min_child_weight': 0.49979438035802604, 'subsample': 0.8550229885420852, 'colsample_bylevel': 0.9548850970305306, 'colsample_bynode': 0.7888859700647797, 'reg_alpha': 0.5980592702669147, 'reg_lambda': 3.566252611636253, 'grow_policy': 'depthwise', 'max_cat_to_onehot': 55, 'max_leaves': 85}. Best is trial 3 with value: 0.06724715833149011.
Trial 9 finished with value: 0.06732651268402018 and parameters: {'learning_rate': 0.02393652463662192, 'max_depth': 6, 'min_child_weight': 0.0012417226051008223, 'subsample': 0.6431565707973218, 'colsample_bylevel': 0.6125716742746937, 'colsample_bynode': 0.8545641645055122, 'reg_alpha': 1.5718484697835258, 'reg_lambda': 2.542902598754398, 'grow_policy': 'depthwise', 'max_cat_to_onehot': 22, 'max_leaves': 308}. Best is trial 3 with value: 0.06724715833149011.
Trial 10 finished with value: 0.06778716034120093 and parameters: {'learning_rate': 0.08675823913417954, 'max_depth': 8, 'min_child_weight': 0.038946887834449, 'subsample': 0.9729161367647149, 'colsample_bylevel': 0.8383148270515275, 'colsample_bynode': 0.9630659181130071, 'reg_alpha': 4.7988577526525065, 'reg_lambda': 0.08173818767886609, 'grow_policy': 'lossguide', 'max_cat_to_onehot': 99, 'max_leaves': 968}. Best is trial 3 with value: 0.06724715833149011.
Trial 11 finished with value: 0.06741252016350413 and parameters: {'learning_rate': 0.031790458723690476, 'max_depth': 7, 'min_child_weight': 0.0012854382994846873, 'subsample': 0.6127966784299254, 'colsample_bylevel': 0.8167265665612355, 'colsample_bynode': 0.731786335173666, 'reg_alpha': 3.482856493951349, 'reg_lambda': 2.289866128356864, 'grow_policy': 'depthwise', 'max_cat_to_onehot': 36, 'max_leaves': 312}. Best is trial 3 with value: 0.06724715833149011.
Trial 12 finished with value: 0.06751510722446133 and parameters: {'learning_rate': 0.031002261148545214, 'max_depth': 6, 'min_child_weight': 0.009572770754468786, 'subsample': 0.7057547966163944, 'colsample_bylevel': 0.6026425170183641, 'colsample_bynode': 0.9005988232681414, 'reg_alpha': 1.6441178832778967, 'reg_lambda': 2.5749005730633137, 'grow_policy': 'depthwise', 'max_cat_to_onehot': 28, 'max_leaves': 317}. Best is trial 3 with value: 0.06724715833149011.
Trial 13 finished with value: 0.06993124840235046 and parameters: {'learning_rate': 0.007223541604445361, 'max_depth': 7, 'min_child_weight': 0.0011818001514340352, 'subsample': 0.6052561262871233, 'colsample_bylevel': 0.7972498328656556, 'colsample_bynode': 0.6861566944610918, 'reg_alpha': 3.690517900796951, 'reg_lambda': 1.4352614493122275, 'grow_policy': 'depthwise', 'max_cat_to_onehot': 82, 'max_leaves': 299}. Best is trial 3 with value: 0.06724715833149011.
Trial 14 finished with value: 0.0674956542695773 and parameters: {'learning_rate': 0.046050307808350566, 'max_depth': 6, 'min_child_weight': 0.013357789608716808, 'subsample': 0.7942586545363085, 'colsample_bylevel': 0.7553082698269054, 'colsample_bynode': 0.8885227719625354, 'reg_alpha': 2.53560334527816, 'reg_lambda': 2.8538768919635995, 'grow_policy': 'lossguide', 'max_cat_to_onehot': 30, 'max_leaves': 171}. Best is trial 3 with value: 0.06724715833149011.
Trial 15 finished with value: 0.06744455892410287 and parameters: {'learning_rate': 0.01961090695651407, 'max_depth': 8, 'min_child_weight': 0.04529442426173348, 'subsample': 0.668147523279367, 'colsample_bylevel': 0.9003988944050104, 'colsample_bynode': 0.6009196686241622, 'reg_alpha': 1.331344822109691, 'reg_lambda': 1.567359566556103, 'grow_policy': 'lossguide', 'max_cat_to_onehot': 62, 'max_leaves': 624}. Best is trial 3 with value: 0.06724715833149011.
Trial 16 finished with value: 0.06879989094387365 and parameters: {'learning_rate': 0.009151843338230383, 'max_depth': 6, 'min_child_weight': 0.0031675634239161153, 'subsample': 0.9609770664791568, 'colsample_bylevel': 0.8800626649701231, 'colsample_bynode': 0.7290807707576658, 'reg_alpha': 4.397553815783182, 'reg_lambda': 0.7218858442270621, 'grow_policy': 'depthwise', 'max_cat_to_onehot': 39, 'max_leaves': 460}. Best is trial 3 with value: 0.06724715833149011.
Trial 17 finished with value: 0.06749766589924946 and parameters: {'learning_rate': 0.022966591471779263, 'max_depth': 5, 'min_child_weight': 0.04817759678663606, 'subsample': 0.7399787742630001, 'colsample_bylevel': 0.6017253812998922, 'colsample_bynode': 0.9117712809246714, 'reg_alpha': 1.1779017087893153, 'reg_lambda': 3.198533115796834, 'grow_policy': 'depthwise', 'max_cat_to_onehot': 12, 'max_leaves': 167}. Best is trial 3 with value: 0.06724715833149011.
Trial 18 finished with value: 0.067381615723408 and parameters: {'learning_rate': 0.04427598533640027, 'max_depth': 7, 'min_child_weight': 0.0025203163301778264, 'subsample': 0.8071269550661433, 'colsample_bylevel': 0.7762584072253719, 'colsample_bynode': 0.8512617680215315, 'reg_alpha': 2.7696704894282336, 'reg_lambda': 2.0450644552445114, 'grow_policy': 'lossguide', 'max_cat_to_onehot': 22, 'max_leaves': 170}. Best is trial 3 with value: 0.06724715833149011.
Trial 19 finished with value: 0.06757264803298214 and parameters: {'learning_rate': 0.03299356557243857, 'max_depth': 10, 'min_child_weight': 0.013633405542229726, 'subsample': 0.6624048029531371, 'colsample_bylevel': 0.6788696453014718, 'colsample_bynode': 0.7511617847264949, 'reg_alpha': 3.660515197094619, 'reg_lambda': 0.8637803219900749, 'grow_policy': 'depthwise', 'max_cat_to_onehot': 12, 'max_leaves': 498}. Best is trial 3 with value: 0.06724715833149011.
Trial 20 finished with value: 0.068040819869275 and parameters: {'learning_rate': 0.09779927334460559, 'max_depth': 8, 'min_child_weight': 0.005087968478747846, 'subsample': 0.9219908109824942, 'colsample_bylevel': 0.860769720301912, 'colsample_bynode': 0.9989879313923895, 'reg_alpha': 2.132552515650514, 'reg_lambda': 1.9200669428525523, 'grow_policy': 'lossguide', 'max_cat_to_onehot': 42, 'max_leaves': 86}. Best is trial 3 with value: 0.06724715833149011.
Trial 21 finished with value: 0.06742483542836698 and parameters: {'learning_rate': 0.0445587068005993, 'max_depth': 7, 'min_child_weight': 0.0021468116058772314, 'subsample': 0.8164031266858413, 'colsample_bylevel': 0.771836707316674, 'colsample_bynode': 0.8597114355897656, 'reg_alpha': 3.104969432618316, 'reg_lambda': 2.1336961531972167, 'grow_policy': 'lossguide', 'max_cat_to_onehot': 23, 'max_leaves': 176}. Best is trial 3 with value: 0.06724715833149011.
Trial 22 finished with value: 0.06738641220062547 and parameters: {'learning_rate': 0.046251986321498136, 'max_depth': 6, 'min_child_weight': 0.0023240210354099444, 'subsample': 0.8652994400662773, 'colsample_bylevel': 0.7485202093651706, 'colsample_bynode': 0.8460752699139931, 'reg_alpha': 2.6222395534004184, 'reg_lambda': 3.191107421190153, 'grow_policy': 'lossguide', 'max_cat_to_onehot': 23, 'max_leaves': 222}. Best is trial 3 with value: 0.06724715833149011.
Trial 23 finished with value: 0.06753961584894787 and parameters: {'learning_rate': 0.06478649884010747, 'max_depth': 7, 'min_child_weight': 0.0010022349549338744, 'subsample': 0.7669606355096268, 'colsample_bylevel': 0.9276198576700337, 'colsample_bynode': 0.6907939095057635, 'reg_alpha': 3.006143322733211, 'reg_lambda': 1.1494262329957399, 'grow_policy': 'lossguide', 'max_cat_to_onehot': 13, 'max_leaves': 117}. Best is trial 3 with value: 0.06724715833149011.
Trial 24 finished with value: 0.06743312087965375 and parameters: {'learning_rate': 0.019936513393263574, 'max_depth': 9, 'min_child_weight': 0.007785998278051684, 'subsample': 0.8229087522029751, 'colsample_bylevel': 0.791818736516692, 'colsample_bynode': 0.7670748854035215, 'reg_alpha': 4.165841225356452, 'reg_lambda': 0.24168057962570733, 'grow_policy': 'lossguide', 'max_cat_to_onehot': 25, 'max_leaves': 481}. Best is trial 3 with value: 0.06724715833149011.
Trial 25 finished with value: 0.06740550078003871 and parameters: {'learning_rate': 0.034713478158563044, 'max_depth': 8, 'min_child_weight': 0.002923730638284673, 'subsample': 0.7089319361260893, 'colsample_bylevel': 0.8417476518599685, 'colsample_bynode': 0.8550748773233047, 'reg_alpha': 2.4815822582912617, 'reg_lambda': 1.90355670731524, 'grow_policy': 'lossguide', 'max_cat_to_onehot': 69, 'max_leaves': 52}. Best is trial 3 with value: 0.06724715833149011.
Optuna Search Completed in: 1547.71 seconds

Training final model on optimized parameter setup...

[XGBOOST FINALIZED METRICS]
Optimal Trees:         548
Log_Loss:             0.0654 (Delta to TabPFN: +0.0018)
Accuracy:             0.9792 (Delta to TabPFN: -0.0003)
Final Train Time:      9.51 seconds (0.1522s per 1K)
Final Infer Time:      0.09 seconds (0.0059s per 1K)

--- XGBOOST Feature Importance (Raw vs. Scaled Share) ---
Feature | Raw gain | Share
pca_embed_0 | 1218555.62 | 54.32%
pca_embed_1 | 336892.62 | 15.02%
pca_embed_6 | 112095.10 | 5.00%
pca_embed_8 | 86605.85 | 3.86%
pca_embed_9 | 69963.98 | 3.12%
pca_embed_4 | 61549.15 | 2.74%
pca_embed_5 | 61345.56 | 2.73%
pca_embed_7 | 52519.69 | 2.34%
pca_embed_3 | 51853.59 | 2.31%
pca_embed_2 | 42314.24 | 1.89%
pca_embed_11 | 36133.25 | 1.61%
pca_embed_10 | 26343.81 | 1.17%
pca_embed_18 | 15449.00 | 0.69%
pca_embed_12 | 12950.66 | 0.58%
pca_embed_13 | 12201.99 | 0.54%
pca_embed_17 | 11919.91 | 0.53%
pca_embed_20 | 9259.73 | 0.41%
pca_embed_14 | 7501.37 | 0.33%
pca_embed_16 | 6620.39 | 0.30%
pca_embed_19 | 5941.53 | 0.26%
pca_embed_15 | 5086.34 | 0.23%

=====================================================================
METRIC TYPE                                  | VALUE / PROFILE
=====================================================================
Embedding Share                              | 100.00%
Raw Feature Share                            | 0.00%
---------------------------------------------------------------------
Active Text Embedding Density                | 100.00% (21/21)
Active Raw Tabular Feature Density           | 0.00% (0/0)
---------------------------------------------------------------------
Top-5 Concentration Ratio (CR5)              | 81.32% of total decision weight
Top-10 Concentration Ratio (CR10)            | 93.34% of total decision weight
=====================================================================

Total Pipeline Execution Time: 1559.58 seconds

[SUCCESS] Permanent artifacts safely written to 'outputs/training-2/'
[W&B] Artifacts and localized metrics logged successfully for sdss17_embed-only_xgboost
