[W&B] Child process started for job: houses_embed-only_catboost in group session-training-2
Loading archive 'archives/houses.npz' and initializing pipeline for target: CATBOOST...
Execution Mode: EMBED-ONLY
Session Output Target: outputs/training-2/
Task Type: REGRESSION
TabPFN Baselines Loaded - Primary: 0.1762 | Secondary: 0.9042
PCA reduced text embeddings to 77 components.
Final training matrix shape assembled for EMBED-ONLY: (16512, 77)

Running 26-Trial Optuna Study for CATBOOST (EMBED-ONLY)...
A new study created in RDB with name: 20260624_173249_houses_embed-only_catboost
Trial 0 finished with value: 0.6593237567650637 and parameters: {}. Best is trial 0 with value: 0.6593237567650637.
Trial 1 finished with value: 0.19325810987292494 and parameters: {'learning_rate': 0.015355286838886862, 'bootstrap_type': 'Bernoulli', 'subsample': 0.9852142919229748, 'grow_policy': 'SymmetricTree', 'depth': 4, 'colsample_bylevel': 0.8733991780504303, 'l2_leaf_reg': 0.00018747059221802545, 'leaf_estimation_iterations': 12, 'one_hot_max_size': 36, 'model_size_reg': 0.6803900745073703, 'max_ctr_complexity': 2, 'boosting_type': 'Plain', 'max_bin': 254}. Best is trial 1 with value: 0.19325810987292494.
Trial 2 finished with value: 0.1968309137246432 and parameters: {'learning_rate': 0.09138013915892866, 'bootstrap_type': 'Bernoulli', 'subsample': 0.9497327922401265, 'grow_policy': 'SymmetricTree', 'depth': 4, 'colsample_bylevel': 0.8956363364439306, 'l2_leaf_reg': 0.02922905212920092, 'leaf_estimation_iterations': 2, 'one_hot_max_size': 16, 'model_size_reg': 0.5243180891902851, 'max_ctr_complexity': 2, 'boosting_type': 'Plain', 'max_bin': 254}. Best is trial 1 with value: 0.19325810987292494.
Trial 3 finished with value: 0.19303014473917013 and parameters: {'learning_rate': 0.011996621453406362, 'bootstrap_type': 'Bernoulli', 'subsample': 0.8099085529881075, 'grow_policy': 'Depthwise', 'depth': 4, 'colsample_bylevel': 0.9271351657620417, 'l2_leaf_reg': 0.06077686426194464, 'leaf_estimation_iterations': 1, 'one_hot_max_size': 36, 'model_size_reg': 0.15869086642715013, 'max_ctr_complexity': 2, 'boosting_type': 'Plain', 'max_bin': 254}. Best is trial 3 with value: 0.19303014473917013.
Trial 4 finished with value: 0.1966481614520472 and parameters: {'learning_rate': 0.08580222514877409, 'bootstrap_type': 'Bernoulli', 'subsample': 0.9896896099223678, 'grow_policy': 'SymmetricTree', 'depth': 4, 'colsample_bylevel': 0.9526349539768235, 'l2_leaf_reg': 0.011702088154220882, 'leaf_estimation_iterations': 1, 'one_hot_max_size': 27, 'model_size_reg': 0.10975998502129433, 'max_ctr_complexity': 5, 'boosting_type': 'Plain', 'max_bin': 254}. Best is trial 3 with value: 0.19303014473917013.
Trial 5 finished with value: 0.19330252149772773 and parameters: {'learning_rate': 0.010855517271883068, 'bootstrap_type': 'Bernoulli', 'subsample': 0.8987566853061946, 'grow_policy': 'Depthwise', 'depth': 6, 'colsample_bylevel': 0.877728168328829, 'l2_leaf_reg': 3.597899951374983, 'leaf_estimation_iterations': 9, 'one_hot_max_size': 86, 'model_size_reg': 1.128232550122133, 'max_ctr_complexity': 4, 'boosting_type': 'Plain', 'max_bin': 254}. Best is trial 3 with value: 0.19303014473917013.
Trial 6 finished with value: 0.19592496128047898 and parameters: {'learning_rate': 0.07913270952323785, 'bootstrap_type': 'Bernoulli', 'subsample': 0.7265477506155759, 'grow_policy': 'SymmetricTree', 'depth': 5, 'colsample_bylevel': 0.9083015934534223, 'l2_leaf_reg': 0.001883913511943895, 'leaf_estimation_iterations': 11, 'one_hot_max_size': 19, 'model_size_reg': 0.21399549030176218, 'max_ctr_complexity': 4, 'boosting_type': 'Plain', 'max_bin': 254}. Best is trial 3 with value: 0.19303014473917013.
Trial 7 finished with value: 0.19449758497745373 and parameters: {'learning_rate': 0.007626348515257587, 'bootstrap_type': 'Bernoulli', 'subsample': 0.9406590942262119, 'grow_policy': 'Depthwise', 'depth': 7, 'colsample_bylevel': 0.8798073522301258, 'l2_leaf_reg': 0.00010615690854925657, 'leaf_estimation_iterations': 10, 'one_hot_max_size': 47, 'model_size_reg': 0.7200770311577639, 'max_ctr_complexity': 5, 'boosting_type': 'Plain', 'max_bin': 254}. Best is trial 3 with value: 0.19303014473917013.
Trial 8 finished with value: 0.1977090889857948 and parameters: {'learning_rate': 0.006241720498669827, 'bootstrap_type': 'Bernoulli', 'subsample': 0.8075397185632818, 'grow_policy': 'Depthwise', 'depth': 7, 'colsample_bylevel': 0.8996347037278973, 'l2_leaf_reg': 0.00019891099118865958, 'leaf_estimation_iterations': 2, 'one_hot_max_size': 17, 'model_size_reg': 0.7212460519889856, 'max_ctr_complexity': 4, 'boosting_type': 'Plain', 'max_bin': 254}. Best is trial 3 with value: 0.19303014473917013.
Trial 9 finished with value: 0.20753962012527274 and parameters: {'learning_rate': 0.07132805718188966, 'bootstrap_type': 'Bernoulli', 'subsample': 0.8416644775485848, 'grow_policy': 'Depthwise', 'depth': 7, 'colsample_bylevel': 0.9341915796354244, 'l2_leaf_reg': 0.4195190175255899, 'leaf_estimation_iterations': 3, 'one_hot_max_size': 29, 'model_size_reg': 0.318293122389662, 'max_ctr_complexity': 2, 'boosting_type': 'Plain', 'max_bin': 254}. Best is trial 3 with value: 0.19303014473917013.
Trial 10 finished with value: 0.20333419344628717 and parameters: {'learning_rate': 0.02632754856303217, 'bootstrap_type': 'Bernoulli', 'subsample': 0.701799154886745, 'grow_policy': 'Depthwise', 'depth': 8, 'colsample_bylevel': 0.9947167472260312, 'l2_leaf_reg': 0.17516619421446947, 'leaf_estimation_iterations': 1, 'one_hot_max_size': 8, 'model_size_reg': 0.11492914573793168, 'max_ctr_complexity': 3, 'boosting_type': 'Plain', 'max_bin': 254}. Best is trial 3 with value: 0.19303014473917013.
Trial 11 finished with value: 0.1929686619452517 and parameters: {'learning_rate': 0.015753387726212563, 'bootstrap_type': 'Bernoulli', 'subsample': 0.7979239426070239, 'grow_policy': 'SymmetricTree', 'depth': 4, 'colsample_bylevel': 0.8601730401643931, 'l2_leaf_reg': 0.0017481163980583247, 'leaf_estimation_iterations': 19, 'one_hot_max_size': 51, 'model_size_reg': 0.2204948892099201, 'max_ctr_complexity': 2, 'boosting_type': 'Plain', 'max_bin': 254}. Best is trial 11 with value: 0.1929686619452517.
Trial 12 finished with value: 0.1933035898386756 and parameters: {'learning_rate': 0.020334499458120252, 'bootstrap_type': 'Bernoulli', 'subsample': 0.7811858575604234, 'grow_policy': 'SymmetricTree', 'depth': 5, 'colsample_bylevel': 0.8541922776832994, 'l2_leaf_reg': 0.002859945715985297, 'leaf_estimation_iterations': 5, 'one_hot_max_size': 65, 'model_size_reg': 0.20744925311840962, 'max_ctr_complexity': 3, 'boosting_type': 'Plain', 'max_bin': 254}. Best is trial 11 with value: 0.1929686619452517.
Trial 13 finished with value: 0.19436017057409904 and parameters: {'learning_rate': 0.027532708516903086, 'bootstrap_type': 'Bernoulli', 'subsample': 0.8463664784189642, 'grow_policy': 'Depthwise', 'depth': 5, 'colsample_bylevel': 0.9636007742720188, 'l2_leaf_reg': 0.10697993006690087, 'leaf_estimation_iterations': 18, 'one_hot_max_size': 54, 'model_size_reg': 0.20881565191192614, 'max_ctr_complexity': 3, 'boosting_type': 'Plain', 'max_bin': 254}. Best is trial 11 with value: 0.1929686619452517.
Trial 14 finished with value: 0.19337751003707326 and parameters: {'learning_rate': 0.012034057135110266, 'bootstrap_type': 'Bernoulli', 'subsample': 0.7624841225940271, 'grow_policy': 'SymmetricTree', 'depth': 4, 'colsample_bylevel': 0.9241667179579247, 'l2_leaf_reg': 0.006439679936871292, 'leaf_estimation_iterations': 5, 'one_hot_max_size': 93, 'model_size_reg': 0.32462778233459855, 'max_ctr_complexity': 2, 'boosting_type': 'Plain', 'max_bin': 254}. Best is trial 11 with value: 0.1929686619452517.
Trial 15 finished with value: 0.19439738450858524 and parameters: {'learning_rate': 0.04415017166722884, 'bootstrap_type': 'Bernoulli', 'subsample': 0.8563310824892957, 'grow_policy': 'SymmetricTree', 'depth': 5, 'colsample_bylevel': 0.8507110179479633, 'l2_leaf_reg': 0.0009649417649234434, 'leaf_estimation_iterations': 1, 'one_hot_max_size': 38, 'model_size_reg': 0.15862413474372106, 'max_ctr_complexity': 2, 'boosting_type': 'Plain', 'max_bin': 254}. Best is trial 11 with value: 0.1929686619452517.
Trial 16 finished with value: 0.2143706670348293 and parameters: {'learning_rate': 0.005041462745872785, 'bootstrap_type': 'Bernoulli', 'subsample': 0.8024650284806477, 'grow_policy': 'Depthwise', 'depth': 4, 'colsample_bylevel': 0.9950571306332299, 'l2_leaf_reg': 1.2556849320310421, 'leaf_estimation_iterations': 5, 'one_hot_max_size': 66, 'model_size_reg': 0.32575658412201763, 'max_ctr_complexity': 3, 'boosting_type': 'Plain', 'max_bin': 254}. Best is trial 11 with value: 0.1929686619452517.
Trial 17 finished with value: 0.19344543089439065 and parameters: {'learning_rate': 0.010007918752186118, 'bootstrap_type': 'Bernoulli', 'subsample': 0.7525255121737926, 'grow_policy': 'SymmetricTree', 'depth': 6, 'colsample_bylevel': 0.9739071074276635, 'l2_leaf_reg': 0.039732991402858436, 'leaf_estimation_iterations': 2, 'one_hot_max_size': 23, 'model_size_reg': 0.15748206109657623, 'max_ctr_complexity': 2, 'boosting_type': 'Plain', 'max_bin': 254}. Best is trial 11 with value: 0.1929686619452517.
Trial 18 finished with value: 0.19302737155788394 and parameters: {'learning_rate': 0.016963336704513762, 'bootstrap_type': 'Bernoulli', 'subsample': 0.8798608855346057, 'grow_policy': 'Depthwise', 'depth': 5, 'colsample_bylevel': 0.9358595091451619, 'l2_leaf_reg': 0.0008201688600278081, 'leaf_estimation_iterations': 20, 'one_hot_max_size': 13, 'model_size_reg': 0.4257650150846379, 'max_ctr_complexity': 3, 'boosting_type': 'Plain', 'max_bin': 254}. Best is trial 11 with value: 0.1929686619452517.
Trial 19 finished with value: 0.19395628074392052 and parameters: {'learning_rate': 0.018915137025867522, 'bootstrap_type': 'Bernoulli', 'subsample': 0.884269028199908, 'grow_policy': 'Depthwise', 'depth': 6, 'colsample_bylevel': 0.9439729844197828, 'l2_leaf_reg': 0.0007370599966139074, 'leaf_estimation_iterations': 19, 'one_hot_max_size': 10, 'model_size_reg': 0.41463191443358494, 'max_ctr_complexity': 3, 'boosting_type': 'Plain', 'max_bin': 254}. Best is trial 11 with value: 0.1929686619452517.
Trial 20 finished with value: 0.19487712395042794 and parameters: {'learning_rate': 0.03887497205274868, 'bootstrap_type': 'Bernoulli', 'subsample': 0.9010433513142694, 'grow_policy': 'SymmetricTree', 'depth': 5, 'colsample_bylevel': 0.9775925698961954, 'l2_leaf_reg': 0.00042985137305826985, 'leaf_estimation_iterations': 15, 'one_hot_max_size': 12, 'model_size_reg': 1.288464091163862, 'max_ctr_complexity': 3, 'boosting_type': 'Plain', 'max_bin': 254}. Best is trial 11 with value: 0.1929686619452517.
Trial 21 finished with value: 0.1929775798267334 and parameters: {'learning_rate': 0.014934742695936585, 'bootstrap_type': 'Bernoulli', 'subsample': 0.8167867026547497, 'grow_policy': 'Depthwise', 'depth': 4, 'colsample_bylevel': 0.9198136749138434, 'l2_leaf_reg': 0.00700822836169304, 'leaf_estimation_iterations': 7, 'one_hot_max_size': 41, 'model_size_reg': 0.15478588327386184, 'max_ctr_complexity': 2, 'boosting_type': 'Plain', 'max_bin': 254}. Best is trial 11 with value: 0.1929686619452517.
Trial 22 finished with value: 0.19323629584660745 and parameters: {'learning_rate': 0.01537527130249525, 'bootstrap_type': 'Bernoulli', 'subsample': 0.8672925419351633, 'grow_policy': 'Depthwise', 'depth': 5, 'colsample_bylevel': 0.9134891620610947, 'l2_leaf_reg': 0.00732112140395364, 'leaf_estimation_iterations': 8, 'one_hot_max_size': 13, 'model_size_reg': 0.2653929427612396, 'max_ctr_complexity': 2, 'boosting_type': 'Plain', 'max_bin': 254}. Best is trial 11 with value: 0.1929686619452517.
Trial 23 finished with value: 0.1940414453753058 and parameters: {'learning_rate': 0.026586440295675157, 'bootstrap_type': 'Bernoulli', 'subsample': 0.8261974112418268, 'grow_policy': 'Depthwise', 'depth': 4, 'colsample_bylevel': 0.9478290697932688, 'l2_leaf_reg': 0.0032041773126903067, 'leaf_estimation_iterations': 7, 'one_hot_max_size': 50, 'model_size_reg': 0.467423303632269, 'max_ctr_complexity': 3, 'boosting_type': 'Plain', 'max_bin': 254}. Best is trial 11 with value: 0.1929686619452517.
Trial 24 finished with value: 0.19325566861094762 and parameters: {'learning_rate': 0.017497663150652897, 'bootstrap_type': 'Bernoulli', 'subsample': 0.7744803662148869, 'grow_policy': 'Depthwise', 'depth': 5, 'colsample_bylevel': 0.8887901765365969, 'l2_leaf_reg': 0.018820510742676003, 'leaf_estimation_iterations': 14, 'one_hot_max_size': 67, 'model_size_reg': 0.13614959201550364, 'max_ctr_complexity': 4, 'boosting_type': 'Plain', 'max_bin': 254}. Best is trial 11 with value: 0.1929686619452517.
Trial 25 finished with value: 0.19325905951881944 and parameters: {'learning_rate': 0.00812533083318538, 'bootstrap_type': 'Bernoulli', 'subsample': 0.9199285649838912, 'grow_policy': 'Depthwise', 'depth': 4, 'colsample_bylevel': 0.8662021903148988, 'l2_leaf_reg': 0.001271836456520639, 'leaf_estimation_iterations': 7, 'one_hot_max_size': 8, 'model_size_reg': 0.2456017618610942, 'max_ctr_complexity': 2, 'boosting_type': 'Plain', 'max_bin': 254}. Best is trial 11 with value: 0.1929686619452517.
Optuna Search Completed in: 1118.26 seconds

Training final model on optimized parameter setup...

[CATBOOST FINALIZED METRICS]
Optimal Trees:         1000
RMSE:             0.1769 (Delta to TabPFN: +0.0007)
R2_Score:             0.9035 (Delta to TabPFN: -0.0008)
Final Train Time:      2.38 seconds (0.1442s per 1K)
Final Infer Time:      0.00 seconds (0.0007s per 1K)

--- CATBOOST Feature Importance (Raw vs. Scaled Share) ---
Feature | Raw gain | Share
pca_embed_0 | 62.81 | 62.81%
pca_embed_1 | 22.04 | 22.04%
pca_embed_3 | 5.00 | 5.00%
pca_embed_2 | 3.76 | 3.76%
pca_embed_4 | 1.02 | 1.02%
pca_embed_5 | 0.78 | 0.78%
pca_embed_6 | 0.66 | 0.66%
pca_embed_74 | 0.18 | 0.18%
pca_embed_38 | 0.13 | 0.13%
pca_embed_64 | 0.13 | 0.13%
pca_embed_12 | 0.12 | 0.12%
pca_embed_26 | 0.11 | 0.11%
pca_embed_8 | 0.10 | 0.10%
pca_embed_65 | 0.10 | 0.10%
pca_embed_51 | 0.09 | 0.09%
pca_embed_45 | 0.09 | 0.09%
pca_embed_40 | 0.09 | 0.09%
pca_embed_9 | 0.09 | 0.09%
pca_embed_18 | 0.09 | 0.09%
pca_embed_7 | 0.09 | 0.09%
pca_embed_59 | 0.09 | 0.09%
pca_embed_13 | 0.09 | 0.09%
pca_embed_11 | 0.08 | 0.08%
pca_embed_10 | 0.08 | 0.08%
pca_embed_52 | 0.08 | 0.08%
pca_embed_27 | 0.08 | 0.08%
pca_embed_63 | 0.07 | 0.07%
pca_embed_44 | 0.07 | 0.07%
pca_embed_69 | 0.07 | 0.07%
pca_embed_76 | 0.07 | 0.07%
pca_embed_21 | 0.07 | 0.07%
pca_embed_14 | 0.07 | 0.07%
pca_embed_23 | 0.06 | 0.06%
pca_embed_55 | 0.06 | 0.06%
pca_embed_39 | 0.06 | 0.06%
pca_embed_37 | 0.05 | 0.05%
pca_embed_66 | 0.05 | 0.05%
pca_embed_60 | 0.05 | 0.05%
pca_embed_67 | 0.05 | 0.05%
pca_embed_32 | 0.05 | 0.05%
pca_embed_58 | 0.05 | 0.05%
pca_embed_49 | 0.05 | 0.05%
pca_embed_47 | 0.05 | 0.05%
pca_embed_35 | 0.05 | 0.05%
pca_embed_15 | 0.05 | 0.05%
pca_embed_56 | 0.05 | 0.05%
pca_embed_57 | 0.05 | 0.05%
pca_embed_50 | 0.05 | 0.05%
pca_embed_43 | 0.04 | 0.04%
pca_embed_22 | 0.04 | 0.04%
pca_embed_36 | 0.04 | 0.04%
pca_embed_30 | 0.04 | 0.04%
pca_embed_33 | 0.04 | 0.04%
pca_embed_28 | 0.04 | 0.04%
pca_embed_41 | 0.04 | 0.04%
pca_embed_24 | 0.04 | 0.04%
pca_embed_53 | 0.04 | 0.04%
pca_embed_25 | 0.03 | 0.03%
pca_embed_61 | 0.03 | 0.03%
pca_embed_16 | 0.03 | 0.03%
pca_embed_29 | 0.03 | 0.03%
pca_embed_73 | 0.03 | 0.03%
pca_embed_71 | 0.03 | 0.03%
pca_embed_68 | 0.03 | 0.03%
pca_embed_31 | 0.03 | 0.03%
pca_embed_62 | 0.02 | 0.02%
pca_embed_34 | 0.02 | 0.02%
pca_embed_48 | 0.02 | 0.02%
pca_embed_72 | 0.02 | 0.02%
pca_embed_75 | 0.02 | 0.02%
pca_embed_46 | 0.01 | 0.01%
pca_embed_70 | 0.01 | 0.01%
pca_embed_20 | 0.01 | 0.01%
pca_embed_42 | 0.01 | 0.01%
pca_embed_54 | 0.01 | 0.01%
pca_embed_19 | 0.01 | 0.01%
pca_embed_17 | 0.01 | 0.01%

=====================================================================
METRIC TYPE                                  | VALUE / PROFILE
=====================================================================
Embedding Share                              | 100.00%
Raw Feature Share                            | 0.00%
---------------------------------------------------------------------
Active Text Embedding Density                | 100.00% (77/77)
Active Raw Tabular Feature Density           | 0.00% (0/0)
---------------------------------------------------------------------
Top-5 Concentration Ratio (CR5)              | 94.64% of total decision weight
Top-10 Concentration Ratio (CR10)            | 96.52% of total decision weight
=====================================================================

Total Pipeline Execution Time: 1122.41 seconds

[SUCCESS] Permanent artifacts safely written to 'outputs/training-2/'
[W&B] Artifacts and localized metrics logged successfully for houses_embed-only_catboost
