number,value,datetime_start,datetime_complete,duration,params_colsample_bylevel,params_colsample_bynode,params_grow_policy,params_learning_rate,params_max_cat_to_onehot,params_max_depth,params_max_leaves,params_min_child_weight,params_reg_alpha,params_reg_lambda,params_subsample,user_attrs_optimal_trees,system_attrs_fixed_params,state
0,0.020788117074152956,2026-06-24 23:41:40.574164,2026-06-24 23:41:42.659956,0 days 00:00:02.085792,,,,,,,,,,,,64,{},COMPLETE
1,0.018802641051412383,2026-06-24 23:41:42.674320,2026-06-24 23:42:27.733242,0 days 00:00:45.058922,0.6624074561769746,0.662397808134481,lossguide,0.015355286838886862,8.0,10.0,884.0,0.5100627805979911,0.29051225247978046,4.330894111260099,0.8394633936788146,755,,COMPLETE
2,0.019253736643225494,2026-06-24 23:42:27.746091,2026-06-24 23:42:31.784099,0 days 00:00:04.038008,0.7216968971838151,0.8099025726528951,depthwise,0.060534484680010825,16.0,4.0,45.0,0.004705059281907645,2.1597818987087147,1.4562165780761898,0.6733618039413735,381,,COMPLETE
3,0.018698694748081612,2026-06-24 23:42:31.793552,2026-06-24 23:42:54.514606,0 days 00:00:22.721054,0.836965827544817,0.6185801650879991,lossguide,0.019603369861210685,92.0,8.0,399.0,0.005477562363971304,3.037763505022002,0.8527035660240889,0.8056937753654446,591,,COMPLETE
4,0.019244972836979346,2026-06-24 23:42:54.527180,2026-06-24 23:43:04.833432,0 days 00:00:10.306252,0.6488152939379115,0.798070764044508,lossguide,0.012453219846912198,17.0,4.0,97.0,0.33959199243313637,0.17203916672398045,4.546611078353703,0.7760609974958406,1000,,COMPLETE
5,0.01940656342926972,2026-06-24 23:43:04.841880,2026-06-24 23:43:14.852553,0 days 00:00:10.010673,0.9757995766256756,0.9579309401710595,lossguide,0.025719142025384646,8.0,4.0,37.0,3.8589082671053854,2.989540104057545,4.609378987692081,0.9100531293444458,797,,COMPLETE
6,0.018358943301673536,2026-06-24 23:43:14.861708,2026-06-24 23:43:28.773764,0 days 00:00:13.912056,0.7123738038749523,0.8170784332632994,lossguide,0.016019568611465234,56.0,5.0,20.0,1.1627201204016835,0.7047070324513158,4.011004684072123,0.7427013306774357,1000,,COMPLETE
7,0.02607344960735536,2026-06-24 23:43:28.786834,2026-06-24 23:43:37.303756,0 days 00:00:08.516922,0.9085081386743783,0.6296178606936361,depthwise,0.0050834018700114374,18.0,9.0,10.0,0.4117599592262879,1.7923927961485087,0.5794337107196961,0.8916028672163949,1000,,COMPLETE
8,0.018595886066080647,2026-06-24 23:43:37.313030,2026-06-24 23:43:48.979818,0 days 00:00:11.666788,0.9548850970305306,0.7888859700647797,depthwise,0.012693089228250284,55.0,5.0,85.0,0.49979438035802604,0.5980592702669147,3.566252611636253,0.8550229885420852,1000,,COMPLETE
9,0.01845268257572985,2026-06-24 23:43:48.989305,2026-06-24 23:44:00.190615,0 days 00:00:11.201310,0.6125716742746937,0.8545641645055122,depthwise,0.02393652463662192,22.0,6.0,308.0,0.0012417226051008223,1.5718484697835258,2.542902598754398,0.6431565707973218,763,,COMPLETE
10,0.01940625782757155,2026-06-24 23:44:00.199575,2026-06-24 23:44:05.077916,0 days 00:00:04.878341,0.7785521584210519,0.9630659181130071,lossguide,0.08651476814006658,40.0,7.0,9.0,0.038946887834449,4.7988577526525065,2.5700768651765165,0.9729161367647149,381,,COMPLETE
11,0.018561489457516567,2026-06-24 23:44:05.086681,2026-06-24 23:44:10.586532,0 days 00:00:05.499851,0.6046474205309514,0.8759561693398767,depthwise,0.031790458723690476,38.0,6.0,223.0,0.0018160396567158895,1.5647918198189947,2.792536267064169,0.6093306837234106,313,,COMPLETE
12,0.0195203098652319,2026-06-24 23:44:10.595247,2026-06-24 23:44:21.741885,0 days 00:00:11.146638,0.710512823560304,0.8714730259516918,depthwise,0.0080760183343821,27.0,6.0,23.0,0.03278569915353425,1.1447121834575418,2.2827711289191495,0.7162383266715567,1000,,COMPLETE
13,0.018854372983759804,2026-06-24 23:44:21.751314,2026-06-24 23:44:29.089823,0 days 00:00:07.338509,0.602905407024933,0.7392145332841654,depthwise,0.03663053703759853,76.0,5.0,953.0,4.7698893186599465,2.6416112215424157,3.598386535184403,0.6052561262871233,674,,COMPLETE
14,0.01895938136642794,2026-06-24 23:44:29.100517,2026-06-24 23:44:36.589440,0 days 00:00:07.488923,0.7553082698269054,0.8924556479724395,lossguide,0.046050307808350566,32.0,5.0,211.0,0.04151639024555891,1.0233714058752723,3.4686268776231093,0.7151637197860257,351,,COMPLETE
15,0.01873489961244068,2026-06-24 23:44:36.598536,2026-06-24 23:44:51.685533,0 days 00:00:15.086997,0.6732132011401761,0.7238803118866866,lossguide,0.02041336969076048,61.0,6.0,18.0,0.0010553030135126333,3.634851062465046,1.7887936792349817,0.673411567800972,1000,,COMPLETE
16,0.018666537328044575,2026-06-24 23:44:51.694634,2026-06-24 23:45:11.454277,0 days 00:00:19.759643,0.814548203372507,0.8358149799574793,depthwise,0.008757736843423953,23.0,7.0,398.0,0.0994936305984191,1.0230393593771117,3.061804427880384,0.7281358941031667,1000,,COMPLETE
17,0.0187317923501491,2026-06-24 23:45:11.463760,2026-06-24 23:45:19.830196,0 days 00:00:08.366436,0.7093607961740002,0.9213719483072954,depthwise,0.022458493613952326,47.0,5.0,88.0,1.5163419815224977,2.1465699544802543,4.956386852998385,0.6657586950439942,672,,COMPLETE
18,0.0188388579338159,2026-06-24 23:45:19.838766,2026-06-24 23:45:45.809179,0 days 00:00:25.970413,0.6442476723588992,0.7410688709770463,lossguide,0.008309993054108322,11.0,7.0,43.0,0.007617989795689297,1.58502719839835,4.028068314555426,0.7682811498740003,1000,,COMPLETE
19,0.018610560512075436,2026-06-24 23:45:45.818366,2026-06-24 23:45:51.193944,0 days 00:00:05.375578,0.880115133299918,0.8301316476489174,depthwise,0.05099942140746045,12.0,6.0,162.0,0.11159073012194594,0.5641564986107453,0.08689028168849333,0.644268499723459,268,,COMPLETE
20,0.01921064490295432,2026-06-24 23:45:51.202574,2026-06-24 23:46:04.746019,0 days 00:00:13.543445,0.7580871998105609,0.9989879313923895,lossguide,0.015498248753395916,99.0,5.0,16.0,0.013780931175028552,4.067105946049195,1.9348802336542157,0.7486721528730329,1000,,COMPLETE
21,0.0180965256863882,2026-06-24 23:46:04.754360,2026-06-24 23:46:12.138089,0 days 00:00:07.383729,0.6095231446799584,0.8597114355897656,depthwise,0.029431033550187252,35.0,6.0,436.0,0.0010475955126772259,1.5345741222664129,2.834499161679293,0.6030845766616914,441,,COMPLETE
22,0.018476330285314813,2026-06-24 23:46:12.150669,2026-06-24 23:46:19.193070,0 days 00:00:07.042401,0.6253623982813898,0.8561103730457948,depthwise,0.030640243493009332,23.0,6.0,476.0,0.002234518373347648,1.2417078007319526,3.191107421190153,0.6338688587149294,421,,COMPLETE
23,0.018731229878082623,2026-06-24 23:46:19.202002,2026-06-24 23:46:28.919280,0 days 00:00:09.717278,0.686835158553594,0.7709053273401145,depthwise,0.03929525271725099,33.0,7.0,671.0,0.0010022349549338744,2.3086394191556807,3.967494357753847,0.6835229863440575,544,,COMPLETE
24,0.018459739421125887,2026-06-24 23:46:28.928683,2026-06-24 23:46:38.092190,0 days 00:00:09.163507,0.6356641682598433,0.9110088144137071,depthwise,0.024635027092398346,65.0,5.0,154.0,0.0027649917878421063,0.7350293544921975,2.4860344125616427,0.6001328384488102,751,,COMPLETE
25,0.018698576284501778,2026-06-24 23:46:38.101968,2026-06-24 23:46:54.674155,0 days 00:00:16.572187,0.6854589053580308,0.837690511825926,depthwise,0.0168730139133158,51.0,8.0,285.0,0.012207379674667035,1.694885632311633,2.1218639503839496,0.6321727714310739,762,,COMPLETE
